cluster_id,cluster_type,role,sector,section_header,policy_statement,parent_statement,parent_row_type,verbatim_text,extraction_rationale
1,parent_with_subs,parent,Buildings,NEW 2030 CLIMATE EQUITY GOALS FOR AUSTIN — Sustainable Buildings,Achieve net-zero carbon for all new buildings and reduce emissions by 25% for existing buildings while lowering all natural gas-related emissions by 30% by 2030.,,standalone parent policy,"## Sustainable Buildings

- Achieve net-zero carbon for all new buildings and reduce emissions by 25% for existing buildings while lowering all natural gas-related emissions by 30%.",Quantified 2030 building-sector targets; followed by multiple numbered strategies in the Sustainable Buildings section.
1,parent_with_subs,sub,Buildings,SUSTAINABLE BUILDINGS — Goal: Net-zero carbon new buildings; 25% existing; 30% gas emissions reduction,Ensure benefits of building decarbonization programs flow to low-income communities and communities of color through comprehensive energy poverty mitigation and partnerships.,Achieve net-zero carbon for all new buildings and reduce emissions by 25% for existing buildings while lowering all natural gas-related emissions by 30% by 2030.,standalone parent policy,"## Strategy 1: Ensure benefits flow to low-income communities and communities of color

Pursue a comprehensive energy poverty mitigation strategy by partnering with trusted community organizations, affordable housing developers, and schools in equitable outreach and program development.",Specific intervention (energy poverty mitigation strategy and partnerships) tied to the buildings goal.
1,parent_with_subs,sub,Buildings,SUSTAINABLE BUILDINGS — Goal: Net-zero carbon new buildings; 25% existing; 30% gas emissions reduction,"Enhance resident and building owner understanding of energy consumption via outreach, culturally relevant communications, expanded benchmarking for existing buildings, and better access to energy and water data.",Achieve net-zero carbon for all new buildings and reduce emissions by 25% for existing buildings while lowering all natural gas-related emissions by 30% by 2030.,standalone parent policy,"## Strategy 2: Enhance understanding of energy consumption

Enhance resident and building owner understanding of energy savings opportunities, benefits, and climate impacts of energy consumption. This will be done through direct outreach, culturally relevant communications, expanding benchmarking requirements for all existing buildings, and better access to energy and water data.",Concrete programmatic actions (benchmarking expansion; data access; outreach).
1,parent_with_subs,sub,Buildings,SUSTAINABLE BUILDINGS — Goal: Net-zero carbon new buildings; 25% existing; 30% gas emissions reduction,"Achieve net-zero carbon building milestones through new building energy codes/amendments and incentives/education for existing building decarbonization, in collaboration with utilities and with equity focus.",Achieve net-zero carbon for all new buildings and reduce emissions by 25% for existing buildings while lowering all natural gas-related emissions by 30% by 2030.,standalone parent policy,"## Strategy 3: Achieve energy-efficient, net-zero carbon buildings

Achieve goal milestones for net-zero carbon buildings through new building energy codes, amendments, and other methods. Engage owners and operators of existing buildings to decarbonize through incentives and education for contractors and occupants. Collaborate with local utilities to implement equitable emission reduction strategies.","Specific policy mechanisms (codes, amendments, incentives, education, utility collaboration)."
1,parent_with_subs,sub,Buildings,SUSTAINABLE BUILDINGS — Goal: Net-zero carbon new buildings; 25% existing; 30% gas emissions reduction,Create equitable workforce development and training opportunities for emerging building-related technologies by partnering with local unions and education/advocacy organizations serving low-income communities and communities of color.,Achieve net-zero carbon for all new buildings and reduce emissions by 25% for existing buildings while lowering all natural gas-related emissions by 30% by 2030.,standalone parent policy,"## Strategy 4: Ensure equitable workforce development for emerging technologies

Prioritize investment in local emissions reduction and create equitable workforce development and training opportunities for emerging technologies by partnering with local unions, education, and advocacy organizations that serve low-income communities and communities of color.",Defines a workforce development intervention with specified partners and equity focus.
2,parent_with_subs,parent,Buildings,SUSTAINABLE BUILDINGS — Refrigerants,Reduce community-wide greenhouse gas emissions from refrigerant leakage by 25% by 2030.,,standalone parent policy,"By 2030, reduce community-wide greenhouse gas emissions from refrigerant leakage by 25%.",Quantified emissions-reduction target with a deadline; followed by a list of strategies.
2,parent_with_subs,sub,Buildings,SUSTAINABLE BUILDINGS — Goal: Reduce refrigerant leakage emissions 25%,Develop a refrigerant destruction program that places a price on older high ozone-depleting and high-GWP refrigerants to increase capture and safe destruction.,Reduce community-wide greenhouse gas emissions from refrigerant leakage by 25% by 2030.,standalone parent policy,"## Strategy 1: Capture and destroy old refrigerants

Develop a refrigerant destruction program that places a price on older high ozone-depleting substances and global warming potential (GWP) refrigerants.",Specific program intervention (destruction program with pricing mechanism).
2,parent_with_subs,sub,Buildings,SUSTAINABLE BUILDINGS — Goal: Reduce refrigerant leakage emissions 25%,Move forward with building code amendments and other local actions to allow/encourage low and no-GWP refrigerants as soon as feasible.,Reduce community-wide greenhouse gas emissions from refrigerant leakage by 25% by 2030.,standalone parent policy,"## Strategy 2: Improve building codes to encourage cleaner refrigerants

Closely follow developments in revised building codes that allow the use of low and no GWP refrigerants... and move forward with code amendments and other local action as soon as feasible.",Regulatory/code change commitment related to refrigerants.
2,parent_with_subs,sub,Buildings,SUSTAINABLE BUILDINGS — Goal: Reduce refrigerant leakage emissions 25%,"Create incentives for refrigerant leak detection, prevention, and repair in partnership with food retail, restaurants, warehouses, and HVAC companies, prioritizing outreach to small businesses owned by people of color.",Reduce community-wide greenhouse gas emissions from refrigerant leakage by 25% by 2030.,standalone parent policy,"## Strategy 3: Create incentives for leak detection and repair

Partner with grocery stores, convenience stores, restaurants... to create an incentive for designing and tracking refrigerant leak detection, prevention, and repair.",Concrete incentive-based policy with named partner sectors.
2,parent_with_subs,sub,Buildings,SUSTAINABLE BUILDINGS — Goal: Reduce refrigerant leakage emissions 25%,"Create an awareness, education, and training campaign for HVAC service providers and related stakeholders; lead by example with refrigerant leak detection/repair at City-owned facilities.",Reduce community-wide greenhouse gas emissions from refrigerant leakage by 25% by 2030.,standalone parent policy,"## Strategy 4: Awareness and training for HVAC service providers

Create an awareness, education, and training campaign... Lead by example by implementing a refrigerant leak detection, prevention, and repair program at City-owned facilities.",Specific campaign plus a City operational commitment (lead by example).
2,parent_with_subs,sub,Buildings,SUSTAINABLE BUILDINGS — Goal: Reduce refrigerant leakage emissions 25%,"Reduce the volume/use of refrigerants, particularly high-GWP refrigerants, by expanding and prioritizing codes and incentives favoring passive design, reduction, and efficiency.",Reduce community-wide greenhouse gas emissions from refrigerant leakage by 25% by 2030.,standalone parent policy,"## Strategy 5: Reduce the volume of refrigerants

Emphasize the link between design and refrigerant use by reducing and preventing the use of refrigerants... particularly those with high GWP.

How we'll get there:

- Ensure codes and incentives that favor passive design, reduction, and efficiency are expanded and prioritized.",Concrete policy direction to use codes/incentives to reduce refrigerant use.
3,parent_with_subs,parent,Buildings,SUSTAINABLE BUILDINGS — Embodied Carbon,Reduce the embodied carbon footprint of building materials used in local construction by 40% from a 2020 baseline by 2030 (with project embodied carbon not exceeding 500 kg CO2e/m2).,,standalone parent policy,"By 2030, reduce the embodied carbon footprint of building materials used in local construction by 40% from a 2020 baseline*.

*The embodied carbon associated with the construction and materials must not exceed 500 kg CO2e/m2 (~100 lbs. CO2e/sf) per project.",Quantified target plus specific performance threshold; followed by multiple strategies.
3,parent_with_subs,sub,Buildings,SUSTAINABLE BUILDINGS — Goal: Reduce embodied carbon 40%,"Develop City of Austin design and construction specifications and purchasing agreements to deliver healthy, low-carbon buildings, prioritizing community facilities serving low-income communities and communities of color first.",Reduce the embodied carbon footprint of building materials used in local construction by 40% from a 2020 baseline by 2030 (with project embodied carbon not exceeding 500 kg CO2e/m2).,standalone parent policy,"## Strategy 1: Lead by example through design and construction standards

In partnership with other cities and states, develop City of Austin design and construction specifications and purchasing agreements to result in healthy, low-carbon buildings.",Specific government procurement/standards action (lead by example).
3,parent_with_subs,sub,Buildings,SUSTAINABLE BUILDINGS — Goal: Reduce embodied carbon 40%,"Integrate lower-carbon building materials and deconstruction practices into City incentive programs (e.g., expedited permitting and Austin Energy Green Building) and transition voluntary guidance into planning/development agreements over time.",Reduce the embodied carbon footprint of building materials used in local construction by 40% from a 2020 baseline by 2030 (with project embodied carbon not exceeding 500 kg CO2e/m2).,standalone parent policy,"## Strategy 2: Incentivize lower-carbon materials

Enhance and integrate lower-carbon building materials and deconstruction practices into City incentive programs, like the expedited permitting process and Austin Energy's Green Building program, to transition voluntary design guidance into planning and development agreements over time.",Clear incentive/program modification commitment.
3,parent_with_subs,sub,Buildings,SUSTAINABLE BUILDINGS — Goal: Reduce embodied carbon 40%,"Create a performance framework and educational programming on low-carbon materials best practices for industry professionals and the public, focusing on low-income communities and communities of color.",Reduce the embodied carbon footprint of building materials used in local construction by 40% from a 2020 baseline by 2030 (with project embodied carbon not exceeding 500 kg CO2e/m2).,standalone parent policy,"## Strategy 3: Educate stakeholders on materials best practices

Create a performance framework and educational programming for industry professionals and the general public, focusing on low-income communities and communities of color, to reduce the lifecycle and negative health impacts of building materials and construction practices.",Specific education/programming intervention tied to embodied carbon and health impacts.
3,parent_with_subs,sub,Buildings,SUSTAINABLE BUILDINGS — Goal: Reduce embodied carbon 40%,"Prioritize partnerships within local materials markets to decarbonize high-impact building materials (e.g., glass, steel, aluminum, concrete, drywall, insulation, carpet).",Reduce the embodied carbon footprint of building materials used in local construction by 40% from a 2020 baseline by 2030 (with project embodied carbon not exceeding 500 kg CO2e/m2).,standalone parent policy,"## Strategy 4: Stimulate decarbonization with local producers installation

Prioritize partnerships within local materials markets to decarbonize high-impact materials, specifically glass, steel, aluminum, concrete, drywall, insulation, and carpet.",Specific intervention focusing on decarbonizing named material categories via partnerships.
4,parent_with_subs,parent,Water,SUSTAINABLE BUILDINGS — Water,"Equitably achieve a community-wide water demand of approximately 152,000 acre-feet per year by 2030 by implementing strategies in the Water Forward Plan.",,standalone parent policy,"By 2030, equitably achieve a community-wide water demand of approximately 152,000 acre-feet per year by implementing strategies in the Water Forward Plan.",Quantified water-demand target with timeframe and implementation basis; followed by strategies.
4,parent_with_subs,sub,Water,"SUSTAINABLE BUILDINGS — Goal: Water demand ~152,000 acre-feet/year","Enhance community engagement and partnerships to advance Water Forward equity strategies (e.g., My ATX Water, incentives, ordinances) and implement targeted outreach to improve participation.","Equitably achieve a community-wide water demand of approximately 152,000 acre-feet per year by 2030 by implementing strategies in the Water Forward Plan.",standalone parent policy,"## Strategy 1: Engage residents in water efficiency technological transitions, and conservation programs

Enhance community engagement strategies and create partnerships with community organizations to advance equity through Water Forward strategies, including My ATX Water (Advanced Metering Infrastructure), incentives, and ordinances.",Specific engagement and partnership actions to implement water conservation strategies with equity focus.
4,parent_with_subs,sub,Water,"SUSTAINABLE BUILDINGS — Goal: Water demand ~152,000 acre-feet/year",Evaluate water conservation and customer assistance program criteria to remove structural barriers and expand enrollment in the Customer Assistance Program and other low-income-serving programs.,"Equitably achieve a community-wide water demand of approximately 152,000 acre-feet per year by 2030 by implementing strategies in the Water Forward Plan.",standalone parent policy,"## Strategy 2: Evaluate water conservation, customer assistance, and workforce development program participation criteria

Evaluate program criteria to identify opportunities to address structural barriers that prevent program participation... explore strategies to expand enrollment in the Customer Assistance Program and increase participation in other programs serving low-income customers.",Concrete program evaluation and expansion commitment for equity in water assistance and conservation.
4,parent_with_subs,sub,Water,"SUSTAINABLE BUILDINGS — Goal: Water demand ~152,000 acre-feet/year","Assess and pursue water conservation and energy management optimization at the water-energy nexus, including evaluating Austin Water facility energy use and developing methods to quantify emissions reductions from water-demand reduction.","Equitably achieve a community-wide water demand of approximately 152,000 acre-feet per year by 2030 by implementing strategies in the Water Forward Plan.",standalone parent policy,"## Strategy 3: Reduce emissions at the water-energy nexus

Assess how water demand reduction is associated with energy consumption in residential and commercial buildings and Austin Water facilities. Identify and pursue synergistic water conservation and energy management optimization efforts through programs and partnerships.",Specific assessment and optimization actions linking water conservation to emissions reductions.
5,parent_with_subs,parent,Transport,TRANSPORTATION AND LAND USE,Locate 80% of new non-residential development within the city's Imagine Austin activity centers and corridors by 2030.,,standalone parent policy,"By 2030, 80% of new non-residential development is located within the city's Imagine Austin activity centers and corridors.",Quantified land-use development siting target with deadline; followed by multiple strategies.
5,parent_with_subs,sub,Transport,TRANSPORTATION AND LAND USE — Goal: 80% non-residential development in centers/corridors,"Adopt Complete Communities plans to reverse historical and racist impacts, address displacement, and preserve neighborhoods in communities of color.",Locate 80% of new non-residential development within the city's Imagine Austin activity centers and corridors by 2030.,standalone parent policy,"## Strategy 1: Plan for complete communities

Adopt Complete Communities plans that reverse historical and racist impacts on areas experiencing displacement and preserve neighborhoods in communities of color.",Specific planning instrument commitment (adopt plans) tied to equity and land use.
5,parent_with_subs,sub,Transport,TRANSPORTATION AND LAND USE — Goal: 80% non-residential development in centers/corridors,Work with medium and large employers to locate places of business in growth centers and along corridors.,Locate 80% of new non-residential development within the city's Imagine Austin activity centers and corridors by 2030.,standalone parent policy,"## Strategy 2: Work with employers on location and amenities

Work with medium and large employers to locate their places of business in growth centers and along corridors.",Explicit intervention to influence employer location decisions toward target areas.
5,parent_with_subs,sub,Transport,TRANSPORTATION AND LAND USE — Goal: 80% non-residential development in centers/corridors,"Create community mobility hubs, including park-and-ride facilities, adjacent to transit stops with first/last-mile options.",Locate 80% of new non-residential development within the city's Imagine Austin activity centers and corridors by 2030.,standalone parent policy,"## Strategy 3 : Create mobility hubs

Create community mobility hubs, including park-and-ride facilities, adjacent to transit stops to offer a complete trip experience. These hubs should offer various first- and last-mile mobility options.",Concrete infrastructure/program concept to improve multimodal access.
5,parent_with_subs,sub,Transport,TRANSPORTATION AND LAND USE — Goal: 80% non-residential development in centers/corridors,"Phase out free employee parking at City facilities and other large employers within 1/2 mile of the transit priority network, replacing it with cash-out, carpool/vanpool, transit passes, telework, or other commuter benefits.",Locate 80% of new non-residential development within the city's Imagine Austin activity centers and corridors by 2030.,standalone parent policy,"## Strategy 4: Phase out free parking

Phase out the practice of providing free parking spaces to employees at City of Austin facilities and other large employers located within 1/2 mile of the Austin Strategic Mobility Plan's transit priority network. Instead, offer a parking cash-out, carpool and vanpool options, flex schedules, transit passes, support for teleworking, or other commuter benefits programs.",Specific policy change with defined scope and alternative measures.
6,parent_with_subs,parent,Buildings,TRANSPORTATION AND LAND USE,"Preserve and produce 135,000 housing units (including 60,000 affordable units) by 2027, with 75% of new housing located within 1/2 mile of Imagine Austin activity centers and corridors.",,standalone parent policy,"By 2027, preserve and produce 135,000 housing units, including 60,000 affordable housing units*, with 75% of new housing located within ½ mile of Imagine Austin activity centers and corridors.",Quantified housing production/preservation target with timeframe and location share; followed by strategies.
6,parent_with_subs,sub,Buildings,"TRANSPORTATION AND LAND USE — Goal: 135,000 housing units by 2027",Engage communities vulnerable to displacement for immediate affordable housing assistance and proactively monitor at-risk affordable properties to extend affordability.,"Preserve and produce 135,000 housing units (including 60,000 affordable units) by 2027, with 75% of new housing located within 1/2 mile of Imagine Austin activity centers and corridors.",standalone parent policy,"## Strategy 1: Offer immediate affordable housing assistance

Engage directly with communities that are vulnerable to displacement and connect them with services. Proactively monitor affordable housing properties at risk of losing their affordability status to extend the period of affordability.",Direct programmatic commitment for anti-displacement and affordability preservation.
6,parent_with_subs,sub,Buildings,"TRANSPORTATION AND LAND USE — Goal: 135,000 housing units by 2027",Increase funding for the City's Housing Trust Fund and support capacity building for community development corporations.,"Preserve and produce 135,000 housing units (including 60,000 affordable units) by 2027, with 75% of new housing located within 1/2 mile of Imagine Austin activity centers and corridors.",standalone parent policy,"## Strategy 2: Fund affordable housing

Increase funding for the City's current Housing Trust Fund and support capacity building for community development corporations.",Resource allocation commitment (increase funding) and institutional capacity building.
6,parent_with_subs,sub,Buildings,"TRANSPORTATION AND LAND USE — Goal: 135,000 housing units by 2027","Include impacted low-income communities, communities of color, and people with disabilities in Housing Investment Review Committee activities and in creating anti-displacement programs, and enhance culturally relevant outreach for subsidized affordable units in gentrifying areas.","Preserve and produce 135,000 housing units (including 60,000 affordable units) by 2027, with 75% of new housing located within 1/2 mile of Imagine Austin activity centers and corridors.",standalone parent policy,"## Strategy 3: Enhance community engagement for affordable housing and antidisplacement programs

Include low-income communities, communities of color, and people with disabilities directly affected by systemic inequalities in the City's Housing Investment Review Committee activities and when creating anti-displacement programs.",Governance/participation mechanism commitment for equitable housing program design and outreach.
7,parent_with_subs,parent,Transport,TRANSPORTATION AND LAND USE,"Ensure 50% of trips in Austin are made by public transit, biking, walking, carpooling, or avoided by working from home by 2030.",,standalone parent policy,"By 2030, 50% of trips in Austin are made using public transit, biking, walking, carpooling, or avoided altogether by working from home*.",Quantified mode-shift target with deadline; followed by multiple strategies.
7,parent_with_subs,sub,Transport,TRANSPORTATION AND LAND USE — Goal: 50% mode shift by 2030,Work with the Austin Transit Partnership to implement Project Connect and expand and improve public transportation services.,"Ensure 50% of trips in Austin are made by public transit, biking, walking, carpooling, or avoided by working from home by 2030.",standalone parent policy,"## Strategy 1: Expand and improve public transportation

Work with the Austin Transit Partnership to implement Project Connect and expand and improve public transportation services.",Specific implementation commitment to deliver transit improvements through Project Connect.
7,parent_with_subs,sub,Transport,TRANSPORTATION AND LAND USE — Goal: 50% mode shift by 2030,"Create comprehensive, user-friendly resources connecting community members with free transportation options and expand free transit options to increase access for low-income communities, communities of color, and people with disabilities.","Ensure 50% of trips in Austin are made by public transit, biking, walking, carpooling, or avoided by working from home by 2030.",standalone parent policy,"## Strategy 2: Promote free transportation options

Create comprehensive, user-friendly resources connecting community members with free transportation options.

How we'll get there:

- Expand free transit options, including through Capital Metro, to provide increased transportation access for low-income communities, communities of color, and people with disabilities.",Concrete access policy (resources + expanding free transit).
7,parent_with_subs,sub,Transport,TRANSPORTATION AND LAND USE — Goal: 50% mode shift by 2030,Engage impacted communities to improve transit stops/stations and enforce ADA and accessibility guidelines around transit and public spaces.,"Ensure 50% of trips in Austin are made by public transit, biking, walking, carpooling, or avoided by working from home by 2030.",standalone parent policy,"## Strategy 3: Enhance transit stations and stops

Partner with Capital Metro, developers, and community organizers to engage low-income communities, communities of color, and people with disabilities to improve transit stops, stations, and access to these facilities.

How we'll get there:

- Enforce the Americans with Disabilities Act (ADA) and Public Rights-of-Way Accessibility Guidelines regulations...","Specific implementation and enforcement commitments for equitable, accessible transit facilities."
