cluster_id,cluster_type,role,sector,section_header,policy_statement,parent_statement,parent_row_type,verbatim_text,extraction_rationale
7,parent_with_subs,sub,Transport,TRANSPORTATION AND LAND USE — Goal: 50% mode shift by 2030,"Implement 2020 Proposition B bonds for transportation infrastructure (sidewalks, bikeways, trails, safety, safe routes to school, substandard streets) in low-income communities and communities of color through meaningful engagement.","Ensure 50% of trips in Austin are made by public transit, biking, walking, carpooling, or avoided by working from home by 2030.",standalone parent policy,"## Strategy 4: Prioritize bicycle networks

Implement the 2020 Proposition B voter-approved general obligation bonds for transportation infrastructure... in low-income communities and communities of color through a meaningful community engagement process.",Concrete infrastructure investment implementation tied to a named funding mechanism (Proposition B).
7,parent_with_subs,sub,Transport,TRANSPORTATION AND LAND USE — Goal: 50% mode shift by 2030,Provide access to free or reduced-price bicycles and bicycle training for communities of color and train police officers on bicycle laws and racial profiling to improve safety and comfort for riders of color.,"Ensure 50% of trips in Austin are made by public transit, biking, walking, carpooling, or avoided by working from home by 2030.",standalone parent policy,"## Strategy 5: Enhance bicycle education and training

Provide access to free or reduced-priced bicycles and basic bicycle training for communities of color and train police officers on bicycle laws and racial profiling to improve the comfort and safety of people of color riding bicycles.",Specific program/training interventions with equity and safety focus.
7,parent_with_subs,sub,Transport,TRANSPORTATION AND LAND USE — Goal: 50% mode shift by 2030,"Update the City's Sidewalk Plan and Urban Trails Plan emphasizing equity and meaningful community engagement, and build priority segments while addressing ADA barriers and gaps.","Ensure 50% of trips in Austin are made by public transit, biking, walking, carpooling, or avoided by working from home by 2030.",standalone parent policy,"## Strategy 6: Improve sidewalks, urban trails, and crossings

Update the City's Sidewalk Plan and Urban Trails Plan, emphasizing equity and meaningful community engagement.

How we'll get there:

- Build all high- and very-high-priority sidewalk and trail segments and address ADA barriers and gaps...",Concrete planning update and build-out commitments with accessibility requirements.
7,parent_with_subs,sub,Transport,TRANSPORTATION AND LAND USE — Goal: 50% mode shift by 2030,"Actively promote remote work, telework, and flexible commute policies, including a City telework policy encouraging at least 85% of eligible City employees to participate and supporting a goal of 15% residents working from home by 2039.","Ensure 50% of trips in Austin are made by public transit, biking, walking, carpooling, or avoided by working from home by 2030.",standalone parent policy,"## Strategy 7: Promote remote and flexible work policies

Actively promote remote work, telework, and flexible commute policies to maintain and encourage further reductions in single-occupancy vehicle trips.

How we'll get there:

- ...all new City of Austin telework and remote work policies contribute towards the goal of achieving 15% Austin residents working from home by 2039. This should include a strategy to implement a City of Austin telework policy encouraging no less than 85% of eligible City of Austin employees to participate in telework.",Specific policy approach with quantifiable participation targets/timeframe.
8,parent_with_subs,parent,Transport,TRANSPORTATION ELECTRIFICATION,"Electrify 40% of total vehicle miles traveled (VMT) in Austin by 2030 and ensure EV ownership is culturally, geographically, and economically diverse (about 460,000 EVs).",,standalone parent policy,"By 2030, 40% of total vehicle miles traveled in Austin are electrified, and electric vehicle ownership is culturally, geographically, and economically diverse. This translates to approximately 460,000 electric vehicles on the road.",Quantified electrification target with timeframe and scale estimate; followed by strategies.
8,parent_with_subs,sub,Transport,TRANSPORTATION ELECTRIFICATION — Goal: 40% VMT electrified by 2030,"Complete an Electric Vehicle Community Needs Assessment to inform an EV adoption growth plan, using community partners and hiring residents from the communities served.","Electrify 40% of total vehicle miles traveled (VMT) in Austin by 2030 and ensure EV ownership is culturally, geographically, and economically diverse (about 460,000 EVs).",standalone parent policy,"## Strategy 1: Conduct an EV Community Needs Assessment

Complete an Electric Vehicle Community Needs Assessment... The assessment will inform an EV adoption growth plan...",Specific planning/assessment commitment tied to equity and EV adoption.
8,parent_with_subs,sub,Transport,TRANSPORTATION ELECTRIFICATION — Goal: 40% VMT electrified by 2030,"Create inclusive and easily accessible incentives for buying or leasing EVs, prioritizing low-income communities and communities of color and areas with limited transit access.","Electrify 40% of total vehicle miles traveled (VMT) in Austin by 2030 and ensure EV ownership is culturally, geographically, and economically diverse (about 460,000 EVs).",standalone parent policy,"## Strategy 2: Create equitable incentives for buying and leasing EVs

Collaborate with community partners to create inclusive and easily accessible incentives for buying or leasing electric vehicles. This strategy would... prioritize low-income communities and communities of color...",Specific incentive program commitment with equity prioritization.
8,parent_with_subs,sub,Transport,TRANSPORTATION ELECTRIFICATION — Goal: 40% VMT electrified by 2030,Partner with mobility authorities to reduce or eliminate toll rates for low-income communities and communities of color who drive EVs on toll roads from the Eastern Crescent to central Austin.,"Electrify 40% of total vehicle miles traveled (VMT) in Austin by 2030 and ensure EV ownership is culturally, geographically, and economically diverse (about 460,000 EVs).",standalone parent policy,"## Strategy 3: Reduce tolls for EVs in the Eastern Crescent

Partner with highway and regional mobility authorities to offer a reduced or eliminated toll rate for low-income communities and communities of color who drive EVs on toll roads from the Eastern Crescent to central Austin.",Concrete pricing policy intervention targeted by geography and equity groups.
8,parent_with_subs,sub,Transport,TRANSPORTATION ELECTRIFICATION — Goal: 40% VMT electrified by 2030,"Create an electric bike and car-sharing program centered on low-income communities and communities of color, with income thresholds and actions to address displacement.","Electrify 40% of total vehicle miles traveled (VMT) in Austin by 2030 and ensure EV ownership is culturally, geographically, and economically diverse (about 460,000 EVs).",standalone parent policy,"## Strategy 4: Launch an e-bike and electric car-sharing program

Create an electric bike and car-sharing program centered on low-income communities and communities of color to support functional, low-cost, zero-emissions mobility.",Specific shared mobility program commitment with equity design features.
8,parent_with_subs,sub,Transport,TRANSPORTATION ELECTRIFICATION — Goal: 40% VMT electrified by 2030,"Encourage public sector fleets in the five-county MSA to commit to buying 100% electric vehicles when available, cost-competitive, and operationally suitable, leveraging purchasing collaboration and considering early retirement of older vehicles.","Electrify 40% of total vehicle miles traveled (VMT) in Austin by 2030 and ensure EV ownership is culturally, geographically, and economically diverse (about 460,000 EVs).",standalone parent policy,"## Strategy 5: Electrify public sector fleet vehicles

Encourage vehicle fleets from public sector agencies... to commit to buying 100% electric vehicles when they are available, cost-competitive, and meet operational needs.",Fleet procurement commitment framework with conditions and collaboration mechanism.
9,parent_with_subs,parent,Transport,TRANSPORTATION ELECTRIFICATION,"Provide an equitably distributed mix of Level 1, Level 2, and DC fast charging infrastructure sufficient to accommodate 40% of VMT by 2030 (potentially 37,000+ charging ports).",,standalone parent policy,"By 2030, Austin has a compelling and equitably distributed mix of level 1, 2, and DC fast charging infrastructure to accommodate 40% of total vehicle miles traveled in the city... could mean more than 37,000 charging ports.",Time-bound infrastructure scale target; followed by detailed strategies.
9,parent_with_subs,sub,Transport,TRANSPORTATION ELECTRIFICATION — Goal: Equitably distributed charging by 2030,"Incentivize installation of EV charging infrastructure by multiple actors and prioritize systematically excluded areas, including installing chargers on publicly owned land to fill gaps.","Provide an equitably distributed mix of Level 1, Level 2, and DC fast charging infrastructure sufficient to accommodate 40% of VMT by 2030 (potentially 37,000+ charging ports).",standalone parent policy,"## Strategy 1: Create a network with more low-cost, accessible charging stations

Continue to incentivize the installation of EV charging infrastructure by the City, businesses, auto manufacturers, and third-party charging companies...

- Prioritize areas that have been systematically excluded... 
- Fill in gaps by installing EV charging on publicly owned land in systematically excluded areas...",Concrete infrastructure incentive and siting commitments with equity prioritization.
9,parent_with_subs,sub,Transport,TRANSPORTATION ELECTRIFICATION — Goal: Equitably distributed charging by 2030,"Incentivize internet-connected smart charging to support grid reliability, efficiency, reduced emissions, accessibility, and lower costs by 2030.","Provide an equitably distributed mix of Level 1, Level 2, and DC fast charging infrastructure sufficient to accommodate 40% of VMT by 2030 (potentially 37,000+ charging ports).",standalone parent policy,"## Strategy 2: Incentivize internet-connected smart charging

By 2030, the City will have a network of intelligent charging... Incentivize internet-connected charging infrastructure with the ability to manage the start and end time and charge rate across 24 hours...",Specific technology/incentive commitment with deadline (by 2030).
9,parent_with_subs,sub,Transport,TRANSPORTATION ELECTRIFICATION — Goal: Equitably distributed charging by 2030,"Adopt new energy and building codes to address future EV charging needs and lower barriers, including potentially requiring chargers at commercial and multifamily properties and EV-ready single-family homes.","Provide an equitably distributed mix of Level 1, Level 2, and DC fast charging infrastructure sufficient to accommodate 40% of VMT by 2030 (potentially 37,000+ charging ports).",standalone parent policy,"## Strategy 3: Adopt new energy and building codes

Adopt new energy and building codes that address future EV charging needs...

How we'll get there:

- Consider... requiring EV chargers at commercial and multifamily properties, and requiring single-family homes to be EV charger-ready.",Explicit regulatory/code-based intervention for EV readiness and charger requirements.
9,parent_with_subs,sub,Transport,TRANSPORTATION ELECTRIFICATION — Goal: Equitably distributed charging by 2030,Expand culturally competent outreach to systematically excluded groups and stakeholders about EV charging incentives and installation.,"Provide an equitably distributed mix of Level 1, Level 2, and DC fast charging infrastructure sufficient to accommodate 40% of VMT by 2030 (potentially 37,000+ charging ports).",standalone parent policy,"## Strategy 4: Expand outreach to systematically excluded groups

Expand outreach to community groups, professional organizations, unions, and property managers using culturally competent information about EV charging incentives and installation.",Specific outreach/communications strategy to increase equitable uptake.
11,parent_with_subs,parent,AFOLU,FOOD AND PRODUCT CONSUMPTION,"Ensure all Austinites can access a community-driven food system that addresses food insecurity, prioritizes regenerative agriculture, supports dietary/health agency, promotes plant-based foods, and minimizes food waste by 2030.",,standalone parent policy,"By 2030, ensure all Austinites can access a food system that is community-driven, addresses food insecurity, prioritizes regenerative agriculture, supports dietary and health agency, promotes plant-based foods, and minimizes food waste.",Time-bound system goal with specific features; followed by strategies.
11,parent_with_subs,sub,AFOLU,FOOD AND PRODUCT CONSUMPTION — Goal: Equitable food system access,"Apply a purchasing framework and build a regional food system network to increase institutional and corporate procurement of pro-climate, pro-health food options.","Ensure all Austinites can access a community-driven food system that addresses food insecurity, prioritizes regenerative agriculture, supports dietary/health agency, promotes plant-based foods, and minimizes food waste by 2030.",standalone parent policy,"## Strategy 1: Support institutional food purchasing

Apply a purchasing framework, support supply-chain infrastructure, and build a regional food system network to bolster institutional and corporate food procurement of proclimate, pro-health options.",Specific institutional procurement and network-building intervention.
11,parent_with_subs,sub,AFOLU,FOOD AND PRODUCT CONSUMPTION — Goal: Equitable food system access,"Implement community-driven programs to incentivize and promote affordable, culturally relevant pro-climate, pro-health food choices in prepared and retail options, focusing on minimizing displacement.","Ensure all Austinites can access a community-driven food system that addresses food insecurity, prioritizes regenerative agriculture, supports dietary/health agency, promotes plant-based foods, and minimizes food waste by 2030.",standalone parent policy,"## Strategy 2: Promote and fund community-driven food retail programs

Implement community-driven programs to incentivize and promote more affordable and culturally relevant pro-climate, pro-health choices in prepared and retail food options, focusing on minimizing displacement.",Concrete program commitment targeting retail/prepared food with equity and displacement lens.
11,parent_with_subs,sub,AFOLU,FOOD AND PRODUCT CONSUMPTION — Goal: Equitable food system access,"Develop community-driven programs/tools (e.g., labeling, apps, education, incentives) to equitably make pro-climate, pro-health food choices affordable and culturally relevant.","Ensure all Austinites can access a community-driven food system that addresses food insecurity, prioritizes regenerative agriculture, supports dietary/health agency, promotes plant-based foods, and minimizes food waste by 2030.",standalone parent policy,"## Strategy 3: Incentivize pro-climate, prohealth food choices

Develop a variety of community-driven programs and tools to equitably engage and empower... to make affordable and culturally relevant pro-climate, prohealth food choices.",Specific commitment to develop tools and incentives to change food choices equitably.
11,parent_with_subs,sub,Waste,FOOD AND PRODUCT CONSUMPTION — Goal: Equitable food system access,"Conduct a food waste root cause analysis and implement changes to increase food waste reduction practices by 50%, covering single-family, multifamily, and commercial properties.","Ensure all Austinites can access a community-driven food system that addresses food insecurity, prioritizes regenerative agriculture, supports dietary/health agency, promotes plant-based foods, and minimizes food waste by 2030.",standalone parent policy,"## Strategy 4: Conduct a food waste root cause analysis

Conduct a food waste root cause analysis and implement changes informed by the analysis to increase food waste reduction practices by 50%. These practices should... include single-family, multi-family, and commercial properties.",Specific assessment plus quantified reduction action (50%).
12,parent_with_subs,parent,Industry,FOOD AND PRODUCT CONSUMPTION,"Reduce greenhouse gas emissions from institutional, commercial, and government purchasing by at least 50% by 2030.",,standalone parent policy,"By 2030, reduce greenhouse gas emissions from institutional, commercial, and government purchasing by at least 50%.",Quantified emissions-reduction target in purchasing with deadline; followed by strategies.
12,parent_with_subs,sub,Industry,FOOD AND PRODUCT CONSUMPTION — Goal: 50% purchasing emissions reduction,Develop a methodology to measure lifecycle GHG emissions and other impacts from non-residential purchasing and establish a baseline.,"Reduce greenhouse gas emissions from institutional, commercial, and government purchasing by at least 50% by 2030.",standalone parent policy,"## Strategy 1: Measure institutional lifecycle emissions

Develop a methodology to measure lifecycle greenhouse gas emissions and other environmental and social impacts from non-residential purchasing and identify a baseline for tracking progress.",Specific measurement/baseline-building commitment supporting the quantified target.
12,parent_with_subs,sub,Industry,FOOD AND PRODUCT CONSUMPTION — Goal: 50% purchasing emissions reduction,Strengthen the City of Austin's Sustainable Procurement Program and adopt/develop sustainability guidelines for high-impact products; educate vendors and staff and integrate procurement with sustainability initiatives.,"Reduce greenhouse gas emissions from institutional, commercial, and government purchasing by at least 50% by 2030.",standalone parent policy,"## Strategy 2: Strengthen the City's sustainable purchasing program

Strengthen the City of Austin's Sustainable Procurement Program to serve as a model for others locally and nationally.",Explicit commitment to strengthen a named City program (sustainable procurement).
12,parent_with_subs,sub,Industry,FOOD AND PRODUCT CONSUMPTION — Goal: 50% purchasing emissions reduction,"Recruit at least 50% of large local institutional purchasers (2,500+ employees) and at least 2,500 local organizations to adopt environmental and social sustainability procurement standards/guidelines, prioritizing historically underutilized and BIPOC-led/employing organizations.","Reduce greenhouse gas emissions from institutional, commercial, and government purchasing by at least 50% by 2030.",standalone parent policy,"## Strategy 3: Strengthen non-City institutional purchasing programs

Recruit at least 50% of local large institutional purchasers (2,500+ employees) and at least 2,500 local organizations of all sizes to collaboratively adopt a set of environmental and social sustainability procurement standards and/or guidelines.",Quantified recruitment targets and specified procurement standards adoption action.
12,parent_with_subs,sub,Waste,FOOD AND PRODUCT CONSUMPTION — Goal: 50% purchasing emissions reduction,"Expand the City's Circular Economy Program to reduce consumption, enable internal reuse/sharing, provide incubation spaces and assistance, and expand youth internships and related entrepreneurship programs.","Reduce greenhouse gas emissions from institutional, commercial, and government purchasing by at least 50% by 2030.",standalone parent policy,"## Strategy 4: Expand the City's Circular Economy Program

Expand the City of Austin's Circular Economy Program to:

- Support City departments in reducing consumption...
- Use available City-owned space and/or leverage partnerships to create rent-subsidized incubation spaces, grants, loans, and technical assistance for qualifying circular organizations.",Specific program expansion with multiple concrete actions and resource supports.
13,parent_with_subs,parent,Waste,FOOD AND PRODUCT CONSUMPTION,"Aggressively pursue waste reduction, organics composting, and recycling to achieve the waste reduction goals in the 2023 Austin Resource Recovery Comprehensive Plan.",,standalone parent policy,"Aggressively pursue waste reduction, organics composting, and recycling to achieve the waste reduction goals in the 2023 Austin Resource Recovery Comprehensive Plan*.",Explicit commitment referencing a named plan and actions; followed by multiple strategies.
13,parent_with_subs,sub,Waste,FOOD AND PRODUCT CONSUMPTION — Goal: Waste reduction/composting/recycling,"Implement consumer awareness and education campaigns to promote waste reduction, reuse, repair, and hierarchy-based waste management, targeting low-income communities, youth, and communities of color and delivering in many languages.","Aggressively pursue waste reduction, organics composting, and recycling to achieve the waste reduction goals in the 2023 Austin Resource Recovery Comprehensive Plan.",standalone parent policy,"## Strategy 1: Promote waste reduction and reuse

Implement consumer awareness campaigns... and educational campaigns that promote the community benefits of reuse and repair.",Specific campaign-based intervention with targeting guidance.
13,parent_with_subs,sub,Waste,FOOD AND PRODUCT CONSUMPTION — Goal: Waste reduction/composting/recycling,"Create equitably distributed Eco-hubs as neighborhood centers for borrowing, reuse, and repair services, prioritizing guidance from low-income communities and communities of color and co-locating with community centers.","Aggressively pursue waste reduction, organics composting, and recycling to achieve the waste reduction goals in the 2023 Austin Resource Recovery Comprehensive Plan.",standalone parent policy,"## Strategy 2: Create Eco-hubs

Create 'Eco-hubs' that provide equitably distributed in-person neighborhood centers for borrowing, reuse, and repair services.",Concrete new facility/service model commitment with equity distribution.
13,parent_with_subs,sub,Waste,FOOD AND PRODUCT CONSUMPTION — Goal: Waste reduction/composting/recycling,"Offer a workforce development program for the circular economy (repair/reuse skills, job placement, entrepreneurship), prioritizing low-income communities, youth, and communities of color and publishing demographic participation data.","Aggressively pursue waste reduction, organics composting, and recycling to achieve the waste reduction goals in the 2023 Austin Resource Recovery Comprehensive Plan.",standalone parent policy,"## Strategy 3: Create a workforce development program for the circular economy

Offer a workforce development program that includes training for repair and reuse skills, job placement, and entrepreneurship in local circular businesses...",Specific workforce program commitment tied to circular economy goals.
13,parent_with_subs,sub,Waste,FOOD AND PRODUCT CONSUMPTION — Goal: Waste reduction/composting/recycling,"Offer financial incentives (e.g., point-of-sale rebates or sales tax holiday) to encourage consumers to choose lower-impact products, repair services, and rentals, developed with low-income communities and communities of color.","Aggressively pursue waste reduction, organics composting, and recycling to achieve the waste reduction goals in the 2023 Austin Resource Recovery Comprehensive Plan.",standalone parent policy,"## Strategy 4: Offer incentives for products that have lower negative environmental and social impact

Offer financial incentives, such as point-of-sale rebates or a sales tax holiday, to encourage consumers to choose products, repair services, and rentals with lower negative environmental and social impact...",Explicit financial incentive mechanisms are stated.
13,parent_with_subs,sub,Waste,FOOD AND PRODUCT CONSUMPTION — Goal: Waste reduction/composting/recycling,"Review and modify bulk item collection policies/programs so viable items are resold, repaired, or recycled, including exploring additional reuse opportunities and considering undocumented individuals in informal recycling.","Aggressively pursue waste reduction, organics composting, and recycling to achieve the waste reduction goals in the 2023 Austin Resource Recovery Comprehensive Plan.",standalone parent policy,"## Strategy 5: Retool the bulk pick-up collection program

Review and modify policies and programs for the collection of bulky items that result in viable items being resold, repaired, or recycled.",Specific policy/program reform commitment for waste diversion.
14,parent_with_subs,parent,AFOLU,NATURAL SYSTEMS,"Legally protect an additional 20,000 acres of carbon pools on natural lands and manage all new and existing natural areas (~70,000 acres total) for resilience by 2030.",,standalone parent policy,"By 2030, legally protect an additional 20,000 acres of carbon pools on natural lands and manage all new and existing natural areas (approximately 70,000 acres total), focusing on resilience.",Quantified land protection/management target with deadline; followed by strategies.
