cluster_id,cluster_type,role,sector,section_header,policy_statement,parent_statement,verbatim_text,extraction_rationale
,parent_with_subs,parent,Water,5.3.2 Adaptation Plans to enhance the resilience of the Water Resources,"Adaptation plan program: Improve the resilience of systems for the water sector, with an allocated budget of 6.2 million USD and identified responsible institutions.",,"| Improve the resilience of systems for the water sector |
...
“Budget         | 6.2 million USD”
“Responsibility | • Ministry of Electricity and Water • KISR. • Kuwait Environment Protection Authority (KEPA) • The General Secretariat of the Supreme Council for Planning and Development (SCPD) …”",Structured water-sector adaptation plan with multiple action items and a stated budget; appropriate as parent.
,parent_with_subs,sub,Water,5.3.2 Adaptation Plans to enhance the resilience of the Water Resources,Increase water block-tariff to control unnecessary water consumption (medium-term action).,"Adaptation plan program: Improve the resilience of systems for the water sector, with an allocated budget of 6.2 million USD and identified responsible institutions.",“Medium-term actions … ▪ Increase water block-tariff to control unnecessary water consumption.”,Concrete pricing policy instrument listed as an adaptation action.
,parent_with_subs,sub,Water,5.3.2 Adaptation Plans to enhance the resilience of the Water Resources,Utilize water conservation technologies (short-term action).,"Adaptation plan program: Improve the resilience of systems for the water sector, with an allocated budget of 6.2 million USD and identified responsible institutions.",“Short-term actions  ▪ … ▪ Utilize water conservation technologies.”,Specific technological intervention listed under short-term actions.
,parent_with_subs,sub,Water,5.3.2 Adaptation Plans to enhance the resilience of the Water Resources,Adopt efficient irrigation methods to reduce water losses (medium-term action).,"Adaptation plan program: Improve the resilience of systems for the water sector, with an allocated budget of 6.2 million USD and identified responsible institutions.",“Medium-term actions … ▪ Adapt efficient irrigation methods to reduce water losses.”,Specific adaptation measure for irrigation efficiency.
,parent_with_subs,sub,Water,5.3.2 Adaptation Plans to enhance the resilience of the Water Resources,Involve more environmentally sustainable methods of water treatment like reverse osmosis to lower net energy consumption (long-term action).,"Adaptation plan program: Improve the resilience of systems for the water sector, with an allocated budget of 6.2 million USD and identified responsible institutions.","“Long-term actions … ▪ Involve more environmentally sustainable methods of water treatment like Reverse osmosis, where the net energy consumption is lower than other methods.”",Specific technology shift proposed as long-term action.
,parent_with_subs,parent,Coastal,5.3.3 Adaptation Plans to enhance the resilience of the Coastal Zone,"Adaptation plan program: Enhance the resilience of coastal zones to face sea level rise (SLR) risks, with an allocated budget of 7.8 million USD and identified responsible institutions.",,"| Enhancing the resilience of coastal zones to face SLR risks |
...
“Budget                | 7.8 million USD”
“Responsibility        | • Kuwait Environment Protection Authority (KEPA) • The General Secretariat of the Supreme Council for Planning and Development (SCPD). • KISR …”",Structured coastal adaptation plan with multiple actions (short/medium/long-term) and a stated budget; serves as umbrella.
,parent_with_subs,sub,Coastal,5.3.3 Adaptation Plans to enhance the resilience of the Coastal Zone,Develop vulnerability and risk assessment reports for coastal zones (short-term action).,"Adaptation plan program: Enhance the resilience of coastal zones to face sea level rise (SLR) risks, with an allocated budget of 7.8 million USD and identified responsible institutions.",“Short-term actions  ▪ Develop vulnerability and risk assessment reports”,Concrete deliverable listed as a short-term action.
,parent_with_subs,sub,Coastal,5.3.3 Adaptation Plans to enhance the resilience of the Coastal Zone,Legislate laws to restrict negative anthropogenic activities in coastal zones to maintain coastal wildlife (medium-term action).,"Adaptation plan program: Enhance the resilience of coastal zones to face sea level rise (SLR) risks, with an allocated budget of 7.8 million USD and identified responsible institutions.",“Medium-term actions … ▪ Legislating laws to restrict negative anthropogenic activities in the coastal zones to maintain the coastal wildlife”,Legal/regulatory intervention explicitly stated.
,parent_with_subs,sub,Coastal,5.3.3 Adaptation Plans to enhance the resilience of the Coastal Zone,Protect coastlines from sea level rise by constructing protection barriers (long-term action).,"Adaptation plan program: Enhance the resilience of coastal zones to face sea level rise (SLR) risks, with an allocated budget of 7.8 million USD and identified responsible institutions.",“Long-term actions … ▪ Protect coastlines from SLR by constructing protection barriers.”,Specific infrastructure protection measure listed as long-term action.
,parent_with_subs,parent,Health,5.3.4 Adaptation Plans to enhance the resilience of the Human Health Sector,"Adaptation plan program: Enhance and build the capacity of the health sector to prepare for increased health risks due to climate change, with an allocated budget of 4.1 million USD and identified responsible institutions.",,"| Enhance and building the capacity of the health sector to be prepared for increased health risks due to climate change |
...
“Budget              | 4.1 million USD.”
“Responsibility      | Ministry of Health … KEPA. … Meteorological department - Civil Aviation”",Structured health-sector adaptation plan with multiple actions and a stated budget; serves as umbrella.
,parent_with_subs,sub,Health,5.3.4 Adaptation Plans to enhance the resilience of the Human Health Sector,"Adjust official working hours to avoid working during maximum daytime temperatures (short-term action, including studying and issuing a new threshold).","Adaptation plan program: Enhance and build the capacity of the health sector to prepare for increased health risks due to climate change, with an allocated budget of 4.1 million USD and identified responsible institutions.",“Short term actions … ▪ Adjust the official working hours to avoid working during maximum temperatures in the day (study and issue a new threshold).”,Specific occupational-heat adaptation action listed in the plan.
,parent_with_subs,sub,Health,5.3.4 Adaptation Plans to enhance the resilience of the Human Health Sector,Establish national health alerts for dust storms and heat waves (short-term action).,"Adaptation plan program: Enhance and build the capacity of the health sector to prepare for increased health risks due to climate change, with an allocated budget of 4.1 million USD and identified responsible institutions.",“Short term actions … ▪ Establishing national health alerts for dust storms and heat waves.”,Concrete early-warning/alert system commitment under short-term actions.
,parent_with_subs,sub,Health,5.3.4 Adaptation Plans to enhance the resilience of the Human Health Sector,Develop warning systems for extreme weather conditions combined with a communication strategy for alerts (medium-term action).,"Adaptation plan program: Enhance and build the capacity of the health sector to prepare for increased health risks due to climate change, with an allocated budget of 4.1 million USD and identified responsible institutions.",“Medium-term actions  ▪ Develop warning systems for extreme weather conditions combined with a communication strategy for alerts.”,Specific systems-based intervention with communication component.
23.0,individual,individual,Health,4.2 Projects and National Initiatives (Item 30),Ban outdoor work from 11:00 AM to 16:00 PM during June through August under a national law issued in 2005 (occupational heat protection).,,“the Ministry of Social Affairs and Labor of Kuwait issued a national law in 2005 to stop any outdoor work from 11:00 AM to 16:00 PM during the months of June through August.”,Binding mechanism (national law) with specific time restriction and period.
