cluster_id,cluster_type,role,sector,section_header,policy_statement,parent_statement,parent_row_type,verbatim_text,extraction_rationale,location,location_vulnerability_context,row_key,source_bundle_key,is_atomized_row,is_decomposed,canonical_mechanism,mechanism_description,typology_code,typology_confidence,typology_evidence_quote,secondary_categories,gate_demoted_reason,classification_schema_version,secondary_profile,climate_screen,is_financial_instrument,primary_category,primary_causal_pathway,causal_mechanism_detail,dominant_pathway_test,mechanism_classification_reasoning,mechanism_confidence,mechanism_edge_case_notes,instrument_type,instrument_directness,climate_relevance,key_indicators,co_benefits,instance_edge_case_notes,language_violations,primary_gate_passed,primary_gate_reason,secondary_gate_passed,secondary_gate_reason,parent_policy_name,rescue_disposition,rescue_reasoning,rescue_confidence,primary_gate_rescued,dropped_by_climate_rescue
3,parent_with_subs,sub,transport,Measure T5: Limit and Remove Parking Minimums.,"Measure T5 will limit and remove parking minimums through parking supply reductions, unbundling parking costs, and implementing parking pricing to encourage park-once behavior.","Strategy 3 will reduce single-occupancy vehicle trips by developing transportation networks that increase the accessibility, comfort, and convenience of active travel modes.",standalone parent policy,"## Measure T5: Limit and Remove Parking Minimums.

The performance objectives for Measure T5 are to: (1) reduce parking stipulations to reduce parking supply and encourage transit use; (2) unbundle parking costs to reflect the cost of parking; and (3) implement parking pricing to encourage 'park-once' behavior.",Specific intervention set (parking reforms) framed as performance objectives; listed under Strategy 3.,Los_Angeles_California_United_States,No vulnerability context provided,Los_Angeles_California_United_States::f338922888a39b3ccd3f75a6,Los_Angeles_California_United_States::f338922888a39b3ccd3f75a6,False,False,parking_supply_pricing_reform → transport_emissions_reduction,"The measure reduces parking supply, unbundles parking costs, and implements parking pricing to encourage transit use and park-once behavior, which reduces driving and related transport emissions.",None,0.0,None,None,,guide_secondary_typology_v1,policy_text_evidence_gated,explicit_self,yes,Mitigation,"Parking policy reform → ↑ cost/↓ availability of parking → ↓ driving (↓ VMT, ↓ cruising) + mode shift → ↓ fuel combustion → ↓ GHG emissions","1) Change in human activity/system: Cities remove/limit parking minimums, reduce parking supply, unbundle parking from housing/retail costs, and/or price curb/garage parking to reflect demand.  
2) Mediating physical process: Higher monetary/time costs and reduced convenience of storing a private car decreases car ownership/use, reduces discretionary trips, and reduces cruising/idling while searching for parking; some trips shift to lower-carbon modes.  
3) Climate-relevant outcome: Lower vehicle fuel consumption leads to reduced tailpipe CO₂e emissions (and often reduced congestion-related emissions).","The single biggest climate-relevant effect is reducing VMT and idling/cruising, which lowers gasoline/diesel combustion and thus transport GHG emissions.","1) Dominant causal pathway: Parking supply/pricing reform changes travel behavior → reduces VMT/cruising → reduces fuel combustion → reduces GHG emissions.  
2) Why this primary over alternatives: Although reducing parking can improve space efficiency (Resource Efficiency) or enable land-use changes, the core mechanism described and shared across policies is behavior-driven reduction in driving emissions, which is direct Mitigation.  
3) Edge cases applied: If a specific policy’s main intent/effect is land redevelopment (e.g., housing infill) or streetscape cooling/flood resilience, those are co-benefits; however, they are not the dominant, necessary effect of “parking pricing/supply reform” as a mechanism.  
4) Applies to ALL instances sharing this mechanism: Any policy that reduces subsidized/abundant parking via pricing/unbundling/supply cuts aims to deter driving and therefore primarily mitigates by cutting transport emissions.  
5) Secondary subtype assignment deferred: Any further labeling (e.g., “pricing instrument,” “demand management,” “TOD/land-use synergy”) requires policy-specific evidence and is deferred to policy-level assessment.",0.9,"In some contexts, converting parking to housing or mixed-use could make land-use change the larger long-run mitigation driver; conversely, if pricing causes spillover cruising to adjacent areas without complementary management, near-term emission benefits may be reduced. These do not alter the primary classification for the canonical mechanism.",regulatory-mandate,direct,direct,“Limit and Remove Parking Minimums”; “reduce parking stipulations”; “reduce parking supply”; “unbundle parking costs”; “implement parking pricing”; “encourage transit use”; “park-once”,"Reduced congestion/cruising, improved local air quality, reduced noise, improved walkability/streetscape potential, housing affordability impacts via unbundling (potential)","Includes a clear pricing component (“implement parking pricing”) which could justify a secondary classification as a pricing-mechanism, but the headline action is removal/limitation of parking minimums (regulatory reform), so regulatory-mandate is selected as primary instrument type.",[],True,matched token: 'emission',True,no typology code,"Strategy 3 will reduce single-occupancy vehicle trips by developing transportation networks that increase the accessibility, comfort, and convenience of active travel modes.",,,,,
4,parent_with_subs,parent,transport,2.6.2.4 Strategy 4: Institutionalize Low-Carbon Transportation,"Strategy 4 will institutionalize low-carbon transportation by increasing access to charging infrastructure, installing EV charging stations, requiring new development to install EV charging, and developing incentives and requirements for existing buildings to install EV charging stations.",,standalone parent policy,"## 2.6.2.4 Strategy 4: Institutionalize Low-Carbon Transportation

The County also would endeavor to install EV charging stations (EVCSs) at County properties and in the public right-of-way, require new development to install EVCSs, and develop incentives and requirements for existing buildings to install EVCSs.",Named strategy with explicit interventions; umbrella for measures T6–T9.,Los_Angeles_California_United_States,No vulnerability context provided,Los_Angeles_California_United_States::82c129a5e08a5a0cf65a3dfd,Los_Angeles_California_United_States::82c129a5e08a5a0cf65a3dfd,False,False,ev_charging_infrastructure → ev_adoption_enabling,"The County would install EV charging stations at County properties and in the public right-of-way and require new development to install EV charging, enabling wider EV adoption.",None,0.0,None,None,,guide_secondary_typology_v1,policy_text_evidence_gated,explicit_self,no,Mitigation,Charging access expansion → ↑ EV adoption/EV miles → ↓ fossil fuel combustion in transport → ↓ GHG emissions → ↓ atmospheric forcing,"1) Human activity/system changed: The city deploys and/or enables a distributed network of EV chargers (Level 1/2/DC fast), improving access (including equity-focused siting) and reducing “range anxiety” and charging inconvenience.  
2) Mediating physical process: Improved charging availability increases EV purchase and utilization, displacing gasoline/diesel combustion; energy demand shifts from liquid fuels to electricity.  
3) Climate-relevant outcome: Net reduction in transport-sector GHG emissions (direct tailpipe CO₂ is avoided; upstream emissions depend on electricity generation and charging demand patterns).",The single biggest climate-relevant effect is reducing transportation GHG emissions by enabling substitution of internal-combustion vehicle miles traveled with electric vehicle miles.,"1) Dominant causal pathway: Expanding charging infrastructure primarily functions as an enabling measure for EV adoption and use, which reduces fossil fuel combustion in road transport and therefore reduces GHG emissions.  
2) Why this primary over alternatives: While equity, air quality, and grid-management co-benefits may be important, the principal climate-relevant lever shared by all such policies is emissions reduction via electrification of vehicles, i.e., mitigation rather than adaptation/resource efficiency/nature-based solutions.  
3) Edge cases applied: If electricity is high-carbon, near-term lifecycle benefits may be smaller, but the mechanism still targets transport decarbonization through electrification; any grid decarbonization interactions are secondary and not required for the mechanism to be mitigation-oriented.  
4) Confirm applies to ALL instances: Any policy whose core mechanism is “charging infrastructure → EV adoption enabling” aims to increase EV uptake/use; the consistent dominant climate effect is lower transport emissions from reduced liquid-fuel combustion.  
5) Secondary subtype deferred: Whether a given policy is more focused on public vs private charging, workplace charging, equity siting, managed charging/V2G, or complementary incentives is determined at the individual policy level and is not assigned here.",0.9,"If charging is deployed primarily for resilience/emergency power (e.g., V2G hubs) the dominant pathway could shift toward adaptation, but that is a different mechanism than general EV adoption enabling; rebound effects (more VMT due to lower operating costs) can partially offset reductions but typically do not change the primary mitigation classification.",infrastructure-investment,direct,direct,“install EV charging stations (EVCSs) at County properties”; “in the public right-of-way”; “require new development to install EVCSs”; “develop incentives and requirements for existing buildings to install EVCSs”; “Institutionalize Low-Carbon Transportation”,Improved local air quality and public health from reduced tailpipe pollution; potential transportation equity and access benefits depending on siting; reduced noise in some corridors.,"The statement bundles several instrument types (infrastructure investment + regulatory mandate for new development + incentive program/requirements for existing buildings). Classified to the most central/explicit action (public charger installation), but implementation likely spans multiple instruments.",[],True,matched token: 'carbon',True,no typology code,,,,,,
4,parent_with_subs,sub,transport,Measure T6: Increase ZEV Market Share and Reduce Gasoline and Diesel Fuel Sales.,"Measure T6 will increase zero-emission vehicle (ZEV) market share and EV charging stations, including targets for fleetwide ZEV penetration, ZEV sales shares, total new EV charging stations, and EV charging stations at County facilities by 2030/2035/2045.","Strategy 4 will institutionalize low-carbon transportation by increasing access to charging infrastructure, installing EV charging stations, requiring new development to install EV charging, and developing incentives and requirements for existing buildings to install EV charging stations.",standalone parent policy,"## Measure T6: Increase ZEV Market Share and Reduce Gasoline and Diesel Fuel Sales.

The performance objectives for Measure T6 are to: (1) increase the fleetwide percentage of light-duty vehicles in the unincorporated Los Angeles County that are ZEVs to 30 percent by 2030, 50 percent by 2035, and 90 percent by 2045; (2) increase the sales of new light-duty vehicles in the unincorporated Los Angeles County that are ZEVs to 68 percent by 2030 and 100 percent by 2035; (3) install 37,000 total new public and private shared EVCSs (including EVCSs at County facilities and properties) by 2030, 74,000 by 2035, and 140,000 by 2045; and (4) install 5,000 total new EVCSs at County facilities and properties by 2030, 10,000 by 2035, and 25,000 by 2045.",Multiple quantified targets with timelines; listed as a measure under Strategy 4.,Los_Angeles_California_United_States,No vulnerability context provided,Los_Angeles_California_United_States::aefa6077bd5dbbe9f4f53580,Los_Angeles_California_United_States::aefa6077bd5dbbe9f4f53580,False,False,ev_charging_infrastructure → ev_adoption_enabling,"The measure sets objectives to expand EV charging stations and increase ZEV fleet and sales shares, enabling wider EV adoption and reducing gasoline and diesel vehicle emissions.",None,0.0,None,None,evidence_quote not substring-grounded in source,guide_secondary_typology_v1,policy_text_evidence_gated,explicit_self,no,Mitigation,Charging access expansion → ↑ EV adoption/EV miles → ↓ fossil fuel combustion in transport → ↓ GHG emissions → ↓ atmospheric forcing,"1) Human activity/system changed: The city deploys and/or enables a distributed network of EV chargers (Level 1/2/DC fast), improving access (including equity-focused siting) and reducing “range anxiety” and charging inconvenience.  
2) Mediating physical process: Improved charging availability increases EV purchase and utilization, displacing gasoline/diesel combustion; energy demand shifts from liquid fuels to electricity.  
3) Climate-relevant outcome: Net reduction in transport-sector GHG emissions (direct tailpipe CO₂ is avoided; upstream emissions depend on electricity generation and charging demand patterns).",The single biggest climate-relevant effect is reducing transportation GHG emissions by enabling substitution of internal-combustion vehicle miles traveled with electric vehicle miles.,"1) Dominant causal pathway: Expanding charging infrastructure primarily functions as an enabling measure for EV adoption and use, which reduces fossil fuel combustion in road transport and therefore reduces GHG emissions.  
2) Why this primary over alternatives: While equity, air quality, and grid-management co-benefits may be important, the principal climate-relevant lever shared by all such policies is emissions reduction via electrification of vehicles, i.e., mitigation rather than adaptation/resource efficiency/nature-based solutions.  
3) Edge cases applied: If electricity is high-carbon, near-term lifecycle benefits may be smaller, but the mechanism still targets transport decarbonization through electrification; any grid decarbonization interactions are secondary and not required for the mechanism to be mitigation-oriented.  
4) Confirm applies to ALL instances: Any policy whose core mechanism is “charging infrastructure → EV adoption enabling” aims to increase EV uptake/use; the consistent dominant climate effect is lower transport emissions from reduced liquid-fuel combustion.  
5) Secondary subtype deferred: Whether a given policy is more focused on public vs private charging, workplace charging, equity siting, managed charging/V2G, or complementary incentives is determined at the individual policy level and is not assigned here.",0.9,"If charging is deployed primarily for resilience/emergency power (e.g., V2G hubs) the dominant pathway could shift toward adaptation, but that is a different mechanism than general EV adoption enabling; rebound effects (more VMT due to lower operating costs) can partially offset reductions but typically do not change the primary mitigation classification.",target-setting,enabling,direct,"“performance objectives”; “increase… percentage… that are ZEVs to 30 percent by 2030, 50 percent by 2035, and 90 percent by 2045”; “increase the sales… that are ZEVs to 68 percent by 2030 and 100 percent by 2035”; “install 37,000 total new… EVCSs… by 2030, 74,000 by 2035, and 140,000 by 2045”; “install 5,000… EVCSs at County facilities… by 2030… 2035… 2045”",Air quality/health improvements from reduced NOx/PM; reduced fuel expenditures/greater energy security; noise reduction,"Although charger deployment at County facilities implies eventual infrastructure investment/procurement, the excerpt is framed primarily as quantified objectives/targets (not the funding mechanism or a mandate), so classified as target-setting.",[],True,matched token: 'emission',True,no typology code,"Strategy 4 will institutionalize low-carbon transportation by increasing access to charging infrastructure, installing EV charging stations, requiring new development to install EV charging, and developing incentives and requirements for existing buildings to install EV charging stations.",,,,,
4,parent_with_subs,sub,transport,Measure T7: Electrify County Fleet Vehicles.,"Measure T7 will electrify County fleet vehicles by electrifying bus and shuttle fleets by 2035, increasing County-owned light-duty ZEV shares by 2030/2035/2045, and supporting the state's goal that new light-duty fleet purchases (with exceptions) will be ZEVs.","Strategy 4 will institutionalize low-carbon transportation by increasing access to charging infrastructure, installing EV charging stations, requiring new development to install EV charging, and developing incentives and requirements for existing buildings to install EV charging stations.",standalone parent policy,"## Measure T7: Electrify County Fleet Vehicles.

The performance objectives for Measure T7 are to: (1) electrify the County bus and shuttle fleets by 2035; (2) increase the fleetwide percentage of light-duty vehicles in the Countyowned fleet that are ZEVs to 35 percent by 2030, 60 percent by 2035, and 100 percent by 2045; and (3) support the state's goal that all new light-duty vehicle fleet purchases, with certain exceptions, will be ZEVs.",Concrete electrification commitments and quantified targets; under Strategy 4.,Los_Angeles_California_United_States,No vulnerability context provided,Los_Angeles_California_United_States::d75345da3a9816406f3de6f3,Los_Angeles_California_United_States::d75345da3a9816406f3de6f3,False,False,fleet_electrification → transport_emissions_reduction,"The County plans to electrify its bus, shuttle, and light-duty fleets by increasing the share of zero-emission vehicles, reducing tailpipe transportation emissions.",None,0.0,None,None,evidence_quote not substring-grounded in source,guide_secondary_typology_v1,policy_text_evidence_gated,explicit_self,no,Mitigation,Transport activity (VMT) shift: ICE → EV → ↓ fossil fuel combustion (tailpipe) + potentially ↓ lifecycle CO₂e → ↓ GHG emissions → ↓ atmospheric forcing,"1) Changed activity/system: The vehicle fleet and miles traveled shift from internal combustion engine (ICE) cars/buses/trucks to battery-electric (and sometimes plug-in hybrid) vehicles, including public fleets and private ownership.  
2) Mediating process: EV drivetrains eliminate tailpipe CO₂ from gasoline/diesel combustion and can reduce total energy per mile; remaining emissions depend on electricity generation and upstream fuel/vehicle lifecycle.  
3) Climate-relevant outcome: Lower CO₂e emissions per mile and reduced total transport-sector emissions, especially as the electricity grid decarbonizes.","Replacing internal-combustion vehicle miles with electric vehicle miles most strongly reduces GHG emissions from fuel combustion (and, depending on grid mix, upstream energy supply), lowering net transportation-sector emissions.","1) Dominant causal pathway: Substitution of ICE travel with EV travel reduces fossil fuel combustion and associated CO₂e emissions—this is a direct mitigation pathway.  
2) Why this primary over alternatives: Although EVs can improve energy efficiency (a resource-efficiency co-benefit) and reduce air pollution/health burdens, the principal climate-relevant effect is emissions reduction rather than hazard reduction (adaptation) or ecosystem carbon/heat services (nature-based).  
3) Edge cases applied: If a policy focused only on electrification for resilience (e.g., backup power for emergency response fleets) without an emissions objective, classification might differ; however, the canonical mechanism explicitly links fleet electrification to transport emissions reduction, keeping Mitigation dominant. Grid carbon intensity affects magnitude but not the direction of the primary pathway.  
4) Confirm applies to ALL instances sharing this mechanism: Any policy whose mechanism is “fleet electrification → transport emissions reduction” fundamentally operates by reducing CO₂e from combustion per mile and/or total combustion miles, which is mitigation.  
5) Secondary subtype assignment deferred: Any further subtype (e.g., public fleet vs private adoption; infrastructure vs mandates; equity-oriented design) requires policy-specific evidence and is not assigned at the mechanism level.",0.93,"If implemented mainly via promoting hybrids (non-plug-in) or if electricity is extremely high-carbon, net GHG benefits can be smaller; nonetheless the mechanism’s dominant intent/effect remains mitigation through reduced combustion-related emissions. If a policy bundles electrification with VMT growth, rebound could partially offset reductions—this affects impact size, not primary category.",target-setting,direct,direct,"“performance objectives”; “electrify the County bus and shuttle fleets by 2035”; “increase…percentage…that are ZEVs to 35 percent by 2030, 60 percent by 2035, and 100 percent by 2045”; “support the state's goal that all new light-duty vehicle fleet purchases…will be ZEVs”",Improved local air quality (NOx/PM) and potential public health benefits; reduced noise; potential fuel/maintenance cost savings,"Could also be interpreted as a procurement requirement/mandate because it concerns fleet purchases, but the text is framed as “performance objectives” with percentage milestones rather than a binding purchasing rule; classified as target-setting accordingly.",[],True,matched token: 'emission',True,no typology code,"Strategy 4 will institutionalize low-carbon transportation by increasing access to charging infrastructure, installing EV charging stations, requiring new development to install EV charging, and developing incentives and requirements for existing buildings to install EV charging stations.",,,,,
