cluster_id,cluster_type,role,sector,section_header,policy_statement,parent_statement,parent_row_type,verbatim_text,extraction_rationale,location,location_vulnerability_context,row_key,source_bundle_key,is_atomized_row,is_decomposed,canonical_mechanism,mechanism_description,typology_code,typology_confidence,typology_evidence_quote,secondary_categories,gate_demoted_reason,classification_schema_version,secondary_profile,climate_screen,is_financial_instrument,primary_category,primary_causal_pathway,causal_mechanism_detail,dominant_pathway_test,mechanism_classification_reasoning,mechanism_confidence,mechanism_edge_case_notes,instrument_type,instrument_directness,climate_relevance,key_indicators,co_benefits,instance_edge_case_notes,language_violations,primary_gate_passed,primary_gate_reason,secondary_gate_passed,secondary_gate_reason,parent_policy_name,rescue_disposition,rescue_reasoning,rescue_confidence,primary_gate_rescued,dropped_by_climate_rescue
0,parent_with_subs,sub,governance,TABLE ES-1 (CONTINUED) SUMMARY OF DRAFT 2045 CAP MEASURES AND AFFECTED RESOURCE AREAS,Establish an Offsite GHG Reduction Program for new development to use as a GHG reduction/mitigation pathway for CAP compliance and to fund programs reducing GHG emissions in the built environment.,"Strategy 1: Decarbonize the Energy Supply through measures including a sunset strategy for oil and gas operations, procuring zero-carbon electricity, increasing renewable energy production, increasing energy resilience, and establishing GHG requirements for new development.",structural header,Action ES5.4 - Establish an Offsite GHG Reduction Program for new development to use as a GHG reduction or mitigation pathway for 2045 CAP compliance and to fund programs for reducing GHG emissions in the built environment.,Creates a defined program mechanism for mitigation/compliance and funding.,Los_Angeles_California_United_States,No vulnerability context provided,Los_Angeles_California_United_States::f9828b1ec6be5ce522f7003e,Los_Angeles_California_United_States::f9828b1ec6be5ce522f7003e,False,False,offsite_ghg_reduction_program → built_environment_emissions_reduction,Establishes an offsite GHG reduction program for new development that provides a mitigation pathway for CAP compliance and funds programs that reduce GHG emissions in the built environment.,None,0.0,None,None,,guide_secondary_typology_v1,policy_text_evidence_gated,explicit_self,yes,Mitigation,Policy mechanism (fees/credits/funding) → Offsite implementation of emissions-reduction projects → ↓ energy/fuel use or ↓ high-GWP refrigerant leakage → ↓ GHG emissions → ↓ atmospheric forcing,"1) Change in human activity/system: New development is set or enabled to comply with climate targets by paying into or using an offsite GHG reduction program (e.g., purchasing credits, paying an in-lieu fee, or directly funding eligible projects) rather than—or in addition to—onsite measures.  
2) Mediating physical process: Program-funded projects (commonly building energy retrofits, electrification, renewable energy procurement, efficiency upgrades, or refrigerant management) reduce fossil fuel combustion and/or reduce leakage of high-global-warming-potential gases, thereby lowering CO₂e.  
3) Climate-relevant outcome: Net reduction in community/built-environment GHG emissions relative to a baseline, helping meet CAP targets and lowering cumulative emissions.",The single biggest climate-relevant effect is reducing net GHG emissions by funding and/or procuring offsite emissions-reduction measures associated with new development.,"1) Dominant causal pathway: The mechanism’s primary intent and effect is to achieve quantified GHG reductions via offsite actions, leading to lower net emissions.  
2) Why this primary over alternatives: While the mechanism is implemented through governance/finance tools and can improve energy efficiency (a resource-efficiency co-benefit), the defining outcome is emissions reduction (mitigation) rather than “same service with less input” as the endpoint.  
3) Edge cases applied: If an offsite program were to fund adaptation-only projects (e.g., cooling centers) without material GHG impacts, it would no longer fit this canonical mechanism; under the stated mechanism (offsite GHG reduction), mitigation remains dominant.  
4) Confirm applies to ALL instances sharing this mechanism: Any policy that establishes an offsite GHG reduction/mitigation pathway for development compliance and funds emissions-reducing built-environment programs has mitigation as its primary category.  
5) Secondary subtype deferred: Whether the funded measures are efficiency, electrification, renewables, refrigerants, or offsets/credits is policy-specific and should be assigned at the individual policy level based on evidence and MRV rules.",0.86,"Key edge cases are MRV/additionality (true reductions vs. accounting), whether credits are local vs. external, and the possibility of funding measures with weak or indirect GHG impacts; these affect effectiveness but not the mechanism’s primary classification as mitigation.",incentive-program,enabling,direct,"""Establish an Offsite GHG Reduction Program""; ""for new development""; ""GHG reduction or mitigation pathway""; ""CAP compliance""; ""fund programs for reducing GHG emissions in the built environment""",Potential air quality and public health improvements from reduced combustion; potential energy cost savings from efficiency/electrification (not explicitly stated),"Could be implemented as a regulatory permit condition (mandate) requiring payment/participation; however the text emphasizes establishing a program and funding mechanism rather than specifying a binding standard or fee schedule, so it is treated as an enabling incentive/funding program.",['required'],True,matched token: 'ghg',True,no typology code,"Strategy 1: Decarbonize the Energy Supply through measures including a sunset strategy for oil and gas operations, procuring zero-carbon electricity, increasing renewable energy production, increasing energy resilience, and establishing GHG requirements for new development.",,,,,
1,parent_with_subs,parent,buildings,TABLE ES-1 (CONTINUED) SUMMARY OF DRAFT 2045 CAP MEASURES AND AFFECTED RESOURCE AREAS,"Strategy 5: Decarbonize Buildings through measures to electrify existing buildings, standardize all-electric new development, and other decarbonization actions (including embodied carbon and refrigerants).",,standalone parent policy,"Strategy 5: Decarbonize Buildings
Measure E1: Transition Existing Buildings to All- Electric
Measure E2: Standardize All-Electric New Development
Measure E3: Other Decarbonization Actions","Named Strategy with multiple measures and actions underneath, forming a clear umbrella policy.",Los_Angeles_California_United_States,No vulnerability context provided,Los_Angeles_California_United_States::903b5ca5015cd3741639db92,Los_Angeles_California_United_States::903b5ca5015cd3741639db92,False,False,building_electrification → building_emissions_reduction,The strategy transitions existing buildings to all-electric and standardizes all-electric new development to reduce building-related greenhouse gas emissions.,None,0.0,None,None,"evidence quote missing one of: [efficien, kwh, kw·h, per capita, ...]; evidence quote missing secondary subtype token: [efficien, kwh, kw·h, per capita, ...]",guide_secondary_typology_v1,policy_text_evidence_gated,explicit_self,no,Mitigation,Building energy service provision (heat/cooking) → fuel switch (gas/oil → electricity) → ↓ on-site fossil combustion → ↓ GHG emissions → ↓ atmospheric forcing,"1) Change in human/system activity: Building owners/developers retrofit or construct buildings with electric end-use equipment (e.g., heat pumps, electric resistance where applicable, induction stoves) instead of gas/oil/propane systems; sometimes coupled with panel upgrades and wiring readiness.  
2) Mediating physical process: Reduced combustion of methane/oil in boilers/furnaces/water heaters and associated CO₂ (and some CH₄ leakage upstream) emissions; emissions may shift to centralized power generation, where they are typically lower per unit service and can decline over time with grid decarbonization.  
3) Climate-relevant outcome: Net reduction in building-related GHG emissions (especially Scope 1), contributing to overall emissions mitigation.","The single biggest climate-relevant effect is eliminating on-site fossil fuel combustion in buildings, thereby reducing direct GHG emissions (and often enabling further reductions as electricity supply decarbonizes).","1) Dominant causal pathway: Switching building end uses from fossil fuels to electricity reduces direct combustion emissions, which is a direct emissions mitigation pathway.  
2) Why this primary over alternatives: While electrification can also improve energy efficiency (heat pumps) and local air quality, the mechanism as stated is fundamentally about reducing GHGs by eliminating on-site fossil fuel use; that is Mitigation rather than Resource Efficiency (which would be framed as “same service with less energy input” irrespective of fuel).  
3) Edge cases applied: If the electricity supply is very carbon-intensive, near-term net GHG benefits can be smaller or delayed; nevertheless, the intent and primary mechanism remain emissions reduction via fuel switching, often paired with grid decarbonization assumptions.  
4) Primary applies to ALL instances: Any policy under “building electrification → building emissions reduction” shares the same core mitigation pathway—reducing fossil fuel combustion in buildings—regardless of whether it targets new builds, retrofits, incentives, or rate/program design.  
5) Secondary subtype assignment deferred: Whether a specific policy is code-based, incentive-based, public-sector procurement, or equity-focused (and whether it also materially increases efficiency or resilience) requires policy-level evidence and is deferred.",0.93,"Net GHG impact can depend on grid emissions intensity and peak generation mix; some electrification measures may be pursued primarily for health/indoor air quality or cost reasons, but the canonical mechanism’s dominant climate effect remains mitigation via reduced on-site fossil combustion. In rare contexts with highly carbon-intensive grids and no decarbonization trajectory, short-run emissions could increase, but this does not change the mechanism’s primary classification.",planning-strategy,enabling,direct,“Strategy 5: Decarbonize Buildings”; “Transition Existing Buildings to All-Electric”; “Standardize All-Electric New Development”; “Other Decarbonization Actions”,Potential air quality and public health improvements from reduced on-site combustion; potential energy cost stability; improved indoor air quality and safety (cooking); none explicitly stated in the text.,"The measures could ultimately be implemented via mandates/standards (e.g., all-electric requirements), but the provided excerpt is only a strategy/measure listing without explicit regulatory language, funding, or compliance details, so classification remains planning-strategy.",[],True,matched token: 'emission',True,no typology code,,,,,,
1,parent_with_subs,sub,buildings,TABLE ES-1 (CONTINUED) SUMMARY OF DRAFT 2045 CAP MEASURES AND AFFECTED RESOURCE AREAS,"Measure E2: Standardize all-electric new development by adopting an ordinance requiring applicable new buildings be fully electric (no natural gas hookups), adopting ZNE ordinances by specified years, and adopting CALGreen Tier 1 standards and potential Tier 2 amendments.","Strategy 5: Decarbonize Buildings through measures to electrify existing buildings, standardize all-electric new development, and other decarbonization actions (including embodied carbon and refrigerants).",standalone parent policy,"Measure E2: Standardize All-Electric New Development
Energy: • Action E2.1 - Adopt an ordinance requiring all applicable new buildings to be fully electric with no natural gas hookups... • Action E2.2 - Adopt a ZNE ordinance for all new residential buildings built after 2025 and all new nonresidential buildings built after 2030... • Action E2.3 - Adopt CALGreen Code Tier 1 green building standards and identify which Tier 2 standards could be adopted as code amendments.","Measure contains clear regulatory commitments (ordinances, code adoption) and timelines.",Los_Angeles_California_United_States,No vulnerability context provided,Los_Angeles_California_United_States::e2f82c1aac8c9e6f991f0898,Los_Angeles_California_United_States::e2f82c1aac8c9e6f991f0898,False,False,building_energy_code → energy_use_reduction,"The city adopts ordinances and code standards requiring new buildings to be all-electric and meet zero net energy/CALGreen tiers, which reduces building energy use and associated emissions.",None,0.0,None,None,,guide_secondary_typology_v1,policy_text_evidence_gated,explicit_self,no,Mitigation,Building design/retrofit standards → ↓ delivered energy demand + ↓ on-site fossil fuel combustion → ↓ GHG emissions → ↓ atmospheric forcing,"(1) Change in human activity/system: Requirements for new construction and/or major renovations (and sometimes existing-building performance standards) that raise minimum efficiency, tighten envelopes, improve HVAC/lighting/water-heating performance, and may require electrification or low-carbon heat.  
(2) Mediating physical process: Reduced heat transfer losses, improved system efficiencies (higher COP/AFUE equivalents), better controls and reduced peak loads; reduced combustion of natural gas/oil on-site; lower electricity demand from the grid.  
(3) Climate-relevant outcome: Lower operational (Scope 1 and 2) energy-related GHG emissions over the building lifetime; in net-zero/energy-plus cases, near-zero or net-negative operational emissions depending on grid intensity and on-site generation.","The single biggest climate-relevant effect is reduced building operational energy use (and fuel switching away from fossil combustion), which lowers GHG emissions from energy supply.","1) Dominant causal pathway: These policies act on building energy performance so the largest effect is lowering operational energy consumption and fossil fuel use, which directly reduces GHG emissions.  
2) Why this primary over alternatives: While efficiency also improves “resource efficiency,” the climate-dominant purpose and outcome here is emissions reduction from energy use; therefore Mitigation best matches the primary causal pathway.  
3) Edge cases applied: If a code is framed around resilience (e.g., passive survivability during outages/heatwaves) it could have an adaptation co-benefit, but the canonical mechanism explicitly targets energy/emissions reduction, keeping Mitigation primary.  
4) Applicability to ALL instances: Any policy under “building_energy_code → energy_use_reduction” fundamentally reduces operational energy demand and/or on-site combustion, yielding emissions reductions regardless of city or code stringency.  
5) Note on subtypes: Secondary subtype assignment (e.g., “efficiency,” “electrification,” “net-zero,” “performance standard”) is deferred to policy-level evidence and specific provisions.",0.9,"Some building-code policies can include adaptation-focused elements (cool roofs for heat, flood-proofing, backup power) or embodied-carbon limits; those would introduce additional pathways, but under this canonical mechanism the dominant pathway remains operational energy/emissions reduction (Mitigation).",regulatory-mandate,direct,direct,"""Adopt an ordinance requiring all applicable new buildings to be fully electric""; ""no natural gas hookups""; ""Adopt a ZNE ordinance""; ""built after 2025... after 2030""; ""Adopt CALGreen Code Tier 1""; ""Tier 2 standards... adopted as code amendments""","Improved indoor air quality (reduced combustion byproducts), potential public health benefits, and possible energy bill savings for occupants.","Although ZNE/CALGreen can be framed as “standards,” the text specifies adopting them via ordinance/code, making the instrument best classified as a regulatory mandate rather than an incentive or disclosure approach.",[],True,rescued_by_f1_5,True,no typology code,"Strategy 5: Decarbonize Buildings through measures to electrify existing buildings, standardize all-electric new development, and other decarbonization actions (including embodied carbon and refrigerants).",keep,"Climate relevance is explicit in the measure itself: it requires new buildings to be 'fully electric (no natural gas hookups)' and to 'Adopt a ZNE ordinance' for new residential/nonresidential buildings, and adopt higher 'CALGreen' tiers. Electrification and ZNE/building code tightening are standard Mitigation actions via reduced fossil fuel use and energy demand (consistent with canonical_mechanism building_energy_code → energy_use_reduction). The gate failure ('no Mitigation outcome token') is a tokenization issue; climate_screen is 'explicit_self', so keep.",0.9,True,False
1,parent_with_subs,sub,buildings,TABLE ES-1 (CONTINUED) SUMMARY OF DRAFT 2045 CAP MEASURES AND AFFECTED RESOURCE AREAS,"Adopt an ordinance requiring all applicable new buildings to be fully electric with no natural gas hookups, with affordability considerations and supporting measures to defray first costs.","Strategy 5: Decarbonize Buildings through measures to electrify existing buildings, standardize all-electric new development, and other decarbonization actions (including embodied carbon and refrigerants).",standalone parent policy,"Action E2.1 - Adopt an ordinance requiring all applicable new buildings to be fully electric with no natural gas hookups. Include affordable housing considerations in these requirements, and develop supporting measures (financial support, technical assistance, or other incentives) to defray potential additional first costs in order to maintain housing affordability.",Explicit ordinance adoption with specified building electrification requirement.,Los_Angeles_California_United_States,No vulnerability context provided,Los_Angeles_California_United_States::10afb909431a471169cabf3e,Los_Angeles_California_United_States::10afb909431a471169cabf3e,False,False,all_electric_new_buildings_ordinance → onsite_fossil_fuel_use_avoidance,"Adopt an ordinance requiring applicable new buildings to be fully electric with no natural gas hookups, avoiding on-site fossil fuel combustion and associated emissions while supporting affordability through measures that defray first costs.",None,0.0,None,None,"evidence quote missing one of: [ghg, greenhouse gas, greenhouse gases, emission, ...]; evidence quote missing secondary subtype token: [hazard, exposure, vulnerab, resilien, ...]",guide_secondary_typology_v1,policy_text_evidence_gated,explicit_self,no,Mitigation,Building energy system choice (all-electric) → ↓ on-site fossil fuel combustion → ↓ direct GHG emissions (and often ↓ lifecycle emissions as grids decarbonize) → ↓ atmospheric forcing,"1) Changed activity/system: New-building design and equipment selection shifts from gas-fired end uses (furnaces/boilers, water heaters, stoves, dryers) to electric end uses (heat pumps, electric resistance/induction, etc.), typically with no gas service connection.  
2) Mediating physical process: Eliminating combustion prevents CO₂ (and some CH₄/N₂O) emissions at the building site; remaining energy demand is met by electricity whose emissions intensity depends on the grid and procurement, with emissions generally declining over time as grids decarbonize.  
3) Climate-relevant outcome: Net reduction in operational (Scope 1) building emissions and frequently overall lifecycle GHG emissions, avoiding long-lived gas infrastructure lock-in.",The single biggest climate-relevant effect is reduced building operational GHG emissions by avoiding on-site fossil fuel combustion in new construction.,"1) Dominant causal pathway: The mechanism directly targets and reduces GHG emissions by removing on-site fossil fuel combustion in new buildings (operational mitigation).  
2) Why this primary over alternatives: While it can improve energy efficiency and indoor air quality and can interact with grid decarbonization, the central, guaranteed effect across policies using this mechanism is eliminating direct combustion emissions and gas lock-in—best categorized as Mitigation rather than Resource Efficiency or Adaptation.  
3) Edge cases applied: If the electricity supply is carbon-intensive, near-term total emissions reductions could be smaller, but the mechanism still primarily functions via combustion avoidance and enables deeper reductions as the grid cleans; affordability elements do not change the dominant climate pathway.  
4) Confirm applies to ALL instances: Any “all-electric new buildings/no gas hookups” ordinance shares the same primary mitigation pathway of avoiding on-site fossil fuel use; specifics (scope, exemptions, timelines) alter magnitude, not category.  
5) Secondary subtype deferred: Any further sub-classification (e.g., electrification, building decarbonization, equity/affordability co-benefits) depends on the individual policy text and implementation details and is deferred to policy-level evidence.",0.93,"Potential edge cases include jurisdictions with very carbon-intensive grids (reducing near-term net benefits), exemptions for certain end uses (diluting effect), or policies framed mainly as affordability/health measures; however, the canonical mechanism remains operational GHG mitigation via on-site fossil fuel avoidance.",regulatory-mandate,direct,direct,"""Adopt an ordinance""; ""requiring all applicable new buildings to be fully electric""; ""no natural gas hookups""; ""supporting measures (financial support, technical assistance, or other incentives) to defray potential additional first costs""; ""maintain housing affordability""",Housing affordability/equity (affordable housing considerations; defray first costs); improved indoor air quality and health from reduced combustion pollutants; avoided gas infrastructure lock-in/costs,"Mixed instrument package: primary classification is the ordinance (mandate), while the referenced ""financial support/technical assistance/other incentives"" are complementary enabling measures but not the main policy action described.",[],True,matched token: 'fossil',True,no typology code,"Strategy 5: Decarbonize Buildings through measures to electrify existing buildings, standardize all-electric new development, and other decarbonization actions (including embodied carbon and refrigerants).",,,,,
