cluster_id,cluster_type,role,sector,section_header,policy_statement,parent_statement,parent_row_type,verbatim_text,extraction_rationale,location,location_vulnerability_context,row_key,source_bundle_key,is_atomized_row,is_decomposed,canonical_mechanism,mechanism_description,typology_code,typology_confidence,typology_evidence_quote,secondary_categories,gate_demoted_reason,classification_schema_version,secondary_profile,climate_screen,is_financial_instrument,primary_category,primary_causal_pathway,causal_mechanism_detail,dominant_pathway_test,mechanism_classification_reasoning,mechanism_confidence,mechanism_edge_case_notes,instrument_type,instrument_directness,climate_relevance,key_indicators,co_benefits,instance_edge_case_notes,language_violations,primary_gate_passed,primary_gate_reason,secondary_gate_passed,secondary_gate_reason,parent_policy_name,rescue_disposition,rescue_reasoning,rescue_confidence,primary_gate_rescued,dropped_by_climate_rescue
0,parent_with_subs,parent,energy_supply,TABLE ES-1 SUMMARY OF DRAFT 2045 CAP MEASURES AND AFFECTED RESOURCE AREAS,"Strategy 1: Decarbonize the Energy Supply through measures including a sunset strategy for oil and gas operations, procuring zero-carbon electricity, increasing renewable energy production, increasing energy resilience, and establishing GHG requirements for new development.",,structural header,"TABLE ES-1 SUMMARY OF DRAFT 2045 CAP MEASURES AND AFFECTED RESOURCE AREAS

| Draft 2045 CAP Strategies and Measures                                |
| Strategy 1: Decarbonize the Energy Supply                             |
| Measure ES1: Develop a Sunset Strategy for All Oil and Gas Operations |
| Measure ES2: Procure Zero-Carbon Electricity                          |
| Measure ES3: Increase Renewable Energy Production                     |
| Measure ES4: Increase Energy Resilience                               |
| Measure ES5: Establish GHG Requirements for New Development |","The document names Strategy 1 and enumerates multiple measures under it, indicating an umbrella policy framework with sub-actions.",Los_Angeles_California_United_States,No vulnerability context provided,Los_Angeles_California_United_States::fa570947a9cc43149e0d1825,Los_Angeles_California_United_States::fa570947a9cc43149e0d1825,False,False,renewable_energy_procurement → grid_decarbonization,The strategy develops a sunset approach for oil and gas operations and procures/increases zero-carbon and renewable electricity to shift the energy supply toward lower-carbon generation and reduce associated emissions.,None,0.0,None,None,"evidence quote missing one of: [efficien, kwh, kw·h, per capita, ...]; evidence quote missing secondary subtype token: [efficien, kwh, kw·h, per capita, ...]",guide_secondary_typology_v1,policy_text_evidence_gated,explicit_self,no,Mitigation,Electricity procurement / demand shift → ↑ renewable generation share → ↓ fossil generation → ↓ CO₂e emissions → ↓ atmospheric forcing,"(1) Change in human activity/system: The city changes electricity sourcing for public buildings (and sometimes broader municipal operations) to purchase/contract for renewable electricity rather than conventional grid mix.  
(2) Mediating physical process: Increased renewable electricity supply (via PPAs, RECs, utility green tariffs, or on-/off-site projects) reduces the need for fossil-fueled power plants to generate electricity, lowering combustion-related emissions (and associated upstream fuel-cycle emissions).  
(3) Climate-relevant outcome: Net reduction in CO₂e emissions from electricity generation attributable to municipal electricity consumption, contributing to overall grid decarbonization and lower cumulative emissions.",The single biggest climate-relevant effect is reducing GHG emissions by replacing fossil electricity generation with renewable electricity on the grid.,"1) Dominant causal pathway: The core causal chain is “procure more renewable electricity → displace fossil generation → reduce GHG emissions,” which is directly mitigation-focused.  
2) Why this primary over alternatives: While renewable procurement can incidentally improve energy security or price stability (resource efficiency/resilience co-benefits), the dominant and intended climate effect is emissions reduction from the power sector.  
3) Edge cases applied: If a policy only claims “renewable” via unbundled certificates with weak additionality, real-world emissions impacts can be smaller; however, the mechanism as stated still targets grid decarbonization via renewable sourcing and is best categorized as Mitigation.  
4) Applicability to ALL instances: Any policy that increases renewable electricity procurement/use (especially for municipal/public buildings) operates through the same primary pathway of reducing fossil-based electricity emissions.  
5) Note on secondary subtypes: Any secondary subtype distinctions (e.g., municipal operations vs. community-wide targets; on-site generation vs. procurement instruments; REC quality/additionality) require policy-specific evidence and are deferred to policy-level assessment.",0.92,"Emissions benefits depend on additionality and accounting (e.g., bundled vs. unbundled RECs, local vs. remote procurement, marginal grid emissions). Some “clean energy” targets may include nuclear or fossil w/ CCS; classification remains Mitigation because the dominant intended pathway is reduced power-sector GHG emissions.",procurement-requirement,direct,direct,“Decarbonize the Energy Supply”; “Procure Zero-Carbon Electricity”; “Increase Renewable Energy Production”; “Establish GHG Requirements for New Development”; “Sunset Strategy for All Oil and Gas Operations”,Energy resilience / reliability benefits (from “Increase Energy Resilience”) not sufficient here to reclassify away from mitigation-focused decarbonization procurement.,"This strategy bundles multiple instrument types (procurement, regulatory phaseout/sunset, and regulatory GHG requirements). Classification is anchored to the procurement-driven causal pathway provided (“Electricity procurement / demand shift…”). If the “sunset strategy” or “GHG requirements” were the focal mechanism instead, instrument_type could shift to regulatory-mandate/performance-standard.",[],True,matched token: 'ghg',True,no typology code,,,,,,
0,parent_with_subs,sub,energy_supply,TABLE ES-1 SUMMARY OF DRAFT 2045 CAP MEASURES AND AFFECTED RESOURCE AREAS,"Measure ES1: Develop a sunset strategy for all oil and gas operations, including collaboration with jurisdictions/utilities and development of an ordinance.","Strategy 1: Decarbonize the Energy Supply through measures including a sunset strategy for oil and gas operations, procuring zero-carbon electricity, increasing renewable energy production, increasing energy resilience, and establishing GHG requirements for new development.",structural header,"Measure ES1: Develop a Sunset Strategy for All Oil and Gas Operations
Energy: • Action ES1.1 - Collaborate with other local jurisdictions and utilities to develop a sunset strategy for all oil and gas operations that prioritizes disproportionately affected communities. Develop an ordinance.","Named measure under Strategy 1 with specific implementing actions, including an ordinance.",Los_Angeles_California_United_States,No vulnerability context provided,Los_Angeles_California_United_States::0c9c2006135b6d52925dca82,Los_Angeles_California_United_States::0c9c2006135b6d52925dca82,False,False,oil_and_gas_phaseout_ordinance → fossil_fuel_emissions_reduction,"The policy plans to collaborate with other jurisdictions and utilities to develop a sunset strategy and an ordinance to wind down oil and gas operations, reducing fossil fuel-related emissions.",None,0.0,None,None,evidence_quote not substring-grounded in source,guide_secondary_typology_v1,policy_text_evidence_gated,explicit_self,no,Mitigation,Fossil fuel production/operations phaseout → ↓ oil & gas extraction/processing + ↓ fugitives/venting/flaring → ↓ CH₄/CO₂ emissions → ↓ atmospheric forcing,"(1) Change in human activity/system: The jurisdiction legally winds down and ultimately ends oil and gas operations (drilling, production, processing, related infrastructure operation) via a sunset strategy and ordinance, often coordinated with utilities/neighboring jurisdictions.  
(2) Mediating physical process: Reduced hydrocarbon handling and combustion leads to fewer upstream methane leaks and less venting/flaring; reduced fossil fuel supply/throughput can also reduce downstream combustion emissions depending on market substitution and accompanying demand-side measures.  
(3) Climate-relevant outcome: Net decrease in GHG emissions (CH₄ and CO₂), delivering mitigation benefits.","Phasing out local oil and gas operations most strongly affects climate by directly lowering fossil fuel–related GHG emissions, especially methane and CO₂, by ending extraction/processing and associated leaks, venting, and flaring.","1) Dominant causal pathway: Ending oil and gas operations reduces methane/CO₂ emissions from extraction/processing (and potentially downstream combustion), which is a direct mitigation pathway.  
2) Why this primary over alternatives: While there can be air-quality/health, land-use, and environmental remediation co-benefits, the single biggest climate-relevant effect across this mechanism is reduced fossil-fuel GHG emissions, not efficiency gains, hazard reduction, or ecosystem carbon sequestration.  
3) Edge cases applied: If displaced production is fully replaced elsewhere (leakage) the net global benefit could be smaller, but the mechanism’s intended and direct pathway remains emissions reduction; any adaptation or resource-efficiency effects are secondary and not the dominant mechanism.  
4) Applies to ALL instances: Any policy that phases out/winds down oil and gas operations shares the same primary mitigation pathway of reducing fossil-fuel-related emissions from those operations.  
5) Secondary subtype deferred: Any further sub-classification (e.g., methane-focused vs broader fossil supply constraint; local vs economy-wide impacts; just-transition components) requires policy-specific evidence and is deferred.",0.9,"Potential emissions leakage/substitution (production shifts to other regions) can reduce net global mitigation impact; some ordinances primarily target local health/safety but still operate through emissions reductions. If a policy only plans studies without implementation, realized mitigation may be uncertain, but the mechanism classification remains Mitigation.",regulatory-mandate,direct,direct,“Develop a Sunset Strategy for All Oil and Gas Operations”; “collaborate with other local jurisdictions and utilities”; “develop a sunset strategy”; “Develop an ordinance”; “prioritizes disproportionately affected communities”,Local air quality and public health improvements (reduced co-pollutants); environmental justice benefits for disproportionately affected communities,"Although the text is about developing a strategy (planning), the explicit “Develop an ordinance” signals a binding regulatory pathway; classification is based on the intended legal instrument rather than the interim planning step.",[],True,matched token: 'emission',True,no typology code,"Strategy 1: Decarbonize the Energy Supply through measures including a sunset strategy for oil and gas operations, procuring zero-carbon electricity, increasing renewable energy production, increasing energy resilience, and establishing GHG requirements for new development.",,,,,
0,parent_with_subs,sub,energy_supply,TABLE ES-1 SUMMARY OF DRAFT 2045 CAP MEASURES AND AFFECTED RESOURCE AREAS,Collaborate with other local jurisdictions and utilities to develop a sunset strategy for all oil and gas operations prioritizing disproportionately affected communities and develop an ordinance.,"Strategy 1: Decarbonize the Energy Supply through measures including a sunset strategy for oil and gas operations, procuring zero-carbon electricity, increasing renewable energy production, increasing energy resilience, and establishing GHG requirements for new development.",structural header,Action ES1.1 - Collaborate with other local jurisdictions and utilities to develop a sunset strategy for all oil and gas operations that prioritizes disproportionately affected communities. Develop an ordinance.,Concrete intervention and regulatory mechanism (ordinance) stated as an implementing action.,Los_Angeles_California_United_States,No vulnerability context provided,Los_Angeles_California_United_States::f53eda5f5cfeb49a25b16f2b,Los_Angeles_California_United_States::f53eda5f5cfeb49a25b16f2b,False,False,oil_and_gas_phaseout_strategy → fossil_fuel_supply_and_emissions_reduction,"The policy collaborates to develop a sunset strategy and an ordinance for oil and gas operations, aiming to phase down those operations and reduce fossil fuel-related emissions while prioritizing disproportionately affected communities.",None,0.0,None,None,evidence_quote not substring-grounded in source,guide_secondary_typology_v1,policy_text_evidence_gated,explicit_parent,no,Mitigation,"Fossil fuel supply activity (oil & gas operations) → ↓ extraction/processing/leakage & ↓ downstream combustion → ↓ GHG emissions (CH₄, CO₂) → ↓ atmospheric forcing","(1) Change in system/activity: Local government and partners implement a planned “sunset” (phaseout) of oil and gas operations via strategy and ordinance, restricting/ending drilling, production, processing, and related operations.  
(2) Mediating process: Reduced fossil fuel throughput lowers direct operational emissions (especially methane leakage, venting, flaring, and energy use on-site) and constrains fossil fuel availability, which can reduce end-use combustion emissions when not fully offset by imports.  
(3) Climate-relevant outcome: Net reduction in lifecycle GHG emissions (CH₄ and CO₂), lowering overall radiative forcing.",The single biggest climate-relevant effect is reducing greenhouse gas emissions by phasing out oil and gas operations and associated methane/CO₂ emissions across the fossil fuel supply chain.,"1) Dominant causal pathway: The mechanism primarily acts by reducing oil and gas operations, which reduces fossil-fuel-related GHG emissions (CO₂ from combustion and CH₄ from upstream leakage/venting/flaring).  
2) Why this primary over alternatives: While the policy emphasizes disproportionately affected communities (equity/health co-benefits) and may reduce local air pollutants, the largest climate-relevant effect is emissions mitigation, not adaptation, resource efficiency, or nature-based carbon sequestration.  
3) Edge cases applied: If displaced production is fully replaced by imports (“leakage”), net global mitigation could be smaller; however, the intended and typical dominant pathway of a phaseout strategy is still emissions reduction. Interim operational controls (e.g., LDAR) remain mitigation as well.  
4) Applicability to ALL instances sharing this mechanism: Any policy that establishes a phaseout/sunset strategy for oil and gas operations shares the same primary mitigation pathway—constraining fossil fuel supply and upstream emissions to reduce GHGs.  
5) Secondary subtype assignment deferred: Any further tagging (e.g., methane-specific vs. supply-side transition design, equity/just transition components) requires policy-specific evidence and is deferred to the policy level.",0.86,"Potential emissions “leakage” via replacement supply from other regions could reduce net global benefits; some implementations may focus more on health/risk reduction (e.g., setbacks) than climate, but the mechanism as stated is an operational phaseout aimed at reducing fossil-related emissions, keeping mitigation dominant.",regulatory-mandate,direct,direct,“sunset strategy for all oil and gas operations”; “Develop an ordinance”; “Collaborate with other local jurisdictions and utilities”; “prioritizes disproportionately affected communities”,Improved local air quality and public health; environmental justice and reduced disproportionate pollution burdens; reduced safety risks from drilling/operations; potential land restoration/remediation opportunities.,"Includes a planning/coordination component (“collaborate…develop a sunset strategy”), but the explicit commitment to “Develop an ordinance” makes the dominant instrument a direct regulatory mandate rather than a nonbinding plan.",[],True,matched token: 'emission',True,no typology code,"Strategy 1: Decarbonize the Energy Supply through measures including a sunset strategy for oil and gas operations, procuring zero-carbon electricity, increasing renewable energy production, increasing energy resilience, and establishing GHG requirements for new development.",,,,,
0,parent_with_subs,sub,energy_supply,TABLE ES-1 SUMMARY OF DRAFT 2045 CAP MEASURES AND AFFECTED RESOURCE AREAS,"Develop a policy requiring examination of all active, idle, and abandoned oil wells for fugitive GHG emissions and coordinate with agencies conducting fugitive emissions data.","Strategy 1: Decarbonize the Energy Supply through measures including a sunset strategy for oil and gas operations, procuring zero-carbon electricity, increasing renewable energy production, increasing energy resilience, and establishing GHG requirements for new development.",structural header,"Action ES1.2 - Develop a policy that requires the examination of all active, idle, and abandoned oil wells for fugitive emissions of GHGs. Coordinate with federal and state agencies conducting fugitive emissions data.",Explicit requirement ('requires') to examine wells and coordinate with agencies.,Los_Angeles_California_United_States,No vulnerability context provided,Los_Angeles_California_United_States::1a0c4462ecb424416262ae4f,Los_Angeles_California_United_States::1a0c4462ecb424416262ae4f,False,False,fugitive_emissions_monitoring → fugitive_emissions_reduction,Develop a policy that requires examining oil wells for fugitive GHG emissions and coordinating data with other agencies to identify leaks and reduce fugitive emissions.,None,0.0,None,None,,guide_secondary_typology_v1,policy_text_evidence_gated,explicit_self,no,Mitigation,Oil & gas production/handling → leak detection & repair (LDAR) → ↓ fugitive methane/CO₂ emissions → ↓ atmospheric GHG concentration/forcing,"(1) Change in human activity/system: Require inspection/monitoring of active, idle, and abandoned oil wells and coordinate emissions data across agencies to identify high-emitting sources and trigger corrective actions (repairs, plugging, maintenance, operational changes).  
(2) Mediating physical process: Reduced unintentional venting/leakage of methane and other hydrocarbons/CO₂ from wellheads, casings, piping, and associated equipment after leaks are located and remediated.  
(3) Climate-relevant outcome: Lower net GHG emissions (especially methane, a high-GWP, short-lived climate pollutant), producing direct mitigation benefits.",The single biggest climate-relevant effect is reducing methane (and other GHG) emissions by detecting and fixing leaks from oil and gas wells.,"1) Dominant causal pathway: Policy-driven monitoring enables identification and repair of leaks, leading to ↓ fugitive methane/other GHG emissions—this is a direct emissions reduction pathway.  
2) Why this primary over alternatives: While better monitoring can improve operational efficiency or safety, the largest climate-relevant impact is the direct reduction of atmospheric GHG releases (mitigation), not adaptation, resource efficiency, or nature-based sequestration.  
3) Edge cases applied: If monitoring is implemented without any enforceable repair/remediation mechanism, climate benefits could be weaker; however, the canonical mechanism explicitly includes “monitoring → reduction,” implying action that reduces emissions.  
4) Confirm primary applies to ALL instances: Any policy sharing this mechanism (fugitive emissions monitoring leading to reduced fugitive emissions) has its principal climate effect through direct GHG emissions abatement.  
5) Secondary subtype assignment deferred: Any finer classification (e.g., methane-specific, upstream oil & gas, abandoned wells) depends on policy-level details and is deferred.",0.92,"If a policy only inventories emissions for research with no requirement/authority to repair, plug, or mitigate leaks, the realized mitigation effect may be limited; also some actions may reduce co-pollutants (air quality) but the primary climate category remains Mitigation.",regulatory-mandate,direct,direct,"“Develop a policy that requires the examination”; “all active, idle, and abandoned oil wells”; “fugitive emissions of GHGs”; “Coordinate with federal and state agencies”; “fugitive emissions data”","Improved local air quality (reduced VOCs/ozone precursors), public health benefits, reduced explosion/safety risks, better environmental monitoring/data quality.",The text specifies required “examination” and data coordination but does not explicitly state repair/plugging obligations; mitigation impact is implied via inspection/identification rather than an explicit LDAR/repair mandate.,[],True,matched token: 'ghg',True,no typology code,"Strategy 1: Decarbonize the Energy Supply through measures including a sunset strategy for oil and gas operations, procuring zero-carbon electricity, increasing renewable energy production, increasing energy resilience, and establishing GHG requirements for new development.",,,,,
