cluster_id,cluster_type,role,sector,section_header,policy_statement,parent_statement,parent_row_type,verbatim_text,extraction_rationale,location,location_vulnerability_context,row_key,source_bundle_key,is_atomized_row,is_decomposed,canonical_mechanism,mechanism_description,typology_code,typology_confidence,typology_evidence_quote,secondary_categories,gate_demoted_reason,classification_schema_version,secondary_profile,climate_screen,is_financial_instrument,primary_category,primary_causal_pathway,causal_mechanism_detail,dominant_pathway_test,mechanism_classification_reasoning,mechanism_confidence,mechanism_edge_case_notes,instrument_type,instrument_directness,climate_relevance,key_indicators,co_benefits,instance_edge_case_notes,language_violations,primary_gate_passed,primary_gate_reason,secondary_gate_passed,secondary_gate_reason,parent_policy_name,rescue_disposition,rescue_reasoning,rescue_confidence,primary_gate_rescued,dropped_by_climate_rescue
0,parent_with_subs,sub,buildings,TABLE ES-1 SUMMARY OF DRAFT 2045 CAP MEASURES AND AFFECTED RESOURCE AREAS,Require and incentivize renewable energy for affordable housing developments for both new development and existing buildings.,"Strategy 1: Decarbonize the Energy Supply through measures including a sunset strategy for oil and gas operations, procuring zero-carbon electricity, increasing renewable energy production, increasing energy resilience, and establishing GHG requirements for new development.",structural header,Action ES3.5 - Require and incentivize renewable energy for affordable housing developments for both new development and existing buildings.,Contains a requirement and incentives targeting affordable housing renewable energy.,Los_Angeles_California_United_States,No vulnerability context provided,Los_Angeles_California_United_States::a6f5ffcdb298a9305e4e4b0c,Los_Angeles_California_United_States::a6f5ffcdb298a9305e4e4b0c,False,False,solar_pv_deployment → fossil_generation_displacement,"The action requires and incentivizes renewable energy in affordable housing developments, increasing on-site clean power and displacing fossil-based electricity generation.",None,0.0,None,None,,guide_secondary_typology_v1,policy_text_evidence_gated,explicit_self,no,Mitigation,Renewable electricity deployment → fossil generation displacement → ↓ fuel combustion → ↓ GHG emissions → ↓ atmospheric forcing,"1) Changed activity/system: Electricity supply mix shifts as PV capacity and generation increase (utility-scale, rooftop, or community solar), changing dispatch and reducing fossil plant run-hours and output.  
2) Mediating process: PV produces electricity without on-site combustion; on the grid, this zero/low-operational-emissions generation substitutes for marginal fossil generation (often gas or coal), reducing fossil fuel use and associated CO2 (and some CH4/N2O) emissions; effects depend on marginal emissions factors, curtailment, and storage/transmission constraints.  
3) Climate-relevant outcome: Net reduction in power-sector GHG emissions (tCO2e) and, secondarily, reductions in co-pollutants from fossil generation.","The single biggest climate-relevant effect is that added solar PV generation displaces fossil electricity generation, lowering power-sector GHG emissions.","1) Dominant causal pathway: PV deployment increases renewable generation that substitutes for fossil generation, yielding a direct decrease in combustion-related GHG emissions—this is classic emissions mitigation.  
2) Why this primary over alternatives: While PV can improve resource efficiency (less fuel input per kWh) and can support resilience if paired with storage/islanding, the principal and most general effect across all such policies is emissions reduction via fossil displacement.  
3) Edge cases applied: If PV is added in a grid with high curtailment or already near-zero marginal emissions, emissions benefits may be smaller, but the intended and typical dominant pathway remains fossil displacement and mitigation. Lifecycle/manufacturing emissions do not overturn the primary operational mitigation effect in standard accounting.  
4) Applicability to ALL instances: Any policy that materially deploys solar PV to increase electricity production shares this dominant mitigation pathway because the mechanism explicitly relies on renewable generation displacing fossil generation.  
5) Note on secondary subtypes: Any further subtype/secondary tagging (e.g., rooftop vs utility-scale, community ownership, resilience microgrids, equity components) is deferred to policy-level evidence and does not change the primary category.",0.95,"Emissions impact depends on the marginal grid mix, curtailment, and whether PV is paired with storage; PV deployed primarily for backup power/resilience could introduce an adaptation co-benefit, but the canonical mechanism specified is fossil generation displacement (mitigation).",incentive-program,direct,direct,"""Require and incentivize renewable energy""; ""affordable housing developments""; ""new development and existing buildings""",Lower tenant energy bills/energy burden; improved local air quality from reduced fossil generation; resilience benefits if paired with storage/microgrids (not specified),"Mixed instrument signal: includes both a mandate (“require”) and incentives (“incentivize”). With no details on the mandate (e.g., code requirement or performance threshold), classification is anchored on the explicit incentive component. If implemented via a building/solar-ready requirement, it could alternatively be coded as regulatory-mandate.",[],True,matched token: 'fossil',True,no typology code,"Strategy 1: Decarbonize the Energy Supply through measures including a sunset strategy for oil and gas operations, procuring zero-carbon electricity, increasing renewable energy production, increasing energy resilience, and establishing GHG requirements for new development.",,,,,
0,parent_with_subs,sub,energy_supply,TABLE ES-1 SUMMARY OF DRAFT 2045 CAP MEASURES AND AFFECTED RESOURCE AREAS,Streamline and prioritize permitting for solar and battery storage projects.,"Strategy 1: Decarbonize the Energy Supply through measures including a sunset strategy for oil and gas operations, procuring zero-carbon electricity, increasing renewable energy production, increasing energy resilience, and establishing GHG requirements for new development.",structural header,Action ES3.6 - Streamline and prioritize permitting for solar and battery storage projects.,Administrative/regulatory change to permitting is a concrete policy action.,Los_Angeles_California_United_States,No vulnerability context provided,Los_Angeles_California_United_States::622f4d599ffe218d277612d9,Los_Angeles_California_United_States::622f4d599ffe218d277612d9,False,False,solar_pv_and_energy_storage_permitting_streamlining → renewable_deployment_acceleration_and_fossil_generation_displacement,"Streamlining and prioritizing permitting for solar and battery storage projects accelerates their deployment, supporting renewable electricity integration and displacing fossil-based generation.",None,0.0,None,None,"evidence quote missing one of: [efficien, kwh, kw·h, per capita, ...]; evidence quote missing secondary subtype token: [efficien, kwh, kw·h, per capita, ...]",guide_secondary_typology_v1,policy_text_evidence_gated,explicit_self,no,Mitigation,Policy/administration change → faster solar+storage deployment → ↓ fossil generation → ↓ GHG emissions → ↓ atmospheric forcing,"1) Changed human activity/system: The project development and interconnection pipeline for utility-scale or distributed solar PV and battery energy storage (permitting, inspections, approvals, queue processing) is sped up and made more predictable.  
2) Mediating physical/technological process: More renewable generation capacity is installed sooner and storage increases grid flexibility (shifts energy, smooths variability, provides capacity/ancillary services), allowing renewables to serve more load reliably.  
3) Climate-relevant outcome: Reduced combustion of coal/oil/gas for electricity (and potentially reduced curtailment) leads to lower lifecycle CO₂e emissions from the electricity sector.",The single biggest climate-relevant effect is reduced power-sector GHG emissions from faster deployment of solar PV and storage that displaces fossil electricity generation.,"1) Dominant causal pathway: Administrative streamlining → accelerated renewable (solar) + storage deployment → displacement of fossil generation → lower GHG emissions.  
2) Why this primary over alternatives: While the policy also improves “resource efficiency” in an administrative sense (less time/cost) and can aid resilience, its main climate effect is emissions mitigation via supply decarbonization and fossil displacement.  
3) Edge cases applied: If streamlined permitting were used primarily to accelerate fossil generation or non-renewable infrastructure, the category would change—but this canonical mechanism is explicitly solar PV and storage enabling renewable integration, so mitigation dominates.  
4) Confirm applies to ALL instances: Any policy that streamlines permitting for solar PV and energy storage with the intent/effect of accelerating deployment shares the same primary outcome—more renewables and storage online sooner—leading primarily to reduced fossil generation emissions.  
5) Secondary subtype assignment deferred: Whether a given policy most affects utility-scale vs. distributed PV, the magnitude of storage-enabled curtailment reduction, or local air-quality co-benefits requires policy-specific evidence and is not assigned here.",0.9,"In grids already near-zero carbon, incremental solar+storage may yield smaller marginal GHG reductions and more “enabling” benefits (reliability, cost, curtailment reduction), but the primary intended climate pathway remains mitigation through fossil displacement. Also note potential non-trivial lifecycle/storage manufacturing emissions are typically outweighed by operational fossil displacement in most contexts.",planning-strategy,enabling,direct,"""Streamline and prioritize permitting""; ""solar""; ""battery storage projects""",Faster project delivery and reduced developer transaction costs; potential local air quality improvements from reduced fossil generation.,"Could be coded as a regulatory/administrative reform, but absent specific mandatory timelines/requirements, it fits best as a planning/strategy process change (enabling instrument).",[],True,matched token: 'fossil',True,no typology code,"Strategy 1: Decarbonize the Energy Supply through measures including a sunset strategy for oil and gas operations, procuring zero-carbon electricity, increasing renewable energy production, increasing energy resilience, and establishing GHG requirements for new development.",,,,,
0,parent_with_subs,sub,energy_supply,TABLE ES-1 (CONTINUED) SUMMARY OF DRAFT 2045 CAP MEASURES AND AFFECTED RESOURCE AREAS,"Measure ES4: Increase energy resilience by investing in storage and microgrids, deploying resilience hubs, creating an energy map, conducting feasibility studies for solar/storage microgrids and adopting regulations/standards, and promoting efficiency/resilience in critical service facilities.","Strategy 1: Decarbonize the Energy Supply through measures including a sunset strategy for oil and gas operations, procuring zero-carbon electricity, increasing renewable energy production, increasing energy resilience, and establishing GHG requirements for new development.",structural header,"Measure ES4: Increase Energy Resilience
Energy: • Action ES4.2 - Invest in energy storage and microgrids at critical County facilities through CPA's Power Ready Program. • Action ES4.4 - Conduct feasibility studies to identify priority areas for solar and storage, combined with building- and community-scale microgrids and alternative technologies such as fuel cells and grid paralleling... Adopt regulations that establish this use and standards for its development... Hazards and Hazardous Materials: • Action ES4.1 - Develop a program to deploy community resilience hubs at scale. • Action ES4.3 - Develop a publicly accessible community energy map...","Named measure with multiple specific actions including investments, programs, mapping, studies, and adoption of regulations.",Los_Angeles_California_United_States,No vulnerability context provided,Los_Angeles_California_United_States::ece681f7094338051fe8694f,Los_Angeles_California_United_States::ece681f7094338051fe8694f,False,False,energy_storage_and_microgrids → energy_system_resilience,"The County plans to invest in energy storage and microgrids at critical facilities and deploy resilience hubs, improving backup power capability and overall energy system resilience during disruptions.",None,0.0,None,None,evidence_quote not substring-grounded in source,guide_secondary_typology_v1,policy_text_evidence_gated,explicit_self,no,Adaptation,"Climate hazard/shock (e.g., heat, wildfire, storms) → grid disruption risk → ↑ backup/islanding capability via storage + microgrids → ↓ exposure/↓ service interruption impacts at critical facilities","1) Change in human activity/system: The energy system is reconfigured at critical facilities and community sites through deployment of battery storage, solar+storage, controllable microgrids (islanding), and designated resilience hubs with backup power.  
2) Mediating physical/process mechanism: Distributed energy resources provide local generation/storage and controllability that can electrically isolate (“island”) from a failing grid and supply essential loads; storage smooths intermittency and bridges outages; hardened/managed microgrids improve reliability under stress.  
3) Climate-relevant outcome: Reduced vulnerability and damages from climate-related outages (heatwaves, wildfire-related shutoffs, storms), maintaining lifesaving services (cooling, medical equipment, communications, water/wastewater operations) and reducing disruption impacts on populations.",The single biggest climate-relevant effect is reducing impacts from climate-amplified grid disruptions by maintaining critical electricity service through storage/microgrids (backup power and islanding).,"1) Dominant causal pathway: Climate hazards increase outage frequency/severity; microgrids and storage reduce service interruption impacts by enabling backup power and islanding at critical loads.  
2) Why Adaptation over alternatives: The primary objective and effect is resilience/reliability under disruptive events (risk reduction), not primarily reducing energy use (Resource Efficiency) or sequestering carbon (Nature-Based Solutions). Mitigation benefits (e.g., enabling more renewables or reducing diesel generator runtime) can occur but are not the single largest, mechanism-defining outcome across all such “resilience microgrid/storage” policies.  
3) Edge cases applied: If a policy’s principal aim is renewable integration/peak shaving/emissions reduction, it could be Mitigation; however, this canonical mechanism is explicitly “energy_system_resilience” at critical facilities/resilience hubs, which is adaptation-dominant.  
4) Applies to ALL instances sharing this mechanism: Any policy that centers on storage/microgrids/resilience hubs for backup/islanding during disruptions primarily reduces outage-related vulnerability—consistent with Adaptation as the overarching category.  
5) Secondary subtype deferred: Any additional tagging (e.g., mitigation co-benefits from displaced diesel generation or renewable firming) must be assigned based on policy-specific evidence, not assumed from the mechanism alone.",0.86,"Some storage/microgrid programs are primarily justified for emissions reduction, renewable integration, or cost/peak management; those would shift the dominant pathway toward Mitigation/Resource Efficiency. For this mechanism as defined (resilience hubs, critical facilities, backup capability), Adaptation remains primary.",infrastructure-investment,direct,direct,"""Increase Energy Resilience""; ""Invest in energy storage and microgrids at critical County facilities""; ""Power Ready Program""; ""Conduct feasibility studies""; ""deploy community resilience hubs""; ""publicly accessible community energy map""; ""Adopt regulations… and standards for its development""",Energy cost savings and emissions reductions from solar/storage and efficiency; improved day-to-day grid reliability; public safety and emergency preparedness benefits.,"Includes a mix of instruments (investment, planning/mapping, feasibility studies, and regulations/standards). Classified by the primary, most concrete lever in the text—deployment/investment in storage, microgrids, and resilience hubs—while noting the enabling regulatory/planning elements.",[],True,matched token: 'hazard',True,no typology code,"Strategy 1: Decarbonize the Energy Supply through measures including a sunset strategy for oil and gas operations, procuring zero-carbon electricity, increasing renewable energy production, increasing energy resilience, and establishing GHG requirements for new development.",,,,,
0,parent_with_subs,sub,cross_sector,TABLE ES-1 (CONTINUED) SUMMARY OF DRAFT 2045 CAP MEASURES AND AFFECTED RESOURCE AREAS,Develop a program to deploy community resilience hubs at scale.,"Strategy 1: Decarbonize the Energy Supply through measures including a sunset strategy for oil and gas operations, procuring zero-carbon electricity, increasing renewable energy production, increasing energy resilience, and establishing GHG requirements for new development.",structural header,Action ES4.1 - Develop a program to deploy community resilience hubs at scale.,Explicit commitment to develop a program for resilience hubs.,Los_Angeles_California_United_States,No vulnerability context provided,Los_Angeles_California_United_States::7aa10b92eefdc003adace574,Los_Angeles_California_United_States::7aa10b92eefdc003adace574,False,False,community_resilience_hubs_deployment → community_adaptive_capacity_increase,Developing a program to deploy community resilience hubs increases community capacity to prepare for and respond to climate-related disruptions.,None,0.0,None,None,"evidence quote missing one of: [ecosystem, habitat, tree, trees, ...]; evidence quote missing secondary subtype token: [ecosystem, habitat, tree, trees, ...]",guide_secondary_typology_v1,policy_text_evidence_gated,explicit_self,no,Adaptation,Climate hazard event → resilience hub services/coordination → ↓ exposure + ↓ vulnerability → ↓ climate impact damages,"1) Changed human activity/system: Cities/communities establish and operate resilience hubs (often at schools, libraries, community centers) that provide cooling/clean air space, backup power/charging, information, supplies, communications, and mutual-aid coordination before and during disruptions.  
2) Mediating physical/social process: Enhanced access to safe shelter, energy and communications continuity, health-protective environments (cooling/filtration), and coordinated emergency support reduces sensitivity and improves coping capacity during extreme events.  
3) Climate-relevant outcome: Reduced morbidity/mortality and economic/social disruption from climate-related extremes (heat, smoke, storms, outages), i.e., improved adaptive capacity and reduced climate risk.","The single biggest climate-relevant effect is reduced harm from climate hazards by increasing community preparedness and response capacity (i.e., lowering exposure/vulnerability during disruptions).","1) Dominant causal pathway: The mechanism’s main effect is to reduce impacts from climate hazards by improving preparedness, response, and continuity of essential services (hazard → lower exposure/vulnerability → lower damages).  
2) Why Adaptation over alternatives: While hubs can include efficiency upgrades or on-site renewables, those are enabling features; the defining and largest climate-relevant outcome across this mechanism is risk reduction during disruptions, not GHG mitigation or resource-use reduction.  
3) Edge cases applied: If a “resilience hub” program is framed primarily as solar+storage deployment or building decarbonization, mitigation/resource-efficiency could become dominant—but that would be a different canonical mechanism than “adaptive capacity increase.”  
4) Applies to ALL instances sharing this mechanism: Any policy whose mechanism is explicitly “deploy hubs → increase community adaptive capacity” is principally aimed at reducing climate vulnerability and impacts, so Adaptation is consistently primary.  
5) Secondary subtype assignment deferred: Co-benefits (e.g., emissions reductions from solar+storage, energy savings from retrofits, social co-benefits) require policy-specific evidence and are not used to change the primary category here.",0.9,"If hubs are implemented mainly as clean-energy/efficiency infrastructure (e.g., microgrids intended primarily for emissions reduction) or primarily as social service centers without a clear climate-hazard function, the dominant pathway could shift; for this canonical mechanism as stated (adaptive capacity increase), classification as Adaptation is straightforward.",planning-strategy,enabling,direct,"""Develop a program""; ""deploy community resilience hubs""; ""at scale""",None,Could also be coded as infrastructure-investment if the underlying policy text specified funding/retrofit/build-out of hub facilities; here it only specifies developing a program to deploy them (programmatic enablement rather than an explicit capital spend).,[],True,matched token: 'resilien',True,no typology code,"Strategy 1: Decarbonize the Energy Supply through measures including a sunset strategy for oil and gas operations, procuring zero-carbon electricity, increasing renewable energy production, increasing energy resilience, and establishing GHG requirements for new development.",,,,,
