policy_id,role,parent_statement,policy_statement,primary_category,trace_path,validation_trace_csv,validation_lookup_column,validation_lookup_value
000,parent,,"Approach 1: Benchmark, retune, and retrofit existing buildings to reduce emissions from energy use in buildings.",Mitigation,policy_traces/000_Approach_1_Benchmark_retune_and_retrofit_existing_buildings_.json,trace_initiative_policies_valid.csv,parent_statement,"Approach 1: Benchmark, retune, and retrofit existing buildings to reduce emissions from energy use in buildings."
001,sub,"Approach 1: Benchmark, retune, and retrofit existing buildings to reduce emissions from energy use in buildings.",Benchmark 1.3 billion square feet of communitywide buildings by 2026.,Mitigation,policy_traces/001_Benchmark_13_billion_square_feet_of_communitywide_buildings_.json,trace_initiative_policies_valid.csv,parent_statement,"Approach 1: Benchmark, retune, and retrofit existing buildings to reduce emissions from energy use in buildings."
002,sub,"Approach 1: Benchmark, retune, and retrofit existing buildings to reduce emissions from energy use in buildings.","Retrofit 167,500 homes by 2030 to reduce energy costs 28%, prioritizing Low- to Moderate-Income (LMI) homes.",Mitigation,policy_traces/002_Retrofit_167500_homes_by_2030_to_reduce_energy_costs_28_prio.json,trace_initiative_policies_valid.csv,parent_statement,"Approach 1: Benchmark, retune, and retrofit existing buildings to reduce emissions from energy use in buildings."
003,sub,"Approach 1: Benchmark, retune, and retrofit existing buildings to reduce emissions from energy use in buildings.",Adopt a Building Performance Ordinance to ensure benchmarking and retuning of large existing buildings community-wide.,Mitigation,policy_traces/003_Adopt_a_Building_Performance_Ordinance_to_ensure_benchmarkin.json,trace_initiative_policies_valid.csv,parent_statement,"Approach 1: Benchmark, retune, and retrofit existing buildings to reduce emissions from energy use in buildings."
004,sub,"Approach 1: Benchmark, retune, and retrofit existing buildings to reduce emissions from energy use in buildings.","Expand weatherization assistance through repairs and upgrades to improve energy efficiency, safety, and comfort in Low to Moderate Income (LMI) housing.",Mitigation,policy_traces/004_Expand_weatherization_assistance_through_repairs_and_upgrade.json,trace_initiative_policies_valid.csv,parent_statement,"Approach 1: Benchmark, retune, and retrofit existing buildings to reduce emissions from energy use in buildings."
005,sub,"Approach 1: Benchmark, retune, and retrofit existing buildings to reduce emissions from energy use in buildings.",Create a Quality Assurance Verifier position to support the guidelines and applicability of the Building Performance Ordinance.,Mitigation,policy_traces/005_Create_a_Quality_Assurance_Verifier_position_to_support_the_.json,trace_initiative_policies_valid.csv,parent_statement,"Approach 1: Benchmark, retune, and retrofit existing buildings to reduce emissions from energy use in buildings."
006,sub,"Approach 1: Benchmark, retune, and retrofit existing buildings to reduce emissions from energy use in buildings.","Offer monetary and/or non-monetary incentives to promote building retrofits, starting with LMI buildings.",Mitigation,policy_traces/006_Offer_monetary_andor_non_monetary_incentives_to_promote_buil.json,trace_initiative_policies_valid.csv,parent_statement,"Approach 1: Benchmark, retune, and retrofit existing buildings to reduce emissions from energy use in buildings."
007,sub,"Approach 1: Benchmark, retune, and retrofit existing buildings to reduce emissions from energy use in buildings.",Update Miami-Dade County Government's Electricity Master Plan.,Mitigation,policy_traces/007_Update_Miami_Dade_County_Governments_Electricity_Master_Plan.json,trace_initiative_policies_valid.csv,parent_statement,"Approach 1: Benchmark, retune, and retrofit existing buildings to reduce emissions from energy use in buildings."
008,parent,,Approach 2: Expand on-site and off-site renewable energy generation.,Mitigation,policy_traces/008_Approach_2_Expand_on_site_and_off_site_renewable_energy_gene.json,trace_initiative_policies_valid.csv,parent_statement,Approach 2: Expand on-site and off-site renewable energy generation.
009,sub,Approach 2: Expand on-site and off-site renewable energy generation.,"Install 61,725 kW of solar energy by 2030 on County buildings, land, and water (equivalent to 7,498 homes' electricity use for one year).",Mitigation,policy_traces/009_Install_61725_kW_of_solar_energy_by_2030_on_County_buildings.json,trace_initiative_policies_valid.csv,parent_statement,Approach 2: Expand on-site and off-site renewable energy generation.
010,sub,Approach 2: Expand on-site and off-site renewable energy generation.,"Install 794,000 kW of solar energy by 2030 on commercial and residential buildings (equivalent to 104,014 homes' electricity use for one year).",Mitigation,policy_traces/010_Install_794000_kW_of_solar_energy_by_2030_on_commercial_and_.json,trace_initiative_policies_valid.csv,parent_statement,Approach 2: Expand on-site and off-site renewable energy generation.
011,sub,Approach 2: Expand on-site and off-site renewable energy generation.,Maximize participation in utility-scale renewable energy programs.,Mitigation,policy_traces/011_Maximize_participation_in_utility_scale_renewable_energy_pro.json,trace_initiative_policies_valid.csv,parent_statement,Approach 2: Expand on-site and off-site renewable energy generation.
012,sub,Approach 2: Expand on-site and off-site renewable energy generation.,Complete installation of solar on County buildings as identified in Solar Feasibility Study Phase 2.,Mitigation,policy_traces/012_Complete_installation_of_solar_on_County_buildings_as_identi.json,trace_initiative_policies_valid.csv,parent_statement,Approach 2: Expand on-site and off-site renewable energy generation.
013,sub,Approach 2: Expand on-site and off-site renewable energy generation.,Establish the Solar Energy Loan Fund program and similar financial mechanisms in Miami-Dade County.,Mitigation,policy_traces/013_Establish_the_Solar_Energy_Loan_Fund_program_and_similar_fin.json,trace_initiative_policies_valid.csv,parent_statement,Approach 2: Expand on-site and off-site renewable energy generation.
014,sub,Approach 2: Expand on-site and off-site renewable energy generation.,Require new County buildings to be solar ready.,Mitigation,policy_traces/014_Require_new_County_buildings_to_be_solar_ready.json,trace_initiative_policies_valid.csv,parent_statement,Approach 2: Expand on-site and off-site renewable energy generation.
015,sub,Approach 2: Expand on-site and off-site renewable energy generation.,Cut soft costs for installing on-site solar energy.,Mitigation,policy_traces/015_Cut_soft_costs_for_installing_on_site_solar_energy.json,trace_initiative_policies_valid.csv,parent_statement,Approach 2: Expand on-site and off-site renewable energy generation.
016,sub,Approach 2: Expand on-site and off-site renewable energy generation.,Execute an agreement with the U.S. Department of Energy's National Renewable Energy Laboratory (NREL) to pursue mutually beneficial projects to reduce greenhouse gas emissions.,Mitigation,policy_traces/016_Execute_an_agreement_with_the_US_Department_of_Energys_Natio.json,trace_initiative_policies_valid.csv,parent_statement,Approach 2: Expand on-site and off-site renewable energy generation.
017,parent,,Approach 3: Build ultra-low energy buildings.,Mitigation,policy_traces/017_Approach_3_Build_ultra_low_energy_buildings.json,trace_initiative_policies_valid.csv,parent_statement,Approach 3: Build ultra-low energy buildings.
018,sub,Approach 3: Build ultra-low energy buildings.,Reduce energy use of new buildings 20% by 2030 below 2020 levels.,Mitigation,policy_traces/018_Reduce_energy_use_of_new_buildings_20_by_2030_below_2020_lev.json,trace_initiative_policies_valid.csv,parent_statement,Approach 3: Build ultra-low energy buildings.
019,sub,Approach 3: Build ultra-low energy buildings.,Ensure all new County buildings will be Ultra-Low Energy by 2030.,Mitigation,policy_traces/019_Ensure_all_new_County_buildings_will_be_Ultra_Low_Energy_by_.json,trace_initiative_policies_valid.csv,parent_statement,Approach 3: Build ultra-low energy buildings.
020,sub,Approach 3: Build ultra-low energy buildings.,Identify steps to transition to a net-zero ready code.,Mitigation,policy_traces/020_Identify_steps_to_transition_to_a_net_zero_ready_code.json,trace_initiative_policies_valid.csv,parent_statement,Approach 3: Build ultra-low energy buildings.
021,sub,Approach 3: Build ultra-low energy buildings.,Plan for the first Ultra-Low Energy (ULE) or Net Zero Energy (NZE) County building.,Mitigation,policy_traces/021_Plan_for_the_first_Ultra_Low_Energy_ULE_or_Net_Zero_Energy_N.json,trace_initiative_policies_valid.csv,parent_statement,Approach 3: Build ultra-low energy buildings.
022,sub,Approach 3: Build ultra-low energy buildings.,Offer monetary and/or non-monetary incentives to promote construction of ULE or NZE buildings.,Mitigation,policy_traces/022_Offer_monetary_andor_non_monetary_incentives_to_promote_cons.json,trace_initiative_policies_valid.csv,parent_statement,Approach 3: Build ultra-low energy buildings.
023,sub,Approach 3: Build ultra-low energy buildings.,Assess embodied carbon in new construction and create policies and programs to reduce it.,Mitigation,policy_traces/023_Assess_embodied_carbon_in_new_construction_and_create_polici.json,trace_initiative_policies_valid.csv,parent_statement,Approach 3: Build ultra-low energy buildings.
024,parent,,Approach 4: Reduce transportation-related fuel consumption.,Mitigation,policy_traces/024_Approach_4_Reduce_transportation_related_fuel_consumption.json,trace_initiative_policies_valid.csv,parent_statement,Approach 4: Reduce transportation-related fuel consumption.
025,sub,Approach 4: Reduce transportation-related fuel consumption.,Shift 10% of transportation mode away from single-occupant vehicles by 2030.,Mitigation,policy_traces/025_Shift_10_of_transportation_mode_away_from_single_occupant_ve.json,trace_initiative_policies_valid.csv,parent_statement,Approach 4: Reduce transportation-related fuel consumption.
026,sub,Approach 4: Reduce transportation-related fuel consumption.,Electrify the County fleet by 2030: 80% of light vehicles and 50% of buses.,Mitigation,policy_traces/026_Electrify_the_County_fleet_by_2030_80_of_light_vehicles_and_.json,trace_initiative_policies_valid.csv,parent_statement,Approach 4: Reduce transportation-related fuel consumption.
027,sub,Approach 4: Reduce transportation-related fuel consumption.,Transition 30% of communitywide vehicles to electric power by 2030.,Mitigation,policy_traces/027_Transition_30_of_communitywide_vehicles_to_electric_power_by.json,trace_initiative_policies_valid.csv,parent_statement,Approach 4: Reduce transportation-related fuel consumption.
028,sub,Approach 4: Reduce transportation-related fuel consumption.,Reduce greenhouse gas emissions from Miami International Airport and PortMiami operations by 50% by 2030.,Mitigation,policy_traces/028_Reduce_greenhouse_gas_emissions_from_Miami_International_Air.json,trace_initiative_policies_valid.csv,parent_statement,Approach 4: Reduce transportation-related fuel consumption.
029,sub,Approach 4: Reduce transportation-related fuel consumption.,Design an Alternative Workplace Solutions policy and program for Miami-Dade County to maintain and expand employee telecommuting and explore methods to encourage other large employers to implement telecommuting.,Mitigation,policy_traces/029_Design_an_Alternative_Workplace_Solutions_policy_and_program.json,trace_initiative_policies_valid.csv,parent_statement,Approach 4: Reduce transportation-related fuel consumption.
030,sub,Approach 4: Reduce transportation-related fuel consumption.,Implement the Miami-Dade 2045 Bicycle/Pedestrian Master Plan.,Mitigation,policy_traces/030_Implement_the_Miami_Dade_2045_BicyclePedestrian_Master_Plan.json,trace_initiative_policies_valid.csv,parent_statement,Approach 4: Reduce transportation-related fuel consumption.
031,sub,Approach 4: Reduce transportation-related fuel consumption.,Implement Complete Streets and Vision Zero pedestrian and cyclist safety programs.,Mitigation,policy_traces/031_Implement_Complete_Streets_and_Vision_Zero_pedestrian_and_cy.json,trace_initiative_policies_valid.csv,parent_statement,Approach 4: Reduce transportation-related fuel consumption.
032,sub,Approach 4: Reduce transportation-related fuel consumption.,Rapidly deploy premium public transit solutions along SMART Plan corridors to increase ridership and mode shift from single occupancy vehicles.,Mitigation,policy_traces/032_Rapidly_deploy_premium_public_transit_solutions_along_SMART_.json,trace_initiative_policies_valid.csv,parent_statement,Approach 4: Reduce transportation-related fuel consumption.
033,sub,Approach 4: Reduce transportation-related fuel consumption.,Complete a light fleet electrification analysis to guide replacement of County-owned fossil-fuel vehicles with battery-electric vehicles.,Mitigation,policy_traces/033_Complete_a_light_fleet_electrification_analysis_to_guide_rep.json,trace_initiative_policies_valid.csv,parent_statement,Approach 4: Reduce transportation-related fuel consumption.
034,sub,Approach 4: Reduce transportation-related fuel consumption.,Install Visual Guidance Docking System (VGDS) at airports to reduce aircraft idling.,Mitigation,policy_traces/034_Install_Visual_Guidance_Docking_System_VGDS_at_airports_to_r.json,trace_initiative_policies_valid.csv,parent_statement,Approach 4: Reduce transportation-related fuel consumption.
035,parent,,Approach 5: Expand and protect green and blue spaces.,Mitigation,policy_traces/035_Approach_5_Expand_and_protect_green_and_blue_spaces.json,trace_initiative_policies_valid.csv,parent_statement,Approach 5: Expand and protect green and blue spaces.
036,sub,Approach 5: Expand and protect green and blue spaces.,Increase community-wide tree canopy to 30% coverage by 2030.,Adaptation,policy_traces/036_Increase_community_wide_tree_canopy_to_30_coverage_by_2030.json,trace_initiative_policies_valid.csv,parent_statement,Approach 5: Expand and protect green and blue spaces.
037,sub,Approach 5: Expand and protect green and blue spaces.,Ensure all County facilities within the Urban Development Boundary attain at least 30% average canopy coverage and facilities outside the UDB attain at least 50% average canopy coverage by 2030.,Adaptation,policy_traces/037_Ensure_all_County_facilities_within_the_Urban_Development_Bo.json,trace_initiative_policies_valid.csv,parent_statement,Approach 5: Expand and protect green and blue spaces.
038,sub,Approach 5: Expand and protect green and blue spaces.,Double the total non-wetland acreage of natural habitat in preservation.,Mitigation,policy_traces/038_Double_the_total_non_wetland_acreage_of_natural_habitat_in_p.json,trace_initiative_policies_valid.csv,parent_statement,Approach 5: Expand and protect green and blue spaces.
039,sub,Approach 5: Expand and protect green and blue spaces.,"Develop a mitigation policy, based on area impacted, to ensure County-approved development results in a net increase to green infrastructure by the development's completion date.",Adaptation,policy_traces/039_Develop_a_mitigation_policy_based_on_area_impacted_to_ensure.json,trace_initiative_policies_valid.csv,parent_statement,Approach 5: Expand and protect green and blue spaces.
040,parent,,Approach 6: Convert waste to energy.,Mitigation,policy_traces/040_Approach_6_Convert_waste_to_energy.json,trace_initiative_policies_valid.csv,parent_statement,Approach 6: Convert waste to energy.
041,sub,Approach 6: Convert waste to energy.,Generate 48 GWh/year of electricity from cogeneration at wastewater plants by 2030.,Mitigation,policy_traces/041_Generate_48_GWhyear_of_electricity_from_cogeneration_at_wast.json,trace_initiative_policies_valid.csv,parent_statement,Approach 6: Convert waste to energy.
042,sub,Approach 6: Convert waste to energy.,Convert 50% of non-recycled garbage to energy by 2030.,Mitigation,policy_traces/042_Convert_50_of_non_recycled_garbage_to_energy_by_2030.json,trace_initiative_policies_valid.csv,parent_statement,Approach 6: Convert waste to energy.
043,sub,Approach 6: Convert waste to energy.,Increase recycling rates by 10% and cut non-recyclables contamination in half.,Mitigation,policy_traces/043_Increase_recycling_rates_by_10_and_cut_non_recyclables_conta.json,trace_initiative_policies_valid.csv,parent_statement,Approach 6: Convert waste to energy.
044,sub,Approach 6: Convert waste to energy.,"Build a new, more efficient electricity-from-waste facility with onsite solar, designed to charge electric vehicles in the County fleet.",Mitigation,policy_traces/044_Build_a_new_more_efficient_electricity_from_waste_facility_w.json,trace_initiative_policies_valid.csv,parent_statement,Approach 6: Convert waste to energy.
045,sub,Approach 6: Convert waste to energy.,Upgrade cogeneration at wastewater treatment plants to produce 9.6 megawatts of electricity from biogas.,Mitigation,policy_traces/045_Upgrade_cogeneration_at_wastewater_treatment_plants_to_produ.json,trace_initiative_policies_valid.csv,parent_statement,Approach 6: Convert waste to energy.
046,sub,Approach 6: Convert waste to energy.,Upgrade landfill gas collection at the South Dade Landfill.,Mitigation,policy_traces/046_Upgrade_landfill_gas_collection_at_the_South_Dade_Landfill.json,trace_initiative_policies_valid.csv,parent_statement,Approach 6: Convert waste to energy.
047,parent,,Approach 7: Reduce waste and water use.,Mitigation,policy_traces/047_Approach_7_Reduce_waste_and_water_use.json,trace_initiative_policies_valid.csv,parent_statement,Approach 7: Reduce waste and water use.
048,sub,Approach 7: Reduce waste and water use.,Reduce landfill waste per person 50% by 2030.,Mitigation,policy_traces/048_Reduce_landfill_waste_per_person_50_by_2030.json,trace_initiative_policies_valid.csv,parent_statement,Approach 7: Reduce waste and water use.
049,sub,Approach 7: Reduce waste and water use.,Reduce water consumption per person 30% by 2030.,Resource Efficiency,policy_traces/049_Reduce_water_consumption_per_person_30_by_2030.json,trace_initiative_policies_valid.csv,parent_statement,Approach 7: Reduce waste and water use.
050,sub,Approach 7: Reduce waste and water use.,"Create a community-wide food rescue plan in collaboration with community-based organizations, businesses, and farmers.",Mitigation,policy_traces/050_Create_a_community_wide_food_rescue_plan_in_collaboration_wi.json,trace_initiative_policies_valid.csv,parent_statement,Approach 7: Reduce waste and water use.
051,sub,Approach 7: Reduce waste and water use.,Complete a Countywide solid waste characterization study and complete regular updates.,Mitigation,policy_traces/051_Complete_a_Countywide_solid_waste_characterization_study_and.json,trace_initiative_policies_valid.csv,parent_statement,Approach 7: Reduce waste and water use.
052,sub,Approach 7: Reduce waste and water use.,Require waste reduction plans for all large events.,Mitigation,policy_traces/052_Require_waste_reduction_plans_for_all_large_events.json,trace_initiative_policies_valid.csv,parent_statement,Approach 7: Reduce waste and water use.
053,individual,,"Implement the Climate Action Strategy (CAS) to cut Miami-Dade communitywide greenhouse gas emissions 50% by 2030 from 2019 levels, with the goal of achieving net zero by 2050.",Mitigation,policy_traces/053_Implement_the_Climate_Action_Strategy_CAS_to_cut_Miami_Dade_.json,trace_individual_policies_valid.csv,policy_statement,"Implement the Climate Action Strategy (CAS) to cut Miami-Dade communitywide greenhouse gas emissions 50% by 2030 from 2019 levels, with the goal of achieving net zero by 2050."
