cluster_id,cluster_type,role,sector,section_header,policy_statement,parent_statement,parent_row_type,verbatim_text,extraction_rationale,location,location_vulnerability_context,row_key,source_bundle_key,is_atomized_row,is_decomposed,canonical_mechanism,mechanism_description,typology_code,typology_confidence,typology_evidence_quote,secondary_categories,gate_demoted_reason,classification_schema_version,secondary_profile,climate_screen,is_financial_instrument,primary_category,primary_causal_pathway,causal_mechanism_detail,dominant_pathway_test,mechanism_classification_reasoning,mechanism_confidence,mechanism_edge_case_notes,instrument_type,instrument_directness,climate_relevance,key_indicators,co_benefits,instance_edge_case_notes,language_violations,primary_gate_passed,primary_gate_reason,secondary_gate_passed,secondary_gate_reason,rescue_disposition,rescue_reasoning,rescue_confidence,primary_gate_rescued,dropped_by_climate_rescue
0,individual,individual,cross_sector,What has London committed to?,"London is committed to being a zero carbon city by 2050, with the Mayor setting out actions within his powers to achieve this as soon as possible.",,,"The Mayor's London Environment Strategy (May 2018) was one of the first plans of any world city to be compatible with the highest ambition of the Paris Agreement. It commits London to being a zero carbon city by 2050. It sets out the actions the Mayor will take, within his powers, to get there as soon as possible.",Explicit commitment to an economy-wide outcome (zero carbon) with a deadline (2050) and reference to actions the Mayor will take.,London_England,No vulnerability context provided,London_England::d74be073f58d99f06cee6358,London_England::d74be073f58d99f06cee6358,False,False,economy_wide_ghg_target → emissions_reduction_pathway,The strategy commits the city to reaching zero carbon and sets out actions the Mayor will take to drive an economy-wide emissions reduction pathway.,None,0.0,None,None,"evidence quote missing one of: [efficien, kwh, kw·h, per capita, ...]; evidence quote missing secondary subtype token: [efficien, kwh, kw·h, per capita, ...]",guide_secondary_typology_v1,policy_text_evidence_gated,explicit_self,no,Mitigation,Policy target-setting + governance → cross-sector decarbonization actions → ↓ GHG emissions → ↓ atmospheric forcing,"(1) Change in human activity/system: The city adopts a binding or guiding community-wide emissions target (e.g., % reduction by a year, net-zero), aligning planning, budgeting, regulations, and investments across energy, buildings, transport, waste, and industry.  
(2) Mediating physical process: Reduced combustion of fossil fuels, improved energy efficiency, fuel switching/electrification, methane reductions, and other sector measures lower the mass flow of GHGs released to the atmosphere.  
(3) Climate-relevant outcome: Lower community-wide GHG emissions (CO₂e) leading to reduced cumulative atmospheric GHG concentrations and reduced radiative forcing over time.",The single biggest climate-relevant effect of policies using this mechanism is achieving economy-wide reductions in greenhouse gas emissions (often to net-zero) across major sectors.,"1) Dominant causal pathway: The mechanism’s central function is to set an economy-wide emissions outcome that triggers and coordinates decarbonization measures, yielding ↓ GHG emissions.  
2) Why this primary over alternatives: While targets can indirectly improve efficiency or resilience, their defining and largest intended climate effect is emissions mitigation at the community scale, not adaptation (hazard/exposure reduction), not resource efficiency as an end in itself, and not ecosystem-based carbon sequestration as the primary lever.  
3) Edge cases applied: Some targets include “net-zero” via offsets or land-sector sinks; even then, the dominant climate-relevant purpose remains achieving net emissions reductions/neutrality (mitigation). If a document is purely aspirational with no implementation linkage, it is still categorized by intended dominant pathway (mitigation).  
4) Confirm applies to ALL instances: Any policy that sets a community-wide GHG reduction or net-zero target shares the same primary mechanism—economy-wide emissions reduction—regardless of sector mix or local context.  
5) Secondary subtype deferred: Whether delivery relies more on efficiency, electrification, renewables, waste methane controls, offsets, or nature-based sinks requires policy-specific evidence and is deferred to policy-level classification.",0.93,"Targets framed mainly as “climate neutrality” can be met with offsets or external credits; classification remains Mitigation, but downstream interpretation should note whether reductions are in-boundary vs. compensated. Targets limited to municipal operations (not community-wide) would be a different mechanism and should not be conflated.",target-setting,enabling,direct,“London Environment Strategy”; “compatible with the highest ambition of the Paris Agreement”; “commits London to being a zero carbon city by 2050”; “sets out the actions the Mayor will take”,None,"The statement references “actions” but does not specify concrete measures (e.g., standards, incentives, investments), so classification stays at target-setting rather than an implementation instrument.",[],True,matched token: 'ghg',True,no typology code,,,,,
1,individual,individual,cross_sector,How will we get there?,London will follow an emissions pathway aligned with IPCC recommendations to reduce emissions by 60% on 1990 levels by 2030 and by nearly 80% by 2040.,,,Understanding these different pathways has enabled us to set an ambitious emissions pathway in line with the IPCC recommendations. It will see London reduce its emissions by 60 per cent on 1990 levels by 2030 and by nearly 80 per cent by 2040.,Quantified targets with clear baselines and deadlines constitute an extractable mitigation commitment.,London_England,No vulnerability context provided,London_England::0ec284b3d6d9df34e17c4b49,London_England::0ec284b3d6d9df34e17c4b49,False,False,economy_wide_ghg_target → emissions_reduction_pathway,London sets an emissions pathway aligned with IPCC recommendations to guide reductions in overall citywide emissions over time.,None,0.0,None,None,"evidence quote missing one of: [efficien, kwh, kw·h, per capita, ...]; evidence quote missing secondary subtype token: [efficien, kwh, kw·h, per capita, ...]",guide_secondary_typology_v1,policy_text_evidence_gated,explicit_self,no,Mitigation,Policy target-setting + governance → cross-sector decarbonization actions → ↓ GHG emissions → ↓ atmospheric forcing,"(1) Change in human activity/system: The city adopts a binding or guiding community-wide emissions target (e.g., % reduction by a year, net-zero), aligning planning, budgeting, regulations, and investments across energy, buildings, transport, waste, and industry.  
(2) Mediating physical process: Reduced combustion of fossil fuels, improved energy efficiency, fuel switching/electrification, methane reductions, and other sector measures lower the mass flow of GHGs released to the atmosphere.  
(3) Climate-relevant outcome: Lower community-wide GHG emissions (CO₂e) leading to reduced cumulative atmospheric GHG concentrations and reduced radiative forcing over time.",The single biggest climate-relevant effect of policies using this mechanism is achieving economy-wide reductions in greenhouse gas emissions (often to net-zero) across major sectors.,"1) Dominant causal pathway: The mechanism’s central function is to set an economy-wide emissions outcome that triggers and coordinates decarbonization measures, yielding ↓ GHG emissions.  
2) Why this primary over alternatives: While targets can indirectly improve efficiency or resilience, their defining and largest intended climate effect is emissions mitigation at the community scale, not adaptation (hazard/exposure reduction), not resource efficiency as an end in itself, and not ecosystem-based carbon sequestration as the primary lever.  
3) Edge cases applied: Some targets include “net-zero” via offsets or land-sector sinks; even then, the dominant climate-relevant purpose remains achieving net emissions reductions/neutrality (mitigation). If a document is purely aspirational with no implementation linkage, it is still categorized by intended dominant pathway (mitigation).  
4) Confirm applies to ALL instances: Any policy that sets a community-wide GHG reduction or net-zero target shares the same primary mechanism—economy-wide emissions reduction—regardless of sector mix or local context.  
5) Secondary subtype deferred: Whether delivery relies more on efficiency, electrification, renewables, waste methane controls, offsets, or nature-based sinks requires policy-specific evidence and is deferred to policy-level classification.",0.93,"Targets framed mainly as “climate neutrality” can be met with offsets or external credits; classification remains Mitigation, but downstream interpretation should note whether reductions are in-boundary vs. compensated. Targets limited to municipal operations (not community-wide) would be a different mechanism and should not be conflated.",target-setting,enabling,direct,“set an ambitious emissions pathway”; “in line with the IPCC recommendations”; “reduce its emissions by 60 per cent… by 2030”; “nearly 80 per cent… by 2040”,None,No explicit indication the target is legally binding versus aspirational; classified as target-setting regardless because it specifies a quantified pathway and milestones.,[],True,matched token: 'ghg',True,no typology code,,,,,
2,individual,individual,buildings,Key messages,At least 70% of London's buildings need to reach energy performance level EPC C by 2030.,,,Only 35 per cent of homes currently achieve adequate energy efficiency performance (EPC C or above) and many will still be in use by 2050. At least 70 per cent of London's buildings need to reach EPC C by 2030.,Quantified building-efficiency target (share of buildings to EPC C) with deadline (2030).,London_England,No vulnerability context provided,London_England::97c20bf9a782b3f6b84a18d4,London_England::97c20bf9a782b3f6b84a18d4,False,False,building_energy_code → energy_use_reduction,Setting a target for buildings to reach EPC C or above drives energy-efficiency improvements that reduce building energy use and associated emissions.,None,0.0,None,None,"evidence quote missing one of: [ghg, greenhouse gas, greenhouse gases, emission, ...]; row context missing primary/climate token: [ghg, greenhouse gas, greenhouse gases, emission, ...]",guide_secondary_typology_v1,policy_text_evidence_gated,explicit_self,no,Mitigation,Building design/retrofit standards → ↓ delivered energy demand + ↓ on-site fossil fuel combustion → ↓ GHG emissions → ↓ atmospheric forcing,"(1) Change in human activity/system: set for new construction and/or major renovations (and sometimes existing-building performance standards) that raise minimum efficiency, tighten envelopes, improve HVAC/lighting/water-heating performance, and may set electrification or low-carbon heat.  
(2) Mediating physical process: Reduced heat transfer losses, improved system efficiencies (higher COP/AFUE equivalents), better controls and reduced peak loads; reduced combustion of natural gas/oil on-site; lower electricity demand from the grid.  
(3) Climate-relevant outcome: Lower operational (Scope 1 and 2) energy-related GHG emissions over the building lifetime; in net-zero/energy-plus cases, near-zero or net-negative operational emissions depending on grid intensity and on-site generation.","The single biggest climate-relevant effect is reduced building operational energy use (and fuel switching away from fossil combustion), which lowers GHG emissions from energy supply.","1) Dominant causal pathway: These policies act on building energy performance so the largest effect is lowering operational energy consumption and fossil fuel use, which directly reduces GHG emissions.  
2) Why this primary over alternatives: While efficiency also improves “resource efficiency,” the climate-dominant purpose and outcome here is emissions reduction from energy use; therefore Mitigation best matches the primary causal pathway.  
3) Edge cases applied: If a code is framed around resilience (e.g., passive survivability during outages/heatwaves) it could have an adaptation co-benefit, but the canonical mechanism explicitly targets energy/emissions reduction, keeping Mitigation primary.  
4) Applicability to ALL instances: Any policy under “building_energy_code → energy_use_reduction” fundamentally reduces operational energy demand and/or on-site combustion, yielding emissions reductions regardless of city or code stringency.  
5) Note on subtypes: Secondary subtype assignment (e.g., “efficiency,” “electrification,” “net-zero,” “performance standard”) is deferred to policy-level evidence and specific provisions.",0.9,"Some building-code policies can include adaptation-focused elements (cool roofs for heat, flood-proofing, backup power) or embodied-carbon limits; those would introduce additional pathways, but under this canonical mechanism the dominant pathway remains operational energy/emissions reduction (Mitigation).",target-setting,enabling,direct,"""At least 70 per cent of London's buildings""; ""need to reach EPC C""; ""by 2030""; ""energy efficiency performance (EPC C or above)""",Reduced household energy bills; improved indoor thermal comfort; reduced fuel poverty; improved air quality from lower combustion.,"No explicit compliance tool is specified in the text (could be implemented via regulation/EBPS, incentives, or codes), so classification is based on the presence of a quantified goal and deadline (target-setting) rather than a mandate.","['Requirements', 'require']",True,rescued_by_f1_5,True,no typology code,keep,Climate relevance is explicit in the focus on improving building energy efficiency standards. Quotes: policy_statement: 'At least 70% of London's buildings need to reach energy performance level EPC C by 2030.' verbatim_text: 'Only 35 per cent of homes currently achieve adequate energy efficiency performance (EPC C or above)... At least 70 per cent of London's buildings need to reach EPC C by 2030.' Raising EPC ratings is a direct building energy demand reduction measure consistent with mitigation; the absence of an explicit emissions keyword should not cause exclusion. Primary category 'Mitigation' and mechanism 'building_energy_code → energy_use_reduction' are appropriate.,0.86,True,False
5,individual,individual,transport,8. Decarbonising transport and increasing use of active and public transport remains a key objective for London.,"By 2050, all of London's motorised road transport will need to be battery electric or fuel cell electric vehicles.",,,"By 2050, all of London's motorised road transport will need to be battery electric or fuel cell electric vehicles.",Clear technology/transition target for the road transport fleet with a deadline (2050).,London_England,No vulnerability context provided,London_England::c27739a3825a9c803c8fa7d6,London_England::c27739a3825a9c803c8fa7d6,False,False,fleet_electrification → transport_emissions_reduction,Transitioning motorised road transport to battery electric and fuel cell electric vehicles reduces transport greenhouse gas emissions by displacing fossil fuel combustion in vehicles.,None,0.0,None,None,"evidence quote missing one of: [efficien, kwh, kw·h, per capita, ...]; evidence quote missing secondary subtype token: [efficien, kwh, kw·h, per capita, ...]",guide_secondary_typology_v1,policy_text_evidence_gated,explicit_self,no,Mitigation,Transport activity (VMT) shift: ICE → EV → ↓ fossil fuel combustion (tailpipe) + potentially ↓ lifecycle CO₂e → ↓ GHG emissions → ↓ atmospheric forcing,"1) Changed activity/system: The vehicle fleet and miles traveled shift from internal combustion engine (ICE) cars/buses/trucks to battery-electric (and sometimes plug-in hybrid) vehicles, including public fleets and private ownership.  
2) Mediating process: EV drivetrains eliminate tailpipe CO₂ from gasoline/diesel combustion and can reduce total energy per mile; remaining emissions depend on electricity generation and upstream fuel/vehicle lifecycle.  
3) Climate-relevant outcome: Lower CO₂e emissions per mile and reduced total transport-sector emissions, especially as the electricity grid decarbonizes.","Replacing internal-combustion vehicle miles with electric vehicle miles most strongly reduces GHG emissions from fuel combustion (and, depending on grid mix, upstream energy supply), lowering net transportation-sector emissions.","1) Dominant causal pathway: Substitution of ICE travel with EV travel reduces fossil fuel combustion and associated CO₂e emissions—this is a direct mitigation pathway.  
2) Why this primary over alternatives: Although EVs can improve energy efficiency (a resource-efficiency co-benefit) and reduce air pollution/health burdens, the principal climate-relevant effect is emissions reduction rather than hazard reduction (adaptation) or ecosystem carbon/heat services (nature-based).  
3) Edge cases applied: If a policy focused only on electrification for resilience (e.g., backup power for emergency response fleets) without an emissions objective, classification might differ; however, the canonical mechanism explicitly links fleet electrification to transport emissions reduction, keeping Mitigation dominant. Grid carbon intensity affects magnitude but not the direction of the primary pathway.  
4) Confirm applies to ALL instances sharing this mechanism: Any policy whose mechanism is “fleet electrification → transport emissions reduction” fundamentally operates by reducing CO₂e from combustion per mile and/or total combustion miles, which is mitigation.  
5) Secondary subtype assignment deferred: Any further subtype (e.g., public fleet vs private adoption; infrastructure vs mandates; equity-oriented design) requires policy-specific evidence and is not assigned at the mechanism level.",0.93,"If implemented mainly via promoting hybrids (non-plug-in) or if electricity is extremely high-carbon, net GHG benefits can be smaller; nonetheless the mechanism’s dominant intent/effect remains mitigation through reduced combustion-related emissions. If a policy bundles electrification with VMT growth, rebound could partially offset reductions—this affects impact size, not primary category.",target-setting,direct,direct,"""By 2050""; ""all of London's motorised road transport""; ""will need to be""; ""battery electric or fuel cell electric vehicles""",Improved local air quality (NOx/PM) and potential noise reduction; energy security benefits.,"Could be interpreted as a future regulatory mandate if embedded in binding legislation, but the text as given reads as an aspirational/strategic target without specifying enforcement mechanism or instrument details.",[],True,matched token: 'emission',True,no typology code,,,,,
