0,parent_with_subs,sub,water,"## 2) Response in the event of a disaster / ## i Collection, analysis, and provision of information","TMG will research and build AI-based systems to support floodgate operations by predicting water level fluctuations using big data, consider inflow prediction tech for stormwater pumps, and promote real-time sewer water level monitoring via multifunctional manhole covers shared with municipalities.","TMG will promote structural and non-structural measures for natural disasters using state-of-the-art technologies and urban facility development, and further improve initiatives to cope with larger typhoons and more frequent heavy rains.",standalone parent policy,"## Using AI for predicting water levels

- ' Carry out research on how to build a system that supports the operation of floodgates etc. using AI to analyze various big data...
- ' Consider the development of inflow prediction technology that supports the operation of stormwater pumps.
- ' Encourage municipalities... by utilizing a multifunctional manhole cover that measures water levels in sewerage pipes in real time and sharing the measurements...","Specific digital/AI interventions with defined operational purposes (floodgates, pumps, sewer monitoring).",Tokyo_Japan,No vulnerability context provided,Tokyo_Japan::86ce467b1bd877ae10ce30fa,Tokyo_Japan::86ce467b1bd877ae10ce30fa,False,False,environmental_monitoring_system → adaptation_planning_support,It carries out research to build AI-based water level prediction and real-time sewer water level monitoring to support floodgate and stormwater pump operations and improve flood response.,None,0.0,None,None,evidence_quote not substring-grounded in source,guide_secondary_typology_v1,policy_text_evidence_gated,explicit_self,no,Adaptation,Monitoring & analytics capacity → better risk information & decision-making → improved planning/early action → ↓ climate vulnerability (↓ exposure/sensitivity),"(1) Change in human activity/system: The city upgrades internal monitoring systems, datasets, methodologies (e.g., inventories, models, surveys), and digital tools, and builds staff/process capacity to use them in ongoing planning.  
(2) Mediating process: Improved measurement, tracking, and analysis of climate hazards, vulnerabilities, and performance indicators reduces uncertainty and supports timely identification of risks and evaluation of options.  
(3) Climate-relevant outcome: More effective and targeted adaptation plans and interventions are selected and implemented, leading to reduced vulnerability and improved preparedness for climate impacts.",The single biggest climate-relevant effect is improved climate risk management by generating better information and tools that enable more effective adaptation planning and response.,"1) Dominant causal pathway: The mechanism’s direct effect is informational/institutional—better monitoring and analytics that most strongly improve climate risk identification and adaptive decision-making, leading to reduced vulnerability.  
2) Why this primary over alternatives: While similar systems can also support mitigation tracking (e.g., emissions inventories) and resource efficiency management, the mechanism as stated (“adaptation planning support” and internal climate planning tools) most directly maps to adaptive capacity and vulnerability reduction rather than immediate emissions reduction or efficiency gains.  
3) Edge cases applied: If the monitoring system is explicitly centered on GHG accounting/MRV for emissions caps, it could be mitigation-dominant; if centered on energy/water efficiency KPI management, it could be resource-efficiency-dominant. Here, the canonical mechanism explicitly frames adaptation planning support, so Adaptation is selected.  
4) Confirm primary applies to ALL instances sharing this mechanism: Any policy whose core is improving environmental/climate monitoring and methods to support adaptation planning primarily functions by increasing adaptive capacity and improving vulnerability-reducing decisions, even if it has co-benefits for mitigation tracking.  
5) Secondary subtype assignment deferred: Whether a specific policy primarily supports hazards/early warning, infrastructure resilience planning, or mitigation MRV is policy-evidence-specific and should be assigned at the individual policy level, not at the mechanism level.",0.74,"Some representative examples (e.g., detailed building modeling to support emissions reduction) could be mitigation-enabling rather than adaptation-enabling; classification here follows the canonical mechanism framing (adaptation planning support) and treats mitigation support as a potential co-benefit/secondary pathway.",planning-strategy,direct,direct,"""build a system that supports the operation of floodgates""; ""using AI to analyze various big data""; ""predicting water level fluctuations""; ""inflow prediction technology""; ""operation of stormwater pumps""; ""measures water levels in sewerage pipes in real time""; ""sharing the measurements""",Improved routine water/sewer infrastructure management and maintenance efficiency; potential public safety benefits beyond climate-related flooding.,Could also be framed as an enabling information/monitoring program; classified as direct because it is explicitly intended to support real-time flood/stormwater operations and water-level prediction (immediate adaptation function rather than general data modernization).,[],True,matched token: 'adapt',True,no typology code,"TMG will promote structural and non-structural measures for natural disasters using state-of-the-art technologies and urban facility development, and further improve initiatives to cope with larger typhoons and more frequent heavy rains.",,,,,,,
0,parent_with_subs,sub,water,"## 2) Response in the event of a disaster / ## i Collection, analysis, and provision of information","TMG will improve water-disaster information provision by adding flood forecast/water level information rivers, strengthening the Flood Control Integrated Information System, starting operation of the Storm Surge Disaster Prevention Information System, and continuing Tokyo Amesh rainfall information.","TMG will promote structural and non-structural measures for natural disasters using state-of-the-art technologies and urban facility development, and further improve initiatives to cope with larger typhoons and more frequent heavy rains.",standalone parent policy,"## Improved provision of information on disaster preparedness

- ' ...TMG will consider specifying additional flood forecast rivers 1 and water level information rivers 2...
- ' Improve the provision of information... by strengthening the Flood Control Integrated Information System and starting the operation of the Storm Surge Disaster Prevention Information System.
- ' Continue to provide rainfall information through Tokyo Amesh.",Concrete system and operational improvements for public warnings and information.,Tokyo_Japan,No vulnerability context provided,Tokyo_Japan::f36de0e258751b9cb8762011,Tokyo_Japan::f36de0e258751b9cb8762011,False,False,water_disaster_information_systems → flood_risk_preparedness_and_response,"TMG will strengthen and operate systems that provide flood, water-level, storm-surge, and rainfall information to improve preparedness and response for water-related disasters.",None,0.0,None,None,"evidence quote missing one of: [ecosystem, habitat, tree, trees, ...]; evidence quote missing secondary subtype token: [ecosystem, habitat, tree, trees, ...]",guide_secondary_typology_v1,policy_text_evidence_gated,explicit_self,no,Adaptation,Climate hazard (flooding/storm surge/extreme rainfall) → improved monitoring/forecasting & warning → earlier action/response → ↓ exposure & vulnerability → ↓ climate damages,"1) Change in human activity/system: Deploy, strengthen, and operate hydrometeorological monitoring, forecasting, and public information/alert systems (e.g., rainfall radar, river gauge networks, storm-surge models, integrated dissemination platforms) and associated response protocols.  
2) Mediating physical/process pathway: Improved detection and prediction of hazardous hydrological conditions increases lead time and decision quality for evacuations, protective actions (e.g., temporary barriers, pump operation), and emergency management.  
3) Climate-relevant outcome: Reduced human and economic losses from climate-related water disasters (especially as heavy precipitation and coastal surge risks intensify), i.e., increased resilience and reduced disaster impacts.","The single biggest climate-relevant effect is reducing flood impacts (loss of life, damage, and disruption) by improving early warning and emergency response to extreme rainfall, river flooding, and storm surge.","1) Dominant causal pathway: The mechanism acts on disaster preparedness/response—turning climate hazard information into earlier action—thereby reducing exposure and vulnerability to floods and storm surge.  
2) Why this primary over alternatives: While information systems may have minor co-benefits (e.g., operational efficiency), they do not primarily reduce energy use/GHGs (Mitigation) nor primarily optimize resource inputs (Resource Efficiency) nor enhance ecosystems (Nature-Based Solutions).  
3) Edge cases applied: If an information system were explicitly used mainly to optimize water/energy operations for emissions reductions, classification could shift, but that is not the typical or dominant purpose of flood/storm-surge warning systems.  
4) Applicability to ALL instances: Any policy under this canonical mechanism—flood/water-level/storm-surge/rainfall information provision aimed at preparedness and response—has its main climate effect through reduced disaster risk and impacts, i.e., Adaptation.  
5) Secondary subtype note: More specific adaptation subtype (e.g., early warning systems, emergency management, climate services) should be assigned based on policy-level evidence and is deferred.",0.93,"If deployed primarily for real-time control that reduces emissions (e.g., optimizing pump energy with explicit GHG targets), there could be a mitigation/resource-efficiency secondary effect; however, the canonical mechanism as stated is clearly centered on preparedness/response and impact reduction.",infrastructure-investment,direct,direct,"""specifying additional flood forecast rivers""; ""water level information rivers""; ""strengthening the Flood Control Integrated Information System""; ""starting the operation of the Storm Surge Disaster Prevention Information System""; ""provide rainfall information through Tokyo Amesh""",None,"Could be interpreted as an information-disclosure instrument, but the dominant action is system strengthening/operation (IT and monitoring infrastructure), so infrastructure-investment is the best fit.",[],True,matched token: 'flood',True,no typology code,"TMG will promote structural and non-structural measures for natural disasters using state-of-the-art technologies and urban facility development, and further improve initiatives to cope with larger typhoons and more frequent heavy rains.",,,,,,,
0,parent_with_subs,sub,governance,## 2) Response in the event of a disaster / ## ii Enhancement of the system,TMG will strengthen inter-organizational disaster response by enabling liaison staff dispatch to all municipalities and running PDCA-based practical training for large storm/flood scenarios to update plans and manuals.,"TMG will promote structural and non-structural measures for natural disasters using state-of-the-art technologies and urban facility development, and further improve initiatives to cope with larger typhoons and more frequent heavy rains.",standalone parent policy,"## Strengthening cooperation with related organizations

- ' Strengthen our seamless disaster response system by building a system to dispatch liaison staff to all municipalities in Tokyo as needed...
- ' Actively implement the PDCA cycle... through practical training assuming large-scale storms and flooding, and then reflect the results in various plans and manuals.",Defines a concrete coordination mechanism (liaison dispatch) and continuous improvement process (PDCA with training).,Tokyo_Japan,No vulnerability context provided,Tokyo_Japan::9a92d9124752f39d1ea14139,Tokyo_Japan::9a92d9124752f39d1ea14139,False,False,adaptation_planning_framework → institutional_adaptive_capacity,"The government plans to improve storm and flood response by dispatching liaison staff, running PDCA-based training exercises, and using the results to update disaster plans and manuals, strengthening institutional adaptive capacity.",None,0.0,None,None,"evidence quote missing one of: [ecosystem, habitat, tree, trees, ...]; evidence quote missing secondary subtype token: [ecosystem, habitat, tree, trees, ...]",guide_secondary_typology_v1,policy_text_evidence_gated,explicit_self,no,Adaptation,Climate hazard → preparedness/planning capacity → ↓ exposure & ↓ vulnerability → ↓ climate impacts,"(1) Change in human/system activity: Cities implement structured climate preparedness and resilience planning (risk/vulnerability assessments, emergency management optimization, cross-agency coordination, and readiness protocols).  
(2) Mediating physical/social process: Better information, governance, and operational readiness enables earlier warnings, faster response, targeted protection of vulnerable groups, and continuity of critical services during extreme events.  
(3) Climate-relevant outcome: Reduced morbidity/mortality and reduced disruption/damages from extreme weather and other climate stressors; increased institutional adaptive capacity over time.","The single biggest climate-relevant effect is reduced impacts (health, safety, service disruption, damages) from climate hazards through improved preparedness, coordination, and response capacity.","1) Dominant causal pathway: climate hazards are anticipated and managed via planning/readiness, which reduces exposure and vulnerability and therefore reduces adverse impacts—an adaptation pathway.  
2) Why this primary over alternatives: while planning can incidentally influence mitigation (e.g., integrating emissions considerations), the core mechanism described and shared across examples is preparedness and resilience capacity, not GHG reduction (Mitigation), efficiency (Resource Efficiency), or ecosystem-mediated benefits (Nature-Based Solutions).  
3) Edge cases applied: some “resilience planning” documents may include mitigation measures, but that would be a different mechanism; this canonical mechanism is specifically institutional adaptive capacity and readiness for extremes/health impacts.  
4) Applicability to ALL instances: any policy that fits “adaptation planning framework → institutional adaptive capacity” primarily functions by improving governance/readiness to reduce climate impacts, so Adaptation remains the correct primary category across contexts.  
5) Secondary subtype assignment is deferred: details like whether it is heat-health focused, flood emergency management, or broader resilience governance require policy-specific evidence and are not assigned at the mechanism level.",0.9,"Plans labeled “climate preparedness” may bundle mitigation actions (e.g., decarbonization roadmaps); if the dominant implemented content is emissions reduction rather than hazard-impact reduction, that would warrant a different mechanism/category. Here, the stated chain is clearly preparedness/readiness and health risk reduction from extremes.",planning-strategy,direct,direct,"""dispatch liaison staff to all municipalities""; ""Strengthen our seamless disaster response system""; ""PDCA cycle""; ""practical training assuming large-scale storms and flooding""; ""reflect the results in various plans and manuals""",Improved general disaster readiness for non-climate hazards; enhanced inter-organizational coordination and administrative efficiency,"Could be interpreted as an operational capacity-building program; however, the explicit linkage to updating ""plans and manuals"" via PDCA and drills supports classifying it under planning/strategy rather than an incentive or regulatory approach.",[],True,matched token: 'adapt',True,no typology code,"TMG will promote structural and non-structural measures for natural disasters using state-of-the-art technologies and urban facility development, and further improve initiatives to cope with larger typhoons and more frequent heavy rains.",,,,,,,
0,parent_with_subs,sub,transport,## 2) Response in the event of a disaster / ## ii Enhancement of the system,"TMG will enhance cargo transport during disasters via agreements with businesses, practical training, drone-based logistics demonstrations, and systems enabling bidirectional communication with cargo vehicles.","TMG will promote structural and non-structural measures for natural disasters using state-of-the-art technologies and urban facility development, and further improve initiatives to cope with larger typhoons and more frequent heavy rains.",standalone parent policy,"## Enhancement of the cargo transport system

- ' Enhance the cargo transport system by concluding agreements with businesses...
- ' Carry out research and demonstration experiments in model areas to build a cargo transport system using drones.
- ' Develop a more efficient cargo transport system by building a system that enables bidirectional communication between TMG and cargo transport vehicles.","Specific logistics resilience actions including agreements, drills, drone demos, and comms systems.",Tokyo_Japan,No vulnerability context provided,Tokyo_Japan::7fa0093ecf2d4ed8abebafa3,Tokyo_Japan::7fa0093ecf2d4ed8abebafa3,False,False,disaster_resilient_freight_logistics_system → supply_chain_resilience,"The policy enhances cargo transport capabilities during disasters through business agreements, drone logistics demonstrations, and bidirectional communication systems with freight vehicles to improve logistics continuity and supply-chain resilience.",None,0.0,None,None,evidence_quote not substring-grounded in source,guide_secondary_typology_v1,policy_text_evidence_gated,explicit_self,no,Adaptation,Climate hazard/disaster shock → logistics system preparedness & redundancy → ↓ freight/supply-chain service disruption → ↓ vulnerability/impacts,"(1) Change in human activity/system: Governments and freight stakeholders establish pre-arranged mutual aid/business agreements, conduct drills, deploy alternative delivery modalities (e.g., drones), and implement real-time two-way communications with freight vehicles to coordinate routing and deliveries during emergencies.  
(2) Mediating process: Increased operational redundancy, situational awareness, and coordination enable rapid reconfiguration of freight flows when infrastructure is damaged or conditions are dangerous.  
(3) Climate-relevant outcome: Reduced exposure/sensitivity of communities and the economy to disaster-related supply interruptions (e.g., food, medicine, fuel), thereby lowering disaster impacts under climate-amplified extremes.","The single biggest climate-relevant effect is reduced disruption impacts from hazards by maintaining freight/logistics operations and critical supplies during disasters (i.e., improved resilience).","1) Dominant causal pathway: hazard event → maintained freight functionality via preparedness/coordination → reduced disruption and impacts (adaptation/resilience).  
2) Why this primary over alternatives: While certain tools (e.g., drones, optimized communication) could marginally affect emissions, the main climate-relevant effect across policies using this mechanism is reduced vulnerability to disruptions, not systematic GHG reduction or energy/resource efficiency.  
3) Edge cases applied: If a policy framed “resilient logistics” primarily as electrification/efficiency upgrades, it could shift toward Mitigation/Resource Efficiency; however, this canonical mechanism is explicitly about disaster continuity and response capability.  
4) Confirm applies to ALL instances: Any policy matching “disaster-resilient freight logistics system → supply-chain resilience” is centered on maintaining logistics during disruptive events, which is adaptation by dominant effect.  
5) Secondary subtype assignment deferred: More granular subtypes (e.g., critical infrastructure resilience, emergency management, digital systems) depend on policy-level evidence and are not assigned here.",0.86,Potential overlap if “drone logistics” or ICT upgrades are primarily justified/used for routine efficiency or decarbonization; classify as Adaptation here because the stated mechanism is disaster operations continuity and supply-chain resilience.,planning-strategy,enabling,direct,"""Enhance the cargo transport system""; ""concluding agreements with businesses""; ""research and demonstration experiments""; ""model areas""; ""cargo transport system using drones""; ""Develop a more efficient cargo transport system""; ""building a system that enables bidirectional communication""",Improved day-to-day logistics efficiency; innovation/industry development for drones/ICT; potential congestion and air-pollution reductions from more efficient routing (not explicitly stated).,"Could also be coded as infrastructure-investment due to “building a system” (ICT/communications) and as an incentive-program if the demonstrations are grant-funded, but the text most strongly signals a coordinated preparedness plan with pilots and agreements rather than a specific funding or mandate instrument.",[],True,matched token: 'resilien',True,no typology code,"TMG will promote structural and non-structural measures for natural disasters using state-of-the-art technologies and urban facility development, and further improve initiatives to cope with larger typhoons and more frequent heavy rains.",,,,,,,
