cluster_id,cluster_type,role,sector,section_header,policy_statement,parent_statement,parent_row_type,verbatim_text,extraction_rationale,location,location_vulnerability_context,row_key,source_bundle_key,is_atomized_row,is_decomposed,canonical_mechanism,mechanism_description,typology_code,typology_confidence,typology_evidence_quote,secondary_categories,gate_demoted_reason,classification_schema_version,secondary_profile,climate_screen,is_financial_instrument,primary_category,primary_causal_pathway,causal_mechanism_detail,dominant_pathway_test,mechanism_classification_reasoning,mechanism_confidence,mechanism_edge_case_notes,instrument_type,instrument_directness,climate_relevance,key_indicators,co_benefits,instance_edge_case_notes,language_violations,primary_gate_passed,primary_gate_reason,secondary_gate_passed,secondary_gate_reason,parent_policy_name,rescue_disposition,rescue_reasoning,rescue_confidence,primary_gate_rescued,dropped_by_climate_rescue,primary_category_original,primary_category_rescue_corrected
0,parent_with_subs,parent,cross_sector,## Natural Disasters — ## Efforts for the Future,"TMG will promote structural and non-structural measures for natural disasters using state-of-the-art technologies and urban facility development, and further improve initiatives to cope with larger typhoons and more frequent heavy rains.",,standalone parent policy,"## Efforts for the Future

In response to natural threats, such as floods, inland floods, storm surges, and landslides due to intensified heavy rains and typhoons, TMG will promote the utilization of state-of-the-art technologies and the development of urban facilities in both structural and non-structural aspects.

To cope with increasingly larger typhoons and more frequent heavy rains in recent years, TMG will further improve our initiatives.",Introduces an umbrella set of measures with multiple structured subcomponents (structural and non-structural) detailed below.,Tokyo_Japan,No vulnerability context provided,Tokyo_Japan::f1b20469037c8b4fc2c5750c,Tokyo_Japan::f1b20469037c8b4fc2c5750c,False,False,flood_and_storm_resilience_infrastructure_and_measures → disaster_risk_reduction,"TMG will promote advanced technologies and develop urban facilities using structural and non-structural measures to better cope with larger typhoons and heavier rains, reducing disaster impacts such as flooding, storm surges, and landslides.",None,0.0,None,None,"evidence quote missing one of: [hazard, exposure, vulnerab, resilien, ...]; evidence quote missing secondary subtype token: [ecosystem, habitat, tree, trees, ...]",guide_secondary_typology_v1,policy_text_evidence_gated,explicit_self,no,Adaptation,Climate hazard (↑ extreme rain/typhoons) → resilience measures/infrastructure → ↓ exposure & vulnerability → ↓ disaster impacts,"(1) Change in system/activity: Cities plan, build, upgrade, and operate flood/storm resilience infrastructure and implement preparedness/land-use and early-warning measures (structural and non-structural).  
(2) Mediating process: Physical protection and hydrologic/geomorphic risk management (e.g., increased drainage capacity, barriers/levees, retention/storage, slope stabilization) plus improved forecasting/response reduces hazard transmission to people/assets.  
(3) Climate-relevant outcome: Reduced disaster risk and impacts (fewer/inferior floods and storm-surge damages, fewer landslide impacts, lower service disruption and health/safety harms) under current and future climate extremes.","The single biggest climate-relevant effect is reducing losses and disruption by lowering exposure and vulnerability to flooding, storm surge, and landslides during extreme rainfall/typhoon events.","1) Dominant causal pathway: climate hazards (heavier rain, larger typhoons) are anticipated, and measures are implemented to reduce exposure/vulnerability and thus reduce damages—an adaptation risk-reduction pathway.  
2) Why this primary over alternatives: While some measures can have incidental mitigation/resource-efficiency co-benefits (e.g., efficient pumps, reduced reconstruction emissions), the principal intended and largest effect is disaster impact reduction, not emissions reduction or energy/material efficiency.  
3) Edge cases applied: If a specific policy instance were solely about lowering emissions from disaster response/reconstruction, it could shift toward Mitigation, but that is not inherent to this canonical mechanism; here, the mechanism is explicitly resilience to hazards.  
4) Confirm applicability to ALL instances: Any policy fitting “flood and storm resilience infrastructure and measures → disaster risk reduction” primarily functions by reducing climate risk from extreme events, which is categorically Adaptation.  
5) Secondary subtype note: More granular subtyping (e.g., coastal surge protection vs. pluvial flooding vs. landslide stabilization; structural vs. non-structural) is deferred to policy-level evidence and does not change the primary category.",0.93,"Some projects (e.g., green infrastructure/wetland restoration) may also enhance carbon sinks or resource efficiency, but if the dominant intent/effect remains flood/storm risk reduction, the primary category stays Adaptation; mitigation co-benefits should be treated as secondary at the policy level.",infrastructure-investment,direct,direct,"“floods, inland floods, storm surges, and landslides”; “intensified heavy rains and typhoons”; “utilization of state-of-the-art technologies”; “development of urban facilities”; “structural and non-structural aspects”; “cope with increasingly larger typhoons and more frequent heavy rains”; “further improve our initiatives”",Potential general disaster-risk reduction and public safety benefits beyond climate-driven events; potential co-benefits for urban service reliability (not specified).,"Non-structural measures are mentioned but not described (e.g., planning, warnings, zoning), so classification is anchored on the clearly stated “development of urban facilities,” which most strongly signals infrastructure investment rather than a planning/strategy instrument.",[],True,matched token: 'resilien',True,no typology code,,,,,,,,
0,parent_with_subs,sub,water,"## (1) Structural measures / ## i Development of rivers, sewerage systems, and coastal conservation facilities","TMG will develop regulating reservoirs (including extending the Wide-Area Regulating Reservoir under Loop Road No. 7 as an underground river), improve river discharge capacity in the Tama area, and implement preventive river maintenance using ICT/AI for inspections.","TMG will promote structural and non-structural measures for natural disasters using state-of-the-art technologies and urban facility development, and further improve initiatives to cope with larger typhoons and more frequent heavy rains.",standalone parent policy,"## Measures for rivers against heavy rains

- ' Promote the development of regulating reservoirs under construction, such as the Wide-Area Regulating Reservoir under Loop Road No. 7, in parallel with that of river revetment.
- ' Proceed with the study to operationalize new regulating reservoirs and extend the Wide-Area Regulating Reservoir under Loop Road No. 7 by making it an underground river.
- ' In the Tama area damaged by Typhoon Hagibis in 2019, TMG will improve the discharge capacity of rivers through local improvements.

## Promotion of strategic maintenance of rivers

- ' Steadily implement maintenance based on a preventive maintenance plan...
- ' Ensure more efficient and sophisticated inspections through the introduction of ICT/AI...","Specific infrastructure and maintenance actions for rivers with clear verbs ('promote,' 'proceed,' 'will improve,' 'introduce ICT/AI').",Tokyo_Japan,No vulnerability context provided,Tokyo_Japan::189d9d533ade5293ea602b19,Tokyo_Japan::189d9d533ade5293ea602b19,False,False,river_flood_management_infrastructure → flood_risk_reduction,"TMG will develop and extend regulating reservoirs, improve river discharge capacity, and use ICT/AI-enabled preventive maintenance to help reduce flooding impacts during heavy rains.",None,0.0,None,None,"evidence quote missing one of: [hazard, exposure, vulnerab, resilien, ...]; evidence quote missing secondary subtype token: [ecosystem, habitat, tree, trees, ...]",guide_secondary_typology_v1,policy_text_evidence_gated,explicit_self,no,Adaptation,Climate hazard (heavy rainfall/river flooding) → flood management infrastructure & operations → ↓ flood extent/peak discharge → ↓ exposure & damages,"(1) Changes the built water-management system by adding/expanding regulating reservoirs (detention/underground storage), improving river/channel discharge capacity, and enhancing inspection/maintenance using ICT/AI to keep assets functioning. (2) Physical processes include temporary storage and delayed release of runoff, increased conveyance to reduce overtopping, and reduced failure/blockage risk through better maintenance—together lowering flood peaks and inundation probability/extent. (3) Climate-relevant outcome is reduced vulnerability to intensified precipitation and flood events (less inundation, infrastructure disruption, and economic/social losses).",The single biggest climate-relevant effect is reducing flood impacts (exposure/damage) from extreme rainfall by increasing river system capacity and operational reliability.,"1) Dominant causal pathway: addresses a climate hazard (extreme rainfall/river flooding) by increasing system capacity and reliability, leading to reduced flood exposure and damage.  
2) Why Adaptation over alternatives: while there may be minor mitigation co-benefits (e.g., reduced disaster-related emissions) or resource-efficiency aspects, the primary intended and largest effect is risk reduction from climate-driven flooding.  
3) Edge cases applied: if reservoirs were primarily for water supply/hydropower or if measures were mainly to reduce energy use, classification could shift; here, detention/discharge and maintenance are explicitly framed for flood-impact reduction.  
4) Applicability to ALL instances: any policy using “river flood management infrastructure → flood risk reduction” has the same dominant hazard-to-risk-reduction pathway, so Adaptation remains the primary category.  
5) Note on subtypes: secondary subtype assignment (e.g., grey infrastructure vs. hybrid/green-grey, early warning integration) is deferred to policy-level evidence.",0.92,"If “regulating reservoirs” are operated mainly for water supply/energy and only secondarily for flood control, or if projects include substantial ecosystem restoration (e.g., floodplain reconnection) as the main lever, the primary category could shift (Resource Efficiency or Nature-Based Solutions). Here, the described lever is engineered flood control and operational maintenance, so Adaptation is straightforward.",infrastructure-investment,direct,direct,"""Measures for rivers against heavy rains""; ""development of regulating reservoirs""; ""extend...by making it an underground river""; ""improve the discharge capacity of rivers""; ""maintenance based on a preventive maintenance plan""; ""introduction of ICT/AI""",Reduced routine flood nuisance and disruption; improved public safety and emergency accessibility; potential water-quality/ecosystem co-benefits from better river management (not explicitly stated).,Includes both capital works (reservoirs/discharge upgrades) and operational/maintenance modernization (ICT/AI inspections); overall best classified as infrastructure investment because the dominant measures are physical flood-control upgrades.,[],True,matched token: 'flood',True,no typology code,"TMG will promote structural and non-structural measures for natural disasters using state-of-the-art technologies and urban facility development, and further improve initiatives to cope with larger typhoons and more frequent heavy rains.",,,,,,,
0,parent_with_subs,sub,water,"## (1) Structural measures / ## i Development of rivers, sewerage systems, and coastal conservation facilities","TMG will develop sewerage trunk lines and storage to handle 75 mm/hour rainfall in high-risk areas, verify sewerage capacity via runoff simulation for 75 mm/hour rainfall, and strengthen countermeasures in newly identified high-risk districts.","TMG will promote structural and non-structural measures for natural disasters using state-of-the-art technologies and urban facility development, and further improve initiatives to cope with larger typhoons and more frequent heavy rains.",standalone parent policy,"## Development of sewerage facilities

- ' Develop large trunk lines and storage facilities that can handle precipitation of 75 mm/hour...
- ' By utilizing runoff analysis simulation technology, TMG will verify the capacity of sewerage facilities in case of precipitation of 75 mm/hour, add new districts at high risk of inundation, and strengthen the relevant countermeasures.",Contains a quantifiable design standard (75 mm/hour) and concrete infrastructure and analytical actions.,Tokyo_Japan,No vulnerability context provided,Tokyo_Japan::df440b383eabf16eddbfa67d,Tokyo_Japan::df440b383eabf16eddbfa67d,False,False,stormwater_sewerage_capacity_upgrade → urban_flood_risk_reduction,TMG will develop and verify sewerage trunk lines and storage capacity for heavy rainfall and strengthen countermeasures in high-risk districts to reduce inundation and flood impacts.,None,0.0,None,None,evidence_quote not substring-grounded in source,guide_secondary_typology_v1,policy_text_evidence_gated,explicit_parent,no,Adaptation,Climate hazard (extreme rainfall) → ↑ stormwater/sewerage conveyance + storage → ↓ surface inundation/urban flooding → ↓ exposure and damage,"(1) Changed system: Municipal stormwater/sewerage infrastructure is expanded/upsized (trunk lines, detention/storage, and targeted countermeasures in high-risk districts) and planning/verification is improved via runoff simulation. (2) Mediating process: Greater hydraulic capacity and temporary storage reduces surcharge/overflow and peak runoff on streets, lowering flood depth/extent and frequency for a given rainfall intensity. (3) Climate-relevant outcome: Reduced vulnerability to heavier downpours (a climate-amplified hazard), resulting in fewer flood impacts on people, property, and critical services.",The single biggest climate-relevant effect is lowering urban flood/inundation risk and damage during extreme rainfall events by increasing drainage and storage capacity.,"1) Dominant causal pathway: managing a climate hazard (extreme rainfall) by increasing drainage/storage capacity to reduce inundation impacts.  
2) Why this primary over alternatives: while construction can have minor mitigation co-effects (embodied emissions) or operational energy changes (pumping), the intended and largest climate-relevant benefit is risk reduction from flooding—an adaptation outcome.  
3) Edge cases applied: if upgrades are primarily for combined sewer overflow water-quality compliance or energy optimization, categorization could shift, but this mechanism is explicitly framed around heavy rainfall and flood/inundation reduction.  
4) Applies to ALL instances: any policy that upgrades stormwater/sewerage capacity to handle heavier rainfall shares the same primary outcome of reduced flood risk/exposure.  
5) Secondary subtype assignment (e.g., “grey infrastructure flood protection,” “critical infrastructure resilience”) is deferred to policy-level evidence and is not set here.",0.93,"If implemented mainly to reduce wastewater overflows/pollution (water-quality compliance) rather than flood-risk reduction, or if coupled with significant energy-intensive pumping changes, secondary effects could become more salient; however, for this canonical mechanism the primary remains flood-risk adaptation.",infrastructure-investment,direct,direct,“Develop large trunk lines and storage facilities”; “handle precipitation of 75 mm/hour”; “runoff analysis simulation technology”; “verify the capacity of sewerage facilities”; “high risk of inundation”; “strengthen the relevant countermeasures”,"Potential water quality/sanitation improvements and reduced combined sewer overflow incidents, but not explicitly stated.","Includes an enabling component (capacity verification via runoff simulation and adding new high-risk districts), but the dominant instrument is physical sewerage infrastructure development, so classified as infrastructure-investment rather than planning-strategy.",[],True,matched token: 'flood',True,no typology code,"TMG will promote structural and non-structural measures for natural disasters using state-of-the-art technologies and urban facility development, and further improve initiatives to cope with larger typhoons and more frequent heavy rains.",,,,,,,
0,parent_with_subs,sub,water,"## (1) Structural measures / ## i Development of rivers, sewerage systems, and coastal conservation facilities","TMG will set non-binding rainwater runoff control targets (equivalent to 10 mm/hour rainfall) for municipalities, post progress information, consider expanding subsidized prioritized basins, conduct model projects with municipalities, and promote greening to reduce flood damage.","TMG will promote structural and non-structural measures for natural disasters using state-of-the-art technologies and urban facility development, and further improve initiatives to cope with larger typhoons and more frequent heavy rains.",standalone parent policy,"## Promotion of measures for river basins

- ' To encourage municipalities to make voluntary and systematic efforts to control rainwater runoff equivalent to precipitation of 10 mm/hour, TMG will set non-binding targets for the amount to be controlled and post information on progress made towards achieving such targets.
- ' Consider adding prioritized basins that will be subsidized...
- ' Carry out model projects in cooperation with municipalities...
- ' Promote efforts to create and conserve greenery and reduce flood damage through a rainwater drainage function.","Specific interventions include target-setting (10 mm/hour), subsidies, model projects, and greening for drainage.",Tokyo_Japan,No vulnerability context provided,Tokyo_Japan::e0ddb972a9b2227580e21eed,Tokyo_Japan::e0ddb972a9b2227580e21eed,False,False,stormwater_runoff_control → flood_risk_reduction,"TMG sets non-binding rainwater runoff control targets, shares progress information, supports projects and greening, and these actions increase runoff capture/drainage to reduce flood damage.",None,0.0,None,None,evidence_quote not substring-grounded in source,guide_secondary_typology_v1,policy_text_evidence_gated,explicit_self,no,Adaptation,Climate hazard (heavy rainfall) → stormwater runoff management → ↓ flood extent/peak flow → ↓ exposure & vulnerability → ↓ climate impact (damage/disruption),"1) Change in human activity/system: Municipalities and the metro government set runoff-control targets, coordinate and disclose progress, fund/prioritize basins, implement demonstration projects, and expand green/gray stormwater measures (e.g., detention, retention, infiltration, green infrastructure, drainage upgrades).  
2) Mediating physical/ecological process: Increased on-site capture and delayed release, higher infiltration/soil storage, added detention/retention volume, and/or improved conveyance reduces runoff peaks and total runoff reaching waterways and low-lying areas during storms.  
3) Climate-relevant outcome: Lower probability/severity of pluvial/riverine flooding and associated damages, improving resilience to intensifying precipitation extremes.",The single biggest climate-relevant effect is reduced flood damage and disruption from extreme rainfall by lowering runoff volumes/peak flows reaching vulnerable areas.,"1) Dominant causal pathway: The policy acts on stormwater systems to reduce flood impacts from heavy rainfall (hazard → reduced exposure/vulnerability → reduced damage).  
2) Why Adaptation over alternatives: The principal benefit is risk reduction (avoided flood losses), not primarily emissions reduction (Mitigation) or “same service with less energy/material input” (Resource Efficiency).  
3) Edge cases applied: Some stormwater measures can have co-benefits (urban cooling/trees, carbon sequestration, or energy/emissions changes from pumping and construction), but these do not dominate the mechanism’s climate relevance relative to flood-risk reduction.  
4) Applicability to ALL instances: Any policy under “stormwater_runoff_control → flood_risk_reduction” is inherently aimed at managing runoff to lower flood impacts, which is an adaptation outcome regardless of whether measures are green, gray, voluntary, or mandatory.  
5) Note on secondary subtypes: Any further subtype/co-benefit tagging (e.g., nature-based components, mitigation co-benefits) must be determined at the individual policy level with additional evidence.",0.93,"If runoff control is pursued primarily for water quality compliance or to increase water supply (rainwater harvesting) with flood reduction incidental, the dominant pathway could shift; however, for this canonical mechanism (explicit flood-risk reduction), Adaptation remains primary. Co-benefits from greening (Nature-Based Solutions) may be substantial but are secondary unless carbon sink enhancement is the dominant stated/expected climate effect.",target-setting,enabling,direct,“set non-binding targets”; “control rainwater runoff equivalent to precipitation of 10 mm/hour”; “post information on progress”; “prioritized basins that will be subsidized”; “model projects in cooperation with municipalities”; “create and conserve greenery”; “reduce flood damage”; “rainwater drainage function”,Urban heat reduction and air-quality/biodiversity improvements from greening; amenity/public health benefits; potential water-quality improvements via runoff reduction.,"Multiple instruments are bundled (targets + information disclosure + subsidies + demonstration projects). Classified as target-setting because the central, explicitly stated mechanism is establishing non-binding runoff-control targets with progress tracking; funding/model projects are supportive elements.",[],True,matched token: 'flood',True,no typology code,"TMG will promote structural and non-structural measures for natural disasters using state-of-the-art technologies and urban facility development, and further improve initiatives to cope with larger typhoons and more frequent heavy rains.",,,,,,,
