0,parent_with_subs,sub,cross_sector,## iii Promotion of urban development with disaster preparedness,TMG will support municipalities' risk assessment efforts to prevent damage from broken residential land retaining walls.,"TMG will promote structural and non-structural measures for natural disasters using state-of-the-art technologies and urban facility development, and further improve initiatives to cope with larger typhoons and more frequent heavy rains.",standalone parent policy,"## Efforts for building land retaining walls

- ' Provide support for municipalities working on risk assessment to prevent damage caused by broken retaining walls for residential land.",Concrete support action (risk assessment support) aimed at preventing failures.,Tokyo_Japan,No vulnerability context provided,Tokyo_Japan::608a1f5adda17cf03da5c12d,Tokyo_Japan::608a1f5adda17cf03da5c12d,False,False,retaining_wall_risk_assessment_support → landslide_and_infrastructure_damage_risk_reduction,Provide support for municipalities’ risk assessment work on residential land retaining walls to help prevent damage from retaining wall failures.,None,0.0,None,None,"evidence quote missing one of: [hazard, exposure, vulnerab, resilien, ...]; evidence quote missing secondary subtype token: [ecosystem, habitat, tree, trees, ...]",guide_secondary_typology_v1,policy_text_evidence_gated,explicit_self,no,Adaptation,"Climate hazard (e.g., extreme rainfall/slope saturation) → ↓ exposure/vulnerability via risk assessment + targeted remediation → ↓ landslide/structural failure damages","(1) Change in system: Municipalities improve identification, monitoring, and prioritization of at-risk residential land retaining walls (inventories, inspections, hazard mapping, and follow-up actions).  
(2) Mediating process: Engineering/geotechnical assessment detects instability and failure modes (drainage issues, soil saturation, structural deterioration), enabling preventative reinforcement, drainage improvements, or replacement before triggering events.  
(3) Climate-relevant outcome: Reduced probability and severity of landslide/retaining-wall collapse during extreme precipitation, lowering injury risk, property damage, and infrastructure/service disruption (i.e., improved resilience to climate-amplified hazards).","The single biggest climate-relevant effect is reduced exposure and vulnerability of people and infrastructure to rainfall-triggered slope/retaining-wall failures, lowering disaster damages and service disruption.","1) Dominant causal pathway: The mechanism acts on disaster-risk management—assessing and addressing retaining-wall failure risk—so the primary effect is reduced climate hazard impact (adaptation).  
2) Why Adaptation over alternatives: It does not primarily change energy use, materials throughput, or carbon sinks; emissions effects (e.g., avoided reconstruction) are secondary and not the main intended pathway.  
3) Edge cases applied: While repairs can have embodied emissions and avoided-rebuild benefits, these are ancillary; the mechanism’s intent and largest climate-relevant benefit remain risk reduction from climate-sensitive precipitation/landslide hazards.  
4) Applicability to all instances: Any policy that “supports risk assessment work on retaining walls to prevent failure damage” consistently functions as resilience/risk reduction regardless of city context.  
5) Secondary subtype deferred: Any further tagging (e.g., “critical infrastructure resilience,” “landslide risk management,” “planning/assessment”) depends on policy-specific evidence and is deferred to policy-level review.",0.87,"If a specific policy were framed primarily as GHG mitigation via reduced rebuild emissions (unusual for retaining-wall assessment programs), categorization could shift; however, for this canonical mechanism the dominant pathway is hazard damage reduction (adaptation).",planning-strategy,enabling,direct,"""Provide support""; ""municipalities""; ""risk assessment""; ""prevent damage""; ""broken retaining walls for residential land""",Reduced non-climate geotechnical failure risk; improved public safety and asset management,"Could also be framed as an incentive-program if the “support” is explicitly financial (grants/subsidies), but the excerpt does not specify funding vs technical assistance, so it is treated as an enabling planning/strategy instrument.",[],True,rescued_by_f1_5,True,no typology code,"TMG will promote structural and non-structural measures for natural disasters using state-of-the-art technologies and urban facility development, and further improve initiatives to cope with larger typhoons and more frequent heavy rains.",keep,"Climate relevance is clear disaster-risk reduction/resilience. The parent statement explicitly targets climate-linked hazards: ""cope with larger typhoons and more frequent heavy rains."" The specific action is adaptation planning/DRR: ""Provide support for municipalities working on risk assessment to prevent damage caused by broken retaining walls for residential land."" The primary gate failure (missing token) appears to be a false negative; keep under Adaptation.",0.86,True,False,,
0,parent_with_subs,sub,land_use,## iv Landslide measures,"TMG will prioritize erosion control work in landslide-prone areas with evacuation centers and where landslides have occurred, and manage slope protection facilities (e.g., ground anchors) with preventive maintenance; it will also manage forests for disaster preparedness and encourage relocation to safer areas via consolidated regional structure efforts.","TMG will promote structural and non-structural measures for natural disasters using state-of-the-art technologies and urban facility development, and further improve initiatives to cope with larger typhoons and more frequent heavy rains.",standalone parent policy,"## Implementation of erosion control work

- ' Prioritize erosion control work in landslide prone areas where evacuation centers are located and locations where landslides have actually occurred.

## Preventive maintenance management of existing ground anchors

- ' Promote preventive maintenance management of various slope protection facilities...

## Strengthening the disaster preparedness function of forests

- ' Improve benefits... by thinning and pruning...
- ' Develop disaster-resistant forests...

## Making regional structure consolidated

- ' Promote efforts for making regional structure consolidated... TMG will encourage relocation to safer areas...","Multiple specific landslide-risk actions including erosion control prioritization, preventive maintenance, forest management, and relocation encouragement.",Tokyo_Japan,No vulnerability context provided,Tokyo_Japan::35774f9f66c9c0c67b614761,Tokyo_Japan::35774f9f66c9c0c67b614761,False,False,landslide_risk_reduction_measures → reduced_landslide_hazard_and_exposure,"It prioritizes erosion control and preventive maintenance of slope protection facilities, improves forests for disaster preparedness, and encourages relocation to safer areas to reduce landslide hazard and exposure.",None,0.0,None,None,evidence_quote not substring-grounded in source,guide_secondary_typology_v1,policy_text_evidence_gated,explicit_self,no,Adaptation,"Climate hazard (extreme rainfall/slope instability) → risk management (↓ hazard + ↓ exposure) → ↓ impacts (injury, damage, service disruption)","1) Changed human activity/system: Land-use planning and hillside management are altered via erosion control works, maintenance of slope protection infrastructure (e.g., anchors/retaining systems), forest management for slope stability, and (where needed) relocation away from high-risk zones.  
2) Mediating physical/ecological process: Improved slope stability and drainage reduces soil saturation and shear failure likelihood; maintained/strengthened protection structures reduce collapse probability; vegetation/forest condition can improve soil cohesion and reduce surface erosion; relocation reduces the number/value of assets in hazard zones.  
3) Climate-relevant outcome: Lower landslide hazard and exposure under current and future rainfall regimes, reducing climate-related disaster losses and improving resilience.",The single biggest climate-relevant effect is reduced loss of life and damage from landslides by decreasing hazard probability/intensity and/or reducing exposure in landslide-prone areas.,"1) Dominant causal pathway: Reduce climate hazard impacts by lowering landslide hazard and/or exposure (risk reduction), which is an adaptation effect.  
2) Why this primary over alternatives: While forest management may have minor mitigation co-benefits (carbon), and infrastructure upgrades may change material/energy use, the mechanism’s defining intent and largest climate-relevant effect is reducing disaster risk from landslides.  
3) Edge cases applied: If a policy framed as “forest improvement” were primarily for carbon sequestration, it would shift toward Nature-Based Solutions/Mitigation; however, this canonical mechanism explicitly targets landslide hazard/exposure reduction, keeping Adaptation dominant.  
4) Confirm applies to ALL instances: Any policy that uses landslide risk reduction measures to reduce landslide hazard/exposure primarily functions to reduce climate-related impacts, regardless of local context or specific measures (engineering, ecosystem management, or relocation).  
5) Secondary subtype assignment deferred: Any further tagging (e.g., “nature-based” vs “grey infrastructure,” “managed retreat,” “early warning”) requires policy-level evidence and is not set at the mechanism level here.",0.92,"Policies combining slope stabilization with large-scale afforestation/carbon projects could have a mixed objective; classify by the dominant effect—if landslide risk reduction is primary, keep Adaptation, otherwise consider Nature-Based Solutions/Mitigation. If measures are mainly routine infrastructure maintenance unrelated to climate hazards, climate relevance may be indirect but the mechanism still maps to Adaptation.",infrastructure-investment,direct,direct,"""Prioritize erosion control work""; ""landslide prone areas""; ""locations where landslides have actually occurred""; ""Promote preventive maintenance management""; ""slope protection facilities""; ""ground anchors""; ""Strengthening the disaster preparedness function of forests""; ""thinning and pruning""; ""Develop disaster-resistant forests""; ""encourage relocation to safer areas""; ""making regional structure consolidated""","Potential co-benefits: improved forest health/biodiversity, reduced sediment runoff/water quality impacts, general disaster-risk reduction for non-climate triggers (e.g., earthquakes), improved public safety and continuity of services.","Multiple instrument types are bundled (infrastructure investment + planning/strategy for regional consolidation/relocation + ecosystem/forest management program). Classified by the dominant, most concrete measures emphasized: erosion control and slope protection maintenance (infrastructure/asset management).",[],True,matched token: 'hazard',True,no typology code,"TMG will promote structural and non-structural measures for natural disasters using state-of-the-art technologies and urban facility development, and further improve initiatives to cope with larger typhoons and more frequent heavy rains.",,,,,,,
0,parent_with_subs,sub,governance,## 2) Development of materials and equipment,TMG will strengthen flood response by developing personal flood-disaster materials and equipment.,"TMG will promote structural and non-structural measures for natural disasters using state-of-the-art technologies and urban facility development, and further improve initiatives to cope with larger typhoons and more frequent heavy rains.",standalone parent policy,"## Strengthening disaster response in rescue activities

- ' Strengthen the flood prevention activity system by developing personal materials and equipment for flood disasters.",Specific preparedness investment/action: develop equipment and materials.,Tokyo_Japan,No vulnerability context provided,Tokyo_Japan::df5e38bf57d787c5ee29ffd9,Tokyo_Japan::df5e38bf57d787c5ee29ffd9,False,False,flood_response_capacity_building → flood_impact_reduction,"The plan strengthens flood response by developing personal flood-disaster materials and equipment, improving readiness and reducing harm from flooding events.",None,0.0,None,None,"evidence quote missing one of: [efficien, kwh, kw·h, per capita, ...]; evidence quote missing secondary subtype token: [efficien, kwh, kw·h, per capita, ...]",guide_secondary_typology_v1,policy_text_evidence_gated,explicit_self,no,Adaptation,Climate hazard (flooding) → ↑ preparedness/response capacity → ↓ exposure & vulnerability → ↓ flood impacts,"(1) Change in system/activity: City and residents improve flood-disaster readiness by developing/procuring personal flood-response materials and equipment and strengthening response procedures. (2) Mediating process: Faster warning, evacuation, first response, and protective actions reduce hazard contact and shorten disruption duration during inundation. (3) Climate-relevant outcome: Reduced human and economic impacts from flooding (injuries/fatalities, asset damage, downtime), increasing resilience to heavier rainfall/sea-level-rise-driven flood risk.","The single biggest climate-relevant effect is reducing loss of life, property damage, and service disruption during flood events by improving preparedness and response capacity.","1) Dominant causal pathway: addresses a climate hazard (flooding) by increasing response readiness, which reduces impacts—an adaptation pathway. 2) Why this primary over alternatives: any mitigation co-benefits (e.g., avoided emissions from reduced reconstruction) are indirect and typically smaller than the primary effect of impact reduction during flood events. Resource efficiency is not the central lever (it is not primarily about delivering the same service with less energy/material), and nature-based solutions are not involved (no ecosystem enhancement). 3) Edge cases applied: even if equipment includes energy-efficient pumps or low-carbon materials, the core intent and dominant effect remain emergency preparedness and impact reduction. 4) Applies to ALL instances sharing this mechanism: “flood response capacity building → flood impact reduction” consistently targets preparedness/response to lessen flood damages, fitting adaptation across contexts. 5) Secondary subtype assignment (e.g., emergency management, disaster risk reduction, public health resilience) is deferred to policy-level evidence.",0.9,"If a policy under this mechanism primarily funds physical flood-control infrastructure (levees/drainage upgrades) rather than response capacity, it may warrant a different canonical mechanism; however, for capacity-building via materials/equipment/readiness, Adaptation remains correct.",infrastructure-investment,direct,direct,"""Strengthening disaster response""; ""rescue activities""; ""Strengthen the flood prevention activity system""; ""developing personal materials and equipment for flood disasters""",None,"Could also be interpreted as a planning/strategy or household preparedness program depending on whether “developing” means issuing guidance vs procuring/stockpiling equipment; given the explicit focus on materials/equipment, classified as infrastructure-investment.",[],True,matched token: 'flood',True,no typology code,"TMG will promote structural and non-structural measures for natural disasters using state-of-the-art technologies and urban facility development, and further improve initiatives to cope with larger typhoons and more frequent heavy rains.",,,,,,,
0,parent_with_subs,sub,energy_supply,## 2) Development of materials and equipment,"TMG will promote self-consumed renewable generation (solar, storage batteries) and fuel cells for emergency power availability, and install emergency power supplies at TMG and municipal facilities and other important bases.","TMG will promote structural and non-structural measures for natural disasters using state-of-the-art technologies and urban facility development, and further improve initiatives to cope with larger typhoons and more frequent heavy rains.",standalone parent policy,"## Expansion and installation of emergency power supplies

- ' To ensure electricity is available... even in the event of a disaster, TMG will promote the spread of selfconsumed renewable generation, such as solar power generation and storage batteries, as well as fuel cells, for better regional disaster preparedness.
- ' Promote the installation of emergency power supplies at TMG facilities, municipalities' buildings, and other important bases.",Concrete actions to deploy distributed energy resources and emergency power supplies for resilience.,Tokyo_Japan,No vulnerability context provided,Tokyo_Japan::cc28629acd9602cce8361858,Tokyo_Japan::cc28629acd9602cce8361858,False,False,emergency_backup_power_deployment → energy_supply_resilience,"TMG will promote self-consumed renewable generation (solar, storage batteries) and fuel cells and promote installing emergency power supplies at key facilities so electricity remains available during disasters.",None,0.0,None,None,"evidence quote missing one of: [hazard, exposure, vulnerab, resilien, ...]; contextual pass disabled for rare code 'A-3'",guide_secondary_typology_v1,policy_text_evidence_gated,explicit_self,no,Adaptation,Climate hazard (storm/heatwave/earthquake-related grid disruption) → ↓ power system vulnerability/↑ redundancy at critical facilities → ↓ service outages and impacts (↓ exposure/sensitivity),"1) Change in human activity/system: Install and operate onsite/distributed energy resources (solar PV, batteries, fuel cells) and dedicated emergency generators/backup power systems at key public and critical facilities; potentially includes microgrids and islanding capability.  
2) Mediating physical process: Added local generation + stored energy + redundant supply pathways allow facilities to “ride through” grid interruptions or operate islanded, reducing dependence on centralized grid components that may fail during hazards.  
3) Climate-relevant outcome: Increased energy supply resilience—shorter/less frequent outages and sustained operation of essential services (e.g., shelters, hospitals, government operations, communications) during climate-amplified extreme events.",The single biggest climate-relevant effect is maintaining critical electricity service during extreme events (reduced outage risk and impact) by adding distributed/backup power and storage.,"1) Dominant causal pathway: hazard-driven grid disruption risk is addressed by redundancy/onsite supply, which primarily reduces outage impacts—an adaptation/resilience pathway.  
2) Why this primary over alternatives: although solar/storage can reduce GHGs (mitigation/resource efficiency co-benefits), the mechanism’s defining feature is emergency power continuity during disasters; the main climate value is reduced vulnerability to extreme events.  
3) Edge cases applied: if a policy emphasized renewable self-consumption mainly to cut emissions/costs without an emergency/backup framing, mitigation/resource efficiency could dominate; here, explicit “during disasters” and “emergency power supplies at key facilities” makes adaptation dominant.  
4) Applies to ALL instances sharing this mechanism: any policy whose mechanism is “deploy emergency/backup power to ensure availability during disruptions” primarily targets resilience to hazards, regardless of the generation technology used.  
5) Secondary subtype assignment (e.g., mitigation co-benefits from renewables vs. diesel generators, air quality impacts) is deferred to policy-level evidence.",0.88,"If implementation relies heavily on fossil diesel generators without resilience-specific design (e.g., no islanding, inadequate fuel logistics), mitigation benefits may be negative and overall framing could shift; however, the canonical mechanism as stated is explicitly resilience-focused, supporting Adaptation as primary.",infrastructure-investment,direct,direct,"""Expansion and installation of emergency power supplies""; ""ensure electricity is available... even in the event of a disaster""; ""promote the spread of selfconsumed renewable generation, such as solar power generation and storage batteries""; ""fuel cells""; ""Promote the installation of emergency power supplies at TMG facilities, municipalities' buildings, and other important bases""","Mitigation co-benefit from ""solar power generation and storage batteries"" (potential emissions reductions), but not framed as the primary objective in the excerpt.","Mixes two levers: (1) direct public-facility installation (clear infrastructure investment) and (2) ""promote the spread"" (could imply incentives/information). Without explicit mention of subsidies/regulation, classification is anchored on the explicit installation at public facilities.",[],True,matched token: 'resilien',True,no typology code,"TMG will promote structural and non-structural measures for natural disasters using state-of-the-art technologies and urban facility development, and further improve initiatives to cope with larger typhoons and more frequent heavy rains.",,,,,,,
