13,parent_with_subs,sub,waste,FOOD AND PRODUCT CONSUMPTION — Goal: Waste reduction/composting/recycling,"Offer a workforce development program for the circular economy (repair/reuse skills, job placement, entrepreneurship), prioritizing low-income communities, youth, and communities of color and publishing demographic participation data.","Aggressively pursue waste reduction, organics composting, and recycling to achieve the waste reduction goals in the 2023 Austin Resource Recovery Comprehensive Plan.",standalone parent policy,"## Strategy 3: Create a workforce development program for the circular economy

Offer a workforce development program that includes training for repair and reuse skills, job placement, and entrepreneurship in local circular businesses...",Specific workforce program commitment tied to circular economy goals.,Austin_Texas_United_States,No vulnerability context provided,Austin_Texas_United_States::39015ef74c52043ba3be60d5,Austin_Texas_United_States::39015ef74c52043ba3be60d5,False,False,circular_economy_workforce_development_program → waste_and_materials_emissions_reduction,"Offer training, job placement, and entrepreneurship support for repair and reuse work to grow circular-economy activity and reduce waste and associated emissions.",None,0.0,None,None,,guide_secondary_typology_v1,policy_text_evidence_gated,explicit_self,no,Resource Efficiency,Same service (consumer goods utility) → ↑ repair/reuse/recirculation → ↓ virgin material production + ↓ waste disposal → ↓ lifecycle GHG emissions,"(1) Change in activity/system: Municipal programs train and place workers (and support entrepreneurs) in repair, refurbishment, reuse, and related circular-economy services, increasing local capacity and uptake of these services.  
(2) Mediating physical process: Extending product lifetimes and increasing reuse reduces throughput of materials, which (a) displaces energy- and emissions-intensive extraction/processing/manufacturing of virgin materials and (b) decreases quantities sent to landfill/incineration, lowering associated methane and combustion emissions.  
(3) Climate-relevant outcome: Net reduction in lifecycle greenhouse gas emissions (often dominated by avoided upstream manufacturing; secondarily by avoided landfill methane/incineration).",The single biggest climate-relevant effect is reduced lifecycle GHG emissions by increasing repair/reuse activity that avoids virgin material production and reduces waste disposal.,"1) Dominant causal pathway: Workforce development → more repair/reuse/circular activity → lower material throughput → avoided virgin production and reduced disposal → lower lifecycle GHG emissions.  
2) Why this primary over alternatives: While the outcome is mitigation (GHG reduction), the mechanism operates chiefly through using fewer materials/keeping products in service longer (efficiency/circularity) rather than directly switching energy supply or capturing emissions; thus Resource Efficiency best matches the dominant pathway.  
3) Edge cases applied: If a program were primarily about waste diversion to reduce landfill methane (without a strong material displacement effect), Mitigation could dominate; however, the canonical mechanism is explicitly circular-economy repair/reuse workforce expansion, which is fundamentally material-efficiency driven.  
4) Applies to ALL instances: Any policy that builds repair/reuse workforce capacity aims to expand circular activity and reduce material demand and disposal; the primary category remains Resource Efficiency across contexts, even if co-benefits include jobs, equity, and local economic development.  
5) Secondary subtype deferred: Whether emissions reductions come more from avoided manufacturing vs. avoided landfill methane/incineration, and the magnitude, depends on local waste composition, grid intensity, and program design—this is deferred to policy-level evidence.",0.74,"If training is mainly for recycling processing (not repair/reuse) or primarily targets landfill diversion/organics management, the dominant pathway could shift toward direct waste-sector mitigation; for repair/reuse-centered circular workforce programs, Resource Efficiency remains the best primary fit.",incentive-program,enabling,indirect,"""Offer a workforce development program""; ""includes training for repair and reuse skills""; ""job placement""; ""entrepreneurship""; ""prioritizing low-income communities, youth, and communities of color""; ""publishing demographic participation data""",Workforce/economic development; equity and inclusion outcomes; reduced local pollution and landfill burdens (potential public health benefits).,"Includes an information/disclosure element (“publishing demographic participation data”), but the core instrument is programmatic support (training/placement/entrepreneurship), so it is classified primarily as an incentive-program.",[],True,rescued_by_f1_5,True,no typology code,"Aggressively pursue waste reduction, organics composting, and recycling to achieve the waste reduction goals in the 2023 Austin Resource Recovery Comprehensive Plan.",keep,"The policy_statement and verbatim_text explicitly propose a circular economy workforce program: ""workforce development program for the circular economy (repair/reuse skills, job placement, entrepreneurship)"" and ""training for repair and reuse skills"". Repair/reuse and circular businesses are Resource Efficiency mechanisms that reduce waste and upstream material-related emissions. The parent_statement further anchors this in waste reduction goals (""Aggressively pursue waste reduction...""). The gate failure (missing outcome token) appears to be a tokenization issue rather than lack of climate/resource-efficiency relevance. Climate screen is explicit_self, so retain as climate-relevant under Resource Efficiency.",0.86,,,False,True
13,parent_with_subs,sub,cross_sector,FOOD AND PRODUCT CONSUMPTION — Goal: Waste reduction/composting/recycling,"Offer financial incentives (e.g., point-of-sale rebates or sales tax holiday) to encourage consumers to choose lower-impact products, repair services, and rentals, developed with low-income communities and communities of color.","Aggressively pursue waste reduction, organics composting, and recycling to achieve the waste reduction goals in the 2023 Austin Resource Recovery Comprehensive Plan.",standalone parent policy,"## Strategy 4: Offer incentives for products that have lower negative environmental and social impact

Offer financial incentives, such as point-of-sale rebates or a sales tax holiday, to encourage consumers to choose products, repair services, and rentals with lower negative environmental and social impact...",Explicit financial incentive mechanisms are stated.,Austin_Texas_United_States,No vulnerability context provided,Austin_Texas_United_States::56c44f398c4019cdbaf45f98,Austin_Texas_United_States::56c44f398c4019cdbaf45f98,False,False,financial_incentives_for_low_impact_consumption → consumption_emissions_reduction,"Offer financial incentives (e.g., point-of-sale rebates or a sales tax holiday) to encourage consumers to choose lower-impact products and to use repair services and rentals, reducing lifecycle emissions from production and disposal.",None,0.0,None,None,"evidence quote missing one of: [ghg, greenhouse gas, greenhouse gases, emission, ...]; evidence quote missing secondary subtype token: [hazard, exposure, vulnerab, resilien, ...]",guide_secondary_typology_v1,policy_text_evidence_gated,explicit_self,yes,Mitigation,Price incentives → consumer demand shift (↓ new purchases / ↑ repair & rental / ↑ low-impact goods) → ↓ production & disposal → ↓ lifecycle GHG emissions → ↓ atmospheric forcing,"(1) Change: Public or utility/retailer-backed financial incentives (rebates, tax holidays/credits, vouchers) reduce the effective price of low-impact products and circular-economy services (repair, rental, reuse), altering household consumption patterns.  
(2) Mediating process: Lower prices increase adoption of lower-embodied-carbon goods and extend product lifetimes, which reduces upstream material extraction, industrial energy use, and freight activity, and reduces downstream waste processing/landfilling/incineration.  
(3) Outcome: Net reduction in lifecycle CO₂e emissions associated with goods and services consumed in the jurisdiction (especially embodied emissions from manufacturing and waste-related emissions).",The single biggest climate-relevant effect is lowering economy-wide lifecycle GHG emissions by shifting demand away from high-embodied-carbon products and reducing new production through repair and reuse.,"1) Dominant causal pathway: Financial incentives change consumption choices → less carbon-intensive production and less disposal → lower lifecycle GHG emissions (mitigation).  
2) Why this primary over alternatives: While the mechanism can improve material/energy efficiency (a resource-efficiency co-benefit), its main climate claim and largest climate effect is emissions reduction through demand-side mitigation of embodied and waste-related emissions. It is not primarily adaptation (no hazard/exposure pathway) nor nature-based (no ecosystem sink pathway).  
3) Edge cases applied: If incentives inadvertently increase total consumption (rebound) or primarily shift spending without reducing production, mitigation impact may weaken; however, the mechanism’s intended and typical dominant effect remains emissions reduction via reduced new production and waste.  
4) Confirm applies to ALL instances: Any policy using this mechanism—rebates/tax relief to favor low-impact products, repair, and rentals—acts through consumer demand shifts to reduce lifecycle emissions, fitting Mitigation as the primary category across implementations.  
5) Secondary subtype deferral: Specific subtypes (e.g., circular economy vs. efficient appliances vs. waste diversion) and distributional design (income-qualified) require policy-level evidence and are deferred.",0.78,"Potential rebound/overconsumption effects; emissions reductions may occur largely outside city boundaries (embodied emissions accounting); outcomes depend on product definitions (“low-impact”), verification/labeling, and whether incentives target lifetime extension (repair/rental) versus simply swapping to “greener” new goods.",incentive-program,direct,direct,"""Offer financial incentives""; ""point-of-sale rebates""; ""sales tax holiday""; ""encourage consumers to choose products, repair services, and rentals""; ""lower negative environmental and social impact""","Equity and affordability benefits for ""low-income communities and communities of color""; reduced waste and pollution via increased repair/rental; potential local job support in repair services.","While the text emphasizes ""environmental and social impact"" broadly (not explicitly GHG), the specified mechanisms (rebates/tax holidays for low-impact goods, repair, rentals) reasonably imply mitigation via reduced production and disposal emissions.",[],True,matched token: 'emission',True,no typology code,"Aggressively pursue waste reduction, organics composting, and recycling to achieve the waste reduction goals in the 2023 Austin Resource Recovery Comprehensive Plan.",,,,,,,
13,parent_with_subs,sub,waste,FOOD AND PRODUCT CONSUMPTION — Goal: Waste reduction/composting/recycling,"Review and modify bulk item collection policies/programs so viable items are resold, repaired, or recycled, including exploring additional reuse opportunities and considering undocumented individuals in informal recycling.","Aggressively pursue waste reduction, organics composting, and recycling to achieve the waste reduction goals in the 2023 Austin Resource Recovery Comprehensive Plan.",standalone parent policy,"## Strategy 5: Retool the bulk pick-up collection program

Review and modify policies and programs for the collection of bulky items that result in viable items being resold, repaired, or recycled.",Specific policy/program reform commitment for waste diversion.,Austin_Texas_United_States,No vulnerability context provided,Austin_Texas_United_States::d640142cd064f5d58c936ba5,Austin_Texas_United_States::d640142cd064f5d58c936ba5,False,False,waste_diversion → landfill_methane_avoidance,"Retooling bulk item collection so viable items are resold, repaired, or recycled increases diversion from landfill, which avoids methane emissions from landfilled waste.",None,0.0,None,None,,guide_secondary_typology_v1,policy_text_evidence_gated,explicit_self,no,Mitigation,Waste generation/diversion changes → ↓ organic waste to landfill → ↓ anaerobic decomposition → ↓ CH₄ emissions → ↓ radiative forcing,"(1) Change in activity/system: Households, businesses, and city services prevent and/or divert food and other organics away from landfill (e.g., source reduction, redistribution, separate collection, composting/anaerobic digestion, circular business practices that reduce discards).  
(2) Mediating process: With less biodegradable carbon entering landfill conditions, there is less anaerobic microbial breakdown that produces methane over time (and potentially less landfill gas generation overall).  
(3) Climate-relevant outcome: Lower direct GHG emissions, dominated by reduced CH₄ (and some CO₂) from waste disposal, yielding net mitigation benefits.",The single biggest climate-relevant effect is avoided landfill methane emissions from reduced organic waste disposal.,"1) Dominant causal pathway: The mechanism’s main physical effect is reducing methane formation by keeping organics out of landfills, directly lowering GHG emissions.  
2) Why Mitigation over alternatives: While “circular economy” and “zero-waste routes” can also improve material efficiency, the mechanism specified (and common across the examples) is explicitly oriented toward avoiding landfill CH₄—an emissions reduction outcome rather than primarily reducing resource/energy inputs for the same service.  
3) Edge cases applied: Some circular-economy policies may yield larger upstream manufacturing/energy savings than landfill CH₄ reductions depending on materials targeted; however, this canonical mechanism is defined as landfill methane avoidance via waste diversion/food waste reduction, so Mitigation remains primary for all policies that truly share this mechanism.  
4) Confirm applicability to ALL instances: Any policy fitting this mechanism necessarily reduces organic landfill disposal and therefore reduces landfill methane potential; that is inherently a mitigation pathway.  
5) Secondary subtype deferred: Whether a given policy’s secondary benefits are primarily “Resource Efficiency” (e.g., avoided production emissions) or include other co-benefits is policy- and implementation-dependent and should be assigned only with policy-level evidence.",0.9,"Some “circular economy/zero-waste” initiatives may be dominated by upstream embodied-emissions reductions (resource efficiency) if they focus on non-organic materials; ensure the policy actually reduces organic landfill inputs when mapping to this mechanism. If a policy instead centers on landfill gas capture rather than diversion, it belongs to a different mechanism.",planning-strategy,enabling,indirect,"“Retool the bulk pick-up collection program”; “Review and modify policies and programs”; “collection of bulky items”; “viable items being resold, repaired, or recycled”",Reduced landfill disposal costs; job creation in repair/reuse; reduced illegal dumping; material recovery and resource conservation,"Could also be interpreted as a service/infrastructure program change (collection system redesign), but the excerpt frames it primarily as policy/program review and modification without specifying capital investment or a binding requirement, so it is best coded as a planning/strategy instrument with enabling directness.",[],True,matched token: 'methane',True,no typology code,"Aggressively pursue waste reduction, organics composting, and recycling to achieve the waste reduction goals in the 2023 Austin Resource Recovery Comprehensive Plan.",,,,,,,
14,parent_with_subs,parent,land_use,NATURAL SYSTEMS,"Legally protect an additional 20,000 acres of carbon pools on natural lands and manage all new and existing natural areas (~70,000 acres total) for resilience by 2030.",,standalone parent policy,"By 2030, legally protect an additional 20,000 acres of carbon pools on natural lands and manage all new and existing natural areas (approximately 70,000 acres total), focusing on resilience.",Quantified land protection/management target with deadline; followed by strategies.,Austin_Texas_United_States,No vulnerability context provided,Austin_Texas_United_States::217de28083dcb7875d16f85b,Austin_Texas_United_States::217de28083dcb7875d16f85b,False,False,natural_land_protection → ecosystem_and_carbon_preservation,"It legally protects carbon-rich natural lands and manages natural areas for resilience, helping preserve ecosystem function and stored carbon.",None,0.0,None,None,"evidence quote missing one of: [ecosystem, habitat, tree, trees, ...]; evidence quote missing secondary subtype token: [hazard, exposure, vulnerab, resilien, ...]",guide_secondary_typology_v1,policy_text_evidence_gated,explicit_self,no,Nature-Based Solutions,"Ecosystem protection/management → avoided land conversion + maintained carbon stocks (↑/preserved sinks, ↓ releases) → ↓ net GHG emissions → ↓ atmospheric forcing","(1) Change in human activity/system: Governments designate natural areas as protected (e.g., conservation easements, reserves, green networks/corridors) and manage them (fire/invasive control, habitat connectivity, restoration-oriented stewardship) to reduce degradation and support resilience.  
(2) Mediating physical/ecological process: Reduced disturbance and conversion maintains standing biomass and soil organic carbon, sustains ecosystem productivity and carbon sequestration capacity, and lowers risk of carbon loss from degradation (e.g., erosion, dieback, fragmentation).  
(3) Climate-relevant outcome: Avoided emissions from land-use change and preserved/maintained natural carbon sinks (often with co-benefits for heat, flooding, and biodiversity).",Protecting carbon‑rich natural land primarily avoids GHG emissions by preventing land-use change and degradation that would otherwise release stored biogenic carbon.,"1) Dominant causal pathway: Ecosystem protection and management preserves existing carbon stocks and avoids emissions from conversion/degradation—an ecosystem-mediated climate pathway.  
2) Why this primary over alternatives: While these policies can improve resilience (adaptation co-benefits) and can be framed as “resource efficiency” in land management, the single biggest climate effect across the mechanism is biogenic carbon preservation/avoided release and maintained sink function, which is best captured as Nature-Based Solutions.  
3) Edge cases applied: Some “green network” actions (e.g., green roofs, street trees) can act via urban heat reduction (adaptation) or marginal sequestration; however, under this canonical mechanism (“natural land protection → ecosystem and carbon preservation”), the defining feature is protection/management of natural lands for ecosystem function and stored carbon.  
4) Mechanism-wide applicability: All policies that fit this mechanism—legal protection/expansion of protected natural sites, safeguarding carbon pools, and managing natural areas for resilience—share the same dominant ecosystem-carbon preservation pathway.  
5) Secondary subtype deferral: Whether an individual policy is more weighted toward biodiversity corridors, protected-area expansion, or resilience-focused stewardship (and the magnitude of sequestration vs avoided emissions) requires policy-level evidence and is deferred.",0.84,"If a policy mainly creates new small urban green features (e.g., green roofs) rather than protecting existing natural lands, its dominant pathway may shift toward urban heat adaptation or marginal sequestration; ensure the instance truly centers on protecting/maintaining natural ecosystems and existing carbon pools to keep this classification.",planning-strategy,direct,direct,"“By 2030”; “legally protect an additional 20,000 acres”; “carbon pools on natural lands”; “manage all new and existing natural areas”; “focusing on resilience”; “approximately 70,000 acres total”",Biodiversity conservation; improved water regulation/flood mitigation; heat mitigation and recreational/health benefits (not explicitly stated),"Could also be implemented via regulatory protected-area designation (regulatory-mandate) or land acquisition/easements, but the text is framed as a target/plan with acreage and deadline rather than specifying the legal instrument or enforcement mechanism.",[],True,matched token: 'ecosystem',True,no typology code,,,,,,,,
