5,parent_with_subs,sub,transport,TRANSPORTATION AND LAND USE — Goal: 80% non-residential development in centers/corridors,Work with medium and large employers to locate places of business in growth centers and along corridors.,Locate 80% of new non-residential development within the city's Imagine Austin activity centers and corridors by 2030.,standalone parent policy,"## Strategy 2: Work with employers on location and amenities

Work with medium and large employers to locate their places of business in growth centers and along corridors.",Explicit intervention to influence employer location decisions toward target areas.,Austin_Texas_United_States,No vulnerability context provided,Austin_Texas_United_States::2c37d3daa174fa5adf90a634,Austin_Texas_United_States::2c37d3daa174fa5adf90a634,False,False,transit_oriented_development → transport_emissions_and_land_use_reduction,"The strategy works with employers to concentrate job locations in growth centers and corridors, supporting shorter trips and greater use of transit and other lower-carbon travel options, which reduces transportation emissions.",None,0.0,None,None,"evidence quote missing one of: [ghg, greenhouse gas, greenhouse gases, emission, ...]; evidence quote missing secondary subtype token: [hazard, exposure, vulnerab, resilien, ...]",guide_secondary_typology_v1,policy_text_evidence_gated,explicit_self,no,Mitigation,Urban form/land-use change → ↓ car dependence + ↓ VKT + ↑ mode shift → ↓ fuel combustion → ↓ GHG emissions → ↓ atmospheric forcing,"1) Change in human activity/system: Direct new development (especially jobs/non-residential and often mixed-use) into designated activity centers, corridors, and areas well-served by transit, creating denser, more connected, mixed-use neighborhoods.  
2) Mediating physical/social process: Shorter trip distances and improved access to transit and active modes reduce per-capita driving and increase the share of trips by lower-carbon modes; over time, this also reduces the need for parking and road expansion that would otherwise induce additional driving.  
3) Climate-relevant outcome: Lower gasoline/diesel consumption and associated CO₂ (and co-pollutant) emissions from on-road transportation; in some cases, additional mitigation occurs via reduced greenfield conversion and more efficient infrastructure/service delivery.","The single biggest climate-relevant effect is reducing transport-sector GHG emissions by lowering car travel (VKT) and enabling mode shift through compact, transit-served land-use patterns.","1) Dominant causal pathway: Land-use concentration around transit and amenities reduces VKT and increases mode share of transit/active travel, cutting fuel combustion emissions—this is a direct GHG mitigation pathway.  
2) Why this primary over alternatives: While compact growth can also improve resource efficiency (e.g., shorter utility networks) and can support adaptation outcomes (e.g., reduced heat exposure if designed well), the mechanism as stated and commonly used is principally to reduce transport emissions via travel behavior and mode shift.  
3) Edge cases applied: Some “activity center” policies are framed around livability or access (e.g., 10-minute city) and may not explicitly mention emissions; however, the dominant climate-relevant effect across such policies remains VKT reduction and mode shift, which is mitigation.  
4) Confirm primary applies to ALL instances sharing this mechanism: Any policy whose mechanism is “transit-oriented/compact development concentrating growth in centers/corridors” operates through the same core pathway of reduced car dependence and travel emissions, so Mitigation is consistently primary.  
5) Secondary subtype assignment deferred: Whether a given policy also delivers meaningful adaptation (heat, flood risk) or nature-based co-benefits depends on design details (greenspace, building standards, hazard siting), which must be evaluated at the individual policy level.",0.86,"If a “10-minute city” or activity-center policy is implemented primarily through greening/cooling interventions or hazard-avoidance siting (rather than travel reduction), adaptation or nature-based pathways could be prominent; nonetheless, for the specified mechanism (TOD/compact growth to reduce car travel), mitigation remains dominant.",planning-strategy,enabling,direct,"""Work with medium and large employers""; ""locate their places of business""; ""in growth centers""; ""along corridors""",Reduced congestion; improved access to jobs and services; potential air-quality improvements; more efficient infrastructure/service delivery,"Instrument could be implemented through incentives or zoning requirements, but the text itself specifies only coordination (“work with”), so it is classified as a planning/strategy (enabling) rather than an incentive program or regulatory mandate.",[],True,matched token: 'emission',True,no typology code,Locate 80% of new non-residential development within the city's Imagine Austin activity centers and corridors by 2030.,,,,,,,
5,parent_with_subs,sub,transport,TRANSPORTATION AND LAND USE — Goal: 80% non-residential development in centers/corridors,"Create community mobility hubs, including park-and-ride facilities, adjacent to transit stops with first/last-mile options.",Locate 80% of new non-residential development within the city's Imagine Austin activity centers and corridors by 2030.,standalone parent policy,"## Strategy 3 : Create mobility hubs

Create community mobility hubs, including park-and-ride facilities, adjacent to transit stops to offer a complete trip experience. These hubs should offer various first- and last-mile mobility options.",Concrete infrastructure/program concept to improve multimodal access.,Austin_Texas_United_States,No vulnerability context provided,Austin_Texas_United_States::be65bba16fd3d9eee8cdd7f5,Austin_Texas_United_States::be65bba16fd3d9eee8cdd7f5,False,False,modal_shift_to_sustainable_transport → transport_emissions_reduction,"Creating mobility hubs with park-and-ride and first/last-mile options next to transit stops improves transit access and multimodal connectivity, supporting shifts away from single-occupancy driving and reducing transport emissions.",None,0.0,None,None,"evidence quote missing one of: [ghg, greenhouse gas, greenhouse gases, emission, ...]; evidence quote missing secondary subtype token: [hazard, exposure, vulnerab, resilien, ...]",guide_secondary_typology_v1,policy_text_evidence_gated,explicit_self,no,Mitigation,"Mobility system change (↑ transit access + ↑ multimodal connectivity) → modal shift (↓ single-occupancy driving, ↓ VKT) → ↓ fuel combustion → ↓ GHG emissions → ↓ atmospheric forcing","1) Change in human activity/system: Cities invest in and redesign mobility access (mobility hubs, park-and-ride, bike/scooter links, integrated transfers) to make transit and shared/active modes easier and more reliable than driving alone.  
2) Mediating physical process: Reduced internal-combustion vehicle use lowers gasoline/diesel combustion (and associated upstream fuel-cycle emissions); in some cases, congestion relief can further reduce per-km emissions, though rebound can offset.  
3) Climate-relevant outcome: Net reduction in transport CO₂e emissions through lower vehicle travel and substitution toward lower-emitting passenger-km modes.",The single biggest climate-relevant effect is reduced tailpipe (and upstream) GHG emissions from fewer car trips and/or shorter car travel due to a modal shift to lower-carbon transport.,"1) Dominant causal pathway: Improve multimodal connectivity to enable modal shift away from single-occupancy vehicles, leading to lower fuel combustion and lower GHG emissions.  
2) Why this primary over alternatives: While such hubs can improve accessibility (a co-benefit) and sometimes reduce energy use per trip (resource efficiency), the defining and largest climate effect across policies sharing this mechanism is emissions mitigation via reduced car use.  
3) Edge cases applied: If a “mobility hub” primarily induces additional driving (e.g., large park-and-ride generating new trips) or is implemented mainly for resilience/evacuation, the dominant effect could weaken or shift; however, the stated mechanism explicitly targets modal shift to sustainable transport and emissions reduction.  
4) Applies to ALL instances sharing this mechanism: Any policy whose core mechanism is shifting trips from single-occupancy driving to transit/active/shared modes will primarily operate through transport emissions reductions, making Mitigation the consistent primary category.  
5) Secondary subtype deferred: Whether the policy’s realized impact is large, and whether it also qualifies for secondary labels (e.g., air quality, equity, congestion, adaptation co-benefits), depends on policy-specific design and evidence and is not assigned at the mechanism level.",0.86,"Park-and-ride elements can create induced driving or shift trips from active modes to car-to-transit, reducing net benefits; outcomes depend on parking supply/pricing, transit frequency, land-use context, and whether buses/rail are low-carbon. If transit vehicles are diesel and poorly utilized, emissions reductions may be smaller, but the intended dominant pathway remains mitigation via modal shift.",infrastructure-investment,direct,direct,"""Create community mobility hubs""; ""including park-and-ride facilities""; ""adjacent to transit stops""; ""offer various first- and last-mile mobility options""",Reduced congestion; improved air quality; improved accessibility/mobility for non-drivers; potential safety benefits from more multimodal trips.,"Park-and-ride can be ambiguous (it may also induce driving to hubs), but the text frames it as part of a “complete trip experience” with first/last-mile options adjacent to transit, consistent with a transit-access infrastructure strategy.",[],True,matched token: 'emission',True,no typology code,Locate 80% of new non-residential development within the city's Imagine Austin activity centers and corridors by 2030.,,,,,,,
5,parent_with_subs,sub,transport,TRANSPORTATION AND LAND USE — Goal: 80% non-residential development in centers/corridors,"Phase out free employee parking at City facilities and other large employers within 1/2 mile of the transit priority network, replacing it with cash-out, carpool/vanpool, transit passes, telework, or other commuter benefits.",Locate 80% of new non-residential development within the city's Imagine Austin activity centers and corridors by 2030.,standalone parent policy,"## Strategy 4: Phase out free parking

Phase out the practice of providing free parking spaces to employees at City of Austin facilities and other large employers located within 1/2 mile of the Austin Strategic Mobility Plan's transit priority network. Instead, offer a parking cash-out, carpool and vanpool options, flex schedules, transit passes, support for teleworking, or other commuter benefits programs.",Specific policy change with defined scope and alternative measures.,Austin_Texas_United_States,No vulnerability context provided,Austin_Texas_United_States::c030788275a93df7e550a80c,Austin_Texas_United_States::c030788275a93df7e550a80c,False,False,commuter_parking_pricing_and_benefits → modal_shift_to_sustainable_transport_and_vmt_reduction,"Phasing out free employee parking and offering cash-out, transit passes, carpool/vanpool options, telework support, and other commuter benefits shifts commute behavior away from driving alone, reducing vehicle travel and transportation emissions.",None,0.0,None,None,,guide_secondary_typology_v1,policy_text_evidence_gated,explicit_self,no,Mitigation,Commuter incentives/pricing → modal shift + ↓ VMT → ↓ fuel combustion → ↓ GHG emissions → ↓ atmospheric forcing,"1) Change in human activity/system: Employers/cities remove subsidized (free) parking and/or raise parking prices while providing commuter benefits (cash-out, transit passes, carpool/vanpool support, telework options), altering commute choices away from single-occupancy vehicle travel.  
2) Mediating physical process: Reduced vehicle travel and increased use of lower-carbon modes decreases gasoline/diesel combustion (and associated upstream fuel-cycle emissions).  
3) Climate-relevant outcome: Lower CO2e emissions from commuting (and often reduced congestion/idling as a secondary effect), contributing to mitigation.",The single biggest climate-relevant effect is reduced transportation GHG emissions from lower solo driving and VMT due to parking pricing/cash-out and commuter benefit-induced mode shift.,"1) Dominant causal pathway: Incentive and price changes for commuting reduce solo driving, causing ↓ VMT and ↓ fuel combustion, which directly yields ↓ GHG emissions.  
2) Why this primary over alternatives: While the mechanism can also reduce congestion (air quality) or improve system efficiency, the main climate-relevant endpoint across policies is emissions reduction from avoided driving—so it is Mitigation rather than Resource Efficiency (which would be framed as “same service with less energy” without necessarily depending on fuel substitution/avoided travel as the core).  
3) Edge cases applied: If parking pricing is introduced mainly for revenue or local traffic management, the climate effect can be incidental; however, the mechanism as defined explicitly targets mode shift/VMT reduction, and the dominant climate effect remains mitigation. Telework components still act through avoided travel and thus the same mitigation pathway.  
4) Confirm applies to ALL instances: Any policy that phases out free commuter parking / increases parking prices and pairs it with commuter benefits is designed to shift mode and reduce driving; the largest consistent climate impact is reduced transport emissions.  
5) Secondary subtype assignment deferred: Co-benefits (e.g., congestion relief, air quality, equity, demand management) and the exact mitigation subtype (pricing vs. employer program vs. parking management) must be assigned at the individual policy level based on text and implementation details.",0.86,"If parking fee increases lead to spillover parking and longer cruising/search times, or if revenue is used to expand parking supply, the net emissions benefit could be reduced; classification remains Mitigation because the intended and typical dominant pathway is mode shift/VMT reduction and associated emissions avoidance.",pricing-mechanism,direct,direct,"""Phase out the practice of providing free parking spaces""; ""parking cash-out""; ""carpool and vanpool options""; ""transit passes""; ""support for teleworking""; ""commuter benefits programs""; ""within 1/2 mile of the ... transit priority network""",Reduced congestion and local air pollution; improved commuting options/affordability; potential public health benefits from increased active/transit travel,"Could also be framed as a regulatory mandate for City facilities/large employers, but the central lever in the text is removal of a parking subsidy and replacement with cash-out/commuter benefits, aligning best with a pricing-mechanism instrument.",[],True,rescued_by_f1_5,True,no typology code,Locate 80% of new non-residential development within the city's Imagine Austin activity centers and corridors by 2030.,keep,"Keep as Mitigation. The verbatim text describes transportation demand management aimed at reducing driving: 'Phase out the practice of providing free parking spaces to employees' and replace it with 'parking cash-out, carpool and vanpool options... transit passes... support for teleworking'. These measures plausibly drive modal shift and VMT reduction, which are standard mitigation pathways even if no explicit emissions/ghg token appears. Climate screen is 'explicit_self', breaking the tie in favor of inclusion.",0.86,,,False,True
6,parent_with_subs,parent,land_use,TRANSPORTATION AND LAND USE,"Preserve and produce 135,000 housing units (including 60,000 affordable units) by 2027, with 75% of new housing located within 1/2 mile of Imagine Austin activity centers and corridors.",,standalone parent policy,"By 2027, preserve and produce 135,000 housing units, including 60,000 affordable housing units*, with 75% of new housing located within ½ mile of Imagine Austin activity centers and corridors.",Quantified housing production/preservation target with timeframe and location share; followed by strategies.,Austin_Texas_United_States,No vulnerability context provided,Austin_Texas_United_States::66b7f2c124f2a49ca7baa55d,Austin_Texas_United_States::66b7f2c124f2a49ca7baa55d,False,False,transit_oriented_development → transport_emissions_and_land_use_reduction,"The policy plans to preserve and add housing with most new units located near activity centers and corridors, supporting more compact, transit-supportive development that reduces driving and associated emissions.",None,0.0,None,None,"evidence quote missing one of: [ghg, greenhouse gas, greenhouse gases, emission, ...]; evidence quote missing secondary subtype token: [hazard, exposure, vulnerab, resilien, ...]",guide_secondary_typology_v1,policy_text_evidence_gated,explicit_self,no,Mitigation,Urban form/land-use change → ↓ car dependence + ↓ VKT + ↑ mode shift → ↓ fuel combustion → ↓ GHG emissions → ↓ atmospheric forcing,"1) Change in human activity/system: Direct new development (especially jobs/non-residential and often mixed-use) into designated activity centers, corridors, and areas well-served by transit, creating denser, more connected, mixed-use neighborhoods.  
2) Mediating physical/social process: Shorter trip distances and improved access to transit and active modes reduce per-capita driving and increase the share of trips by lower-carbon modes; over time, this also reduces the need for parking and road expansion that would otherwise induce additional driving.  
3) Climate-relevant outcome: Lower gasoline/diesel consumption and associated CO₂ (and co-pollutant) emissions from on-road transportation; in some cases, additional mitigation occurs via reduced greenfield conversion and more efficient infrastructure/service delivery.","The single biggest climate-relevant effect is reducing transport-sector GHG emissions by lowering car travel (VKT) and enabling mode shift through compact, transit-served land-use patterns.","1) Dominant causal pathway: Land-use concentration around transit and amenities reduces VKT and increases mode share of transit/active travel, cutting fuel combustion emissions—this is a direct GHG mitigation pathway.  
2) Why this primary over alternatives: While compact growth can also improve resource efficiency (e.g., shorter utility networks) and can support adaptation outcomes (e.g., reduced heat exposure if designed well), the mechanism as stated and commonly used is principally to reduce transport emissions via travel behavior and mode shift.  
3) Edge cases applied: Some “activity center” policies are framed around livability or access (e.g., 10-minute city) and may not explicitly mention emissions; however, the dominant climate-relevant effect across such policies remains VKT reduction and mode shift, which is mitigation.  
4) Confirm primary applies to ALL instances sharing this mechanism: Any policy whose mechanism is “transit-oriented/compact development concentrating growth in centers/corridors” operates through the same core pathway of reduced car dependence and travel emissions, so Mitigation is consistently primary.  
5) Secondary subtype assignment deferred: Whether a given policy also delivers meaningful adaptation (heat, flood risk) or nature-based co-benefits depends on design details (greenspace, building standards, hazard siting), which must be evaluated at the individual policy level.",0.86,"If a “10-minute city” or activity-center policy is implemented primarily through greening/cooling interventions or hazard-avoidance siting (rather than travel reduction), adaptation or nature-based pathways could be prominent; nonetheless, for the specified mechanism (TOD/compact growth to reduce car travel), mitigation remains dominant.",target-setting,enabling,indirect,"“By 2027”, “preserve and produce 135,000 housing units”, “including 60,000 affordable housing units”, “75% of new housing located within ½ mile”, “Imagine Austin activity centers and corridors”",Affordable housing access; reduced housing cost burden; potential air quality and health benefits from reduced driving; reduced infrastructure/service delivery costs via compact development.,"The statement is a target rather than an implementable mandate or zoning change; actual emissions impacts depend on follow-on instruments (e.g., TOD zoning, parking reform, transit service). The “activity centers and corridors” phrasing implies transit-oriented/compact growth but does not explicitly mention transportation or emissions.",[],True,matched token: 'emission',True,no typology code,,,,,,,,
