cluster_id,cluster_type,role,sector,section_header,policy_statement,parent_statement,parent_row_type,verbatim_text,extraction_rationale,location,location_vulnerability_context,row_key,source_bundle_key,is_atomized_row,is_decomposed,canonical_mechanism,mechanism_description,typology_code,typology_confidence,typology_evidence_quote,secondary_categories,gate_demoted_reason,classification_schema_version,secondary_profile,climate_screen,is_financial_instrument,primary_category,primary_causal_pathway,causal_mechanism_detail,dominant_pathway_test,mechanism_classification_reasoning,mechanism_confidence,mechanism_edge_case_notes,instrument_type,instrument_directness,climate_relevance,key_indicators,co_benefits,instance_edge_case_notes,language_violations,primary_gate_passed,primary_gate_reason,secondary_gate_passed,secondary_gate_reason,parent_policy_name,rescue_disposition,rescue_reasoning,rescue_confidence,primary_category_original,primary_category_rescue_corrected,dropped_by_climate_rescue,primary_gate_rescued
1,parent_with_subs,parent,buildings,NEW 2030 CLIMATE EQUITY GOALS FOR AUSTIN — Sustainable Buildings,Achieve net-zero carbon for all new buildings and reduce emissions by 25% for existing buildings while lowering all natural gas-related emissions by 30% by 2030.,,standalone parent policy,"## Sustainable Buildings

- Achieve net-zero carbon for all new buildings and reduce emissions by 25% for existing buildings while lowering all natural gas-related emissions by 30%.",Quantified 2030 building-sector targets; followed by multiple numbered strategies in the Sustainable Buildings section.,Austin_Texas_United_States,No vulnerability context provided,Austin_Texas_United_States::8314e0cdcf934f364844e8b8,Austin_Texas_United_States::8314e0cdcf934f364844e8b8,False,False,building_energy_code → energy_use_reduction,"The policy aims for net-zero carbon in new buildings and lower emissions in existing buildings, including reducing emissions from natural gas use, which reduces building operational energy-related emissions.",None,0.0,None,None,"evidence quote missing one of: [hazard, exposure, vulnerab, resilien, ...]; evidence quote missing secondary subtype token: [hazard, exposure, vulnerab, resilien, ...]",guide_secondary_typology_v1,policy_text_evidence_gated,explicit_self,no,Mitigation,Building design/retrofit standards → ↓ delivered energy demand + ↓ on-site fossil fuel combustion → ↓ GHG emissions → ↓ atmospheric forcing,"(1) Change in human activity/system: set for new construction and/or major renovations (and sometimes existing-building performance standards) that raise minimum efficiency, tighten envelopes, improve HVAC/lighting/water-heating performance, and may set electrification or low-carbon heat.  
(2) Mediating physical process: Reduced heat transfer losses, improved system efficiencies (higher COP/AFUE equivalents), better controls and reduced peak loads; reduced combustion of natural gas/oil on-site; lower electricity demand from the grid.  
(3) Climate-relevant outcome: Lower operational (Scope 1 and 2) energy-related GHG emissions over the building lifetime; in net-zero/energy-plus cases, near-zero or net-negative operational emissions depending on grid intensity and on-site generation.","The single biggest climate-relevant effect is reduced building operational energy use (and fuel switching away from fossil combustion), which lowers GHG emissions from energy supply.","1) Dominant causal pathway: These policies act on building energy performance so the largest effect is lowering operational energy consumption and fossil fuel use, which directly reduces GHG emissions.  
2) Why this primary over alternatives: While efficiency also improves “resource efficiency,” the climate-dominant purpose and outcome here is emissions reduction from energy use; therefore Mitigation best matches the primary causal pathway.  
3) Edge cases applied: If a code is framed around resilience (e.g., passive survivability during outages/heatwaves) it could have an adaptation co-benefit, but the canonical mechanism explicitly targets energy/emissions reduction, keeping Mitigation primary.  
4) Applicability to ALL instances: Any policy under “building_energy_code → energy_use_reduction” fundamentally reduces operational energy demand and/or on-site combustion, yielding emissions reductions regardless of city or code stringency.  
5) Note on subtypes: Secondary subtype assignment (e.g., “efficiency,” “electrification,” “net-zero,” “performance standard”) is deferred to policy-level evidence and specific provisions.",0.9,"Some building-code policies can include adaptation-focused elements (cool roofs for heat, flood-proofing, backup power) or embodied-carbon limits; those would introduce additional pathways, but under this canonical mechanism the dominant pathway remains operational energy/emissions reduction (Mitigation).",target-setting,enabling,direct,“Achieve net-zero carbon for all new buildings”; “reduce emissions by 25% for existing buildings”; “lowering all natural gas-related emissions by 30%”; “by 2030”,Improved indoor air quality and public health (from reduced on-site gas combustion); lower energy bills; energy security/reliability.,"Could be implemented via regulatory mandates/performance standards (e.g., building codes or existing building performance standards), but the excerpt itself only states outcome targets and not the implementing instrument.","['Requirements', 'require']",True,matched token: 'emission',True,no typology code,,,,,,,,
1,parent_with_subs,sub,governance,SUSTAINABLE BUILDINGS — Goal: Net-zero carbon new buildings; 25% existing; 30% gas emissions reduction,Ensure benefits of building decarbonization programs flow to low-income communities and communities of color through comprehensive energy poverty mitigation and partnerships.,Achieve net-zero carbon for all new buildings and reduce emissions by 25% for existing buildings while lowering all natural gas-related emissions by 30% by 2030.,standalone parent policy,"## Strategy 1: Ensure benefits flow to low-income communities and communities of color

Pursue a comprehensive energy poverty mitigation strategy by partnering with trusted community organizations, affordable housing developers, and schools in equitable outreach and program development.",Specific intervention (energy poverty mitigation strategy and partnerships) tied to the buildings goal.,Austin_Texas_United_States,No vulnerability context provided,Austin_Texas_United_States::f7a340ac520ab1626c0b3cd0,Austin_Texas_United_States::f7a340ac520ab1626c0b3cd0,False,False,equitable_program_partnerships → energy_poverty_mitigation_and_equitable_benefit_distribution,"Partner with trusted community organizations, affordable housing developers, and schools to support equitable outreach and program development that mitigates energy poverty and helps benefits reach low-income communities and communities of color.",None,0.0,None,None,,guide_secondary_typology_v1,policy_text_evidence_gated,explicit_self,no,Mitigation,Equitable program delivery → ↑ uptake of efficiency/electrification → same services with ↓ energy input → ↓ fuel combustion/↓ grid demand → ↓ GHG emissions,"(1) Changes the social/institutional system: governments partner with trusted community organizations (CBOs), affordable housing developers, and schools to co-design outreach, enrollment, financing support, and program rules so low-income households can access retrofits, weatherization, efficient appliances, and building electrification.  
(2) Mediating process: reduced informational/transaction barriers and improved trust increases participation rates; installed measures physically reduce energy losses and improve end-use efficiency (and can shift end-uses from direct fossil combustion to cleaner electricity).  
(3) Climate-relevant outcome: lower delivered energy per household/service (and/or reduced on-site fossil fuel use), which reduces upstream electricity generation and fuel combustion emissions.","The single biggest climate-relevant effect is higher adoption of efficiency/electrification measures in underserved communities, leading to lower energy use and thus lower GHG emissions from buildings and power generation.","1) Dominant causal pathway: equitable partnerships → increased uptake of efficiency/electrification → reduced energy input for the same energy services → reduced GHG emissions.  
2) Why this primary over alternatives: while the mechanism is equity-forward governance, its main climate lever is accelerating energy-saving measures (resource efficiency) rather than directly managing climate hazards (adaptation) or enhancing ecosystems (nature-based). It is not purely “mitigation” in the sense of a direct emissions control instrument; the primary physical lever is reducing energy demand/waste via program uptake.  
3) Edge cases applied: if partnerships mainly steer communities to renewable supply (e.g., community solar subscriptions) without reducing energy use, the dominant pathway would shift toward Mitigation; if focused on resilience (e.g., cooling centers, backup power) it could shift toward Adaptation. Those are not implied as the primary effect in this mechanism as stated (energy poverty mitigation via program benefits).  
4) Confirm applies to ALL instances: partnerships intended to mitigate energy poverty and equitably distribute program benefits generally function by increasing access to efficiency/electrification improvements, making Resource Efficiency the consistent primary category across implementations.  
5) Secondary subtype assignment is deferred: specific subtypes (e.g., building electrification vs. weatherization vs. rate assistance) require policy-level evidence and are not assigned at the mechanism level.",0.68,"Could be classified as Mitigation when the partnership’s main outcome is increased clean energy supply/procurement rather than reduced energy demand; could be Adaptation if framed around heat/cold emergency protection and resilience services. The provided description emphasizes energy poverty mitigation via equitable access to decarbonization/efficiency benefits, supporting Resource Efficiency as primary.",planning-strategy,enabling,indirect,"""Ensure benefits flow to low-income communities and communities of color""; ""comprehensive energy poverty mitigation strategy""; ""partnering with trusted community organizations, affordable housing developers, and schools""; ""equitable outreach and program development""",Reduced energy burden/utility arrears; improved public health and indoor comfort; equity and anti-displacement support; local workforce/community capacity-building,"Could partially overlap with an incentive-program if the broader plan includes targeted rebates/grants, but the provided text centers on partnership-based outreach and program development (strategy/governance) rather than specifying financial incentives or mandates.",[],True,matched token: 'carbon',True,no typology code,Achieve net-zero carbon for all new buildings and reduce emissions by 25% for existing buildings while lowering all natural gas-related emissions by 30% by 2030.,reclassify,"Climate relevance is explicit in the policy_statement: ""Ensure benefits of building decarbonization programs flow..."" and the verbatim_text: ""Pursue a comprehensive energy poverty mitigation strategy...""; it is also anchored by the parent_statement emissions target: ""Achieve net-zero carbon for all new buildings and reduce emissions..."". The gate failure notes no Resource Efficiency outcome token, which aligns with the content: the mechanism is equitable outreach/partnerships and benefit distribution (""partnering with trusted community organizations... in equitable outreach and program development""), not an efficiency outcome. Therefore the row should be kept but reclassified from Resource Efficiency to Mitigation because it supports building decarbonization/emissions reduction program implementation.",0.77,Resource Efficiency,True,False,
1,parent_with_subs,sub,buildings,SUSTAINABLE BUILDINGS — Goal: Net-zero carbon new buildings; 25% existing; 30% gas emissions reduction,"Enhance resident and building owner understanding of energy consumption via outreach, culturally relevant communications, expanded benchmarking for existing buildings, and better access to energy and water data.",Achieve net-zero carbon for all new buildings and reduce emissions by 25% for existing buildings while lowering all natural gas-related emissions by 30% by 2030.,standalone parent policy,"## Strategy 2: Enhance understanding of energy consumption

Enhance resident and building owner understanding of energy savings opportunities, benefits, and climate impacts of energy consumption. This will be done through direct outreach, culturally relevant communications, expanding benchmarking requirements for all existing buildings, and better access to energy and water data.",Concrete programmatic actions (benchmarking expansion; data access; outreach).,Austin_Texas_United_States,No vulnerability context provided,Austin_Texas_United_States::bec080c459983ecdcc83c35d,Austin_Texas_United_States::bec080c459983ecdcc83c35d,False,False,energy_benchmarking_disclosure → market_signal_for_efficiency,The city will expand benchmarking for existing buildings and improve outreach and access to energy and water data so residents and building owners better understand consumption and are encouraged to pursue energy-saving actions.,None,0.0,None,None,"evidence quote missing one of: [ghg, greenhouse gas, greenhouse gases, emission, ...]; evidence quote missing secondary subtype token: [hazard, exposure, vulnerab, resilien, ...]",guide_secondary_typology_v1,policy_text_evidence_gated,explicit_self,no,Mitigation,Information transparency/market signal → efficiency actions (O&M + retrofits) → ↓ building energy use → ↓ fossil energy combustion → ↓ GHG emissions,"(1) Change in human activity/system: Cities require or facilitate energy/water benchmarking, monitoring, and/or public reporting so owners, tenants, lenders, and regulators can compare performance and identify inefficiencies.  
(2) Mediating physical/process link: Improved data availability and comparability triggers operational improvements (commissioning, controls tuning), capital upgrades (HVAC, envelope, lighting), and behavioral changes; these measures reduce kWh and on-site fuel consumption for the same building service levels.  
(3) Climate-relevant outcome: Lower energy demand reduces upstream grid emissions and direct combustion emissions, decreasing overall GHG emissions from the buildings sector.",The single biggest climate-relevant effect is reduced building energy consumption leading to lower GHG emissions from electricity generation and on-site fuel use.,"1) Dominant causal pathway: transparency and benchmarking → motivates/identifies efficiency improvements → lowers energy use → lowers GHG emissions.  
2) Why this primary over alternatives: while water data and energy-burden reporting can support equity and resource efficiency, the core mechanism is to drive building energy efficiency, with the main climate impact being emissions reduction (mitigation).  
3) Edge cases applied: if disclosure is used purely for equity planning or billing assistance without driving efficiency actions, climate impact could be indirect; however, the canonical mechanism specified is explicitly “market signal for efficiency,” keeping mitigation dominant.  
4) Applicability to ALL instances: any policy that expands benchmarking/monitoring/disclosure to create performance comparisons and motivate efficiency improvements shares the same primary mitigation pathway through reduced building energy use.  
5) Secondary subtype assignment deferred: whether outcomes come mainly from operational changes vs retrofits, and whether electricity vs gas dominates, must be determined at the individual policy level with implementation details and local energy mix.",0.84,Some related policies emphasize water benchmarking or “energy burden” reporting; those can be primarily equity/resource-planning tools unless explicitly tied to efficiency interventions. Municipal-only monitoring may yield smaller market signaling effects but still targets efficiency-driven emissions reductions.,information-disclosure,enabling,direct,"""direct outreach""; ""culturally relevant communications""; ""expanding benchmarking requirements for all existing buildings""; ""better access to energy and water data""; ""understanding of energy savings opportunities, benefits, and climate impacts of energy consumption""","Potential water conservation and reduced utility bills/energy burden from ""better access to energy and water data"" and energy savings opportunities.","Mixes voluntary outreach with an implied mandate (""benchmarking requirements""). If the policy is implemented as a legally binding ordinance with compliance/penalties, it could also be framed as a regulatory mandate; however, the dominant mechanism described is information transparency/disclosure.",[],True,rescued_by_f1_5,True,no typology code,Achieve net-zero carbon for all new buildings and reduce emissions by 25% for existing buildings while lowering all natural gas-related emissions by 30% by 2030.,keep,"Climate relevance is explicit in the source text: it aims to improve understanding of 'energy savings opportunities, benefits, and climate impacts of energy consumption.' It includes 'expanding benchmarking requirements for all existing buildings, and better access to energy and water data,' which aligns with the mitigation mechanism energy_benchmarking_disclosure → market_signal_for_efficiency. Although the primary gate reports 'no Mitigation outcome token,' the action is a recognized mitigation policy lever intended to reduce building energy use and thus emissions, consistent with the parent goal to 'reduce emissions' and reach 'net-zero carbon' for buildings. Climate screen is explicit_self, so the row should be kept.",0.86,,,False,True
1,parent_with_subs,sub,buildings,SUSTAINABLE BUILDINGS — Goal: Net-zero carbon new buildings; 25% existing; 30% gas emissions reduction,"Achieve net-zero carbon building milestones through new building energy codes/amendments and incentives/education for existing building decarbonization, in collaboration with utilities and with equity focus.",Achieve net-zero carbon for all new buildings and reduce emissions by 25% for existing buildings while lowering all natural gas-related emissions by 30% by 2030.,standalone parent policy,"## Strategy 3: Achieve energy-efficient, net-zero carbon buildings

Achieve goal milestones for net-zero carbon buildings through new building energy codes, amendments, and other methods. Engage owners and operators of existing buildings to decarbonize through incentives and education for contractors and occupants. Collaborate with local utilities to implement equitable emission reduction strategies.","Specific policy mechanisms (codes, amendments, incentives, education, utility collaboration).",Austin_Texas_United_States,No vulnerability context provided,Austin_Texas_United_States::9feff14dcf02d560468edc8f,Austin_Texas_United_States::9feff14dcf02d560468edc8f,False,False,building_energy_code → energy_use_reduction,The strategy uses new building energy codes and amendments and engages existing building owners and operators through incentives and education to cut building energy use and related emissions.,None,0.0,None,None,"evidence quote missing one of: [efficien, kwh, kw·h, per capita, ...]; evidence quote missing secondary subtype token: [efficien, kwh, kw·h, per capita, ...]",guide_secondary_typology_v1,policy_text_evidence_gated,explicit_self,no,Mitigation,Building design/retrofit standards → ↓ delivered energy demand + ↓ on-site fossil fuel combustion → ↓ GHG emissions → ↓ atmospheric forcing,"(1) Change in human activity/system: set for new construction and/or major renovations (and sometimes existing-building performance standards) that raise minimum efficiency, tighten envelopes, improve HVAC/lighting/water-heating performance, and may set electrification or low-carbon heat.  
(2) Mediating physical process: Reduced heat transfer losses, improved system efficiencies (higher COP/AFUE equivalents), better controls and reduced peak loads; reduced combustion of natural gas/oil on-site; lower electricity demand from the grid.  
(3) Climate-relevant outcome: Lower operational (Scope 1 and 2) energy-related GHG emissions over the building lifetime; in net-zero/energy-plus cases, near-zero or net-negative operational emissions depending on grid intensity and on-site generation.","The single biggest climate-relevant effect is reduced building operational energy use (and fuel switching away from fossil combustion), which lowers GHG emissions from energy supply.","1) Dominant causal pathway: These policies act on building energy performance so the largest effect is lowering operational energy consumption and fossil fuel use, which directly reduces GHG emissions.  
2) Why this primary over alternatives: While efficiency also improves “resource efficiency,” the climate-dominant purpose and outcome here is emissions reduction from energy use; therefore Mitigation best matches the primary causal pathway.  
3) Edge cases applied: If a code is framed around resilience (e.g., passive survivability during outages/heatwaves) it could have an adaptation co-benefit, but the canonical mechanism explicitly targets energy/emissions reduction, keeping Mitigation primary.  
4) Applicability to ALL instances: Any policy under “building_energy_code → energy_use_reduction” fundamentally reduces operational energy demand and/or on-site combustion, yielding emissions reductions regardless of city or code stringency.  
5) Note on subtypes: Secondary subtype assignment (e.g., “efficiency,” “electrification,” “net-zero,” “performance standard”) is deferred to policy-level evidence and specific provisions.",0.9,"Some building-code policies can include adaptation-focused elements (cool roofs for heat, flood-proofing, backup power) or embodied-carbon limits; those would introduce additional pathways, but under this canonical mechanism the dominant pathway remains operational energy/emissions reduction (Mitigation).",regulatory-mandate,direct,direct,"“new building energy codes”, “amendments”, “Achieve … net-zero carbon buildings”, “decarbonize through incentives and education”, “Collaborate with local utilities to implement equitable emission reduction strategies”",Lower energy bills; improved indoor comfort/health (air quality); reduced peak demand and grid stress; equity benefits via “equitable emission reduction strategies”.,Includes a mix of instruments (codes/mandates plus incentives and education). Classified by the primary lever (energy codes) per the text emphasis; incentives/education are secondary supporting measures.,"['Requirements', 'require']",True,matched token: 'emission',True,no typology code,Achieve net-zero carbon for all new buildings and reduce emissions by 25% for existing buildings while lowering all natural gas-related emissions by 30% by 2030.,,,,,,,
