cluster_id,cluster_type,role,sector,section_header,policy_statement,parent_statement,verbatim_text,extraction_rationale,location,location_vulnerability_context,canonical_mechanism,mechanism_description,primary_category,secondary_categories,secondary_justification,primary_causal_pathway,causal_mechanism_detail,dominant_pathway_test,mechanism_classification_reasoning,mechanism_confidence,mechanism_edge_case_notes,additional_secondary_evidence,instrument_type,instrument_directness,climate_relevance,key_indicators,co_benefits,instance_edge_case_notes
14.0,individual,individual,cross_sector,8.1 Dakar's vision for 2050,Reduce Dakar’s GHG emissions by 54% by 2050.,,"Overall, the goals that the city could achieve are:

-    a  54%  reduction  in  GHG  emissions  by 2050;",Quantified mitigation target with a deadline (2050).,Dakar,No vulnerability context provided,economy_wide_ghg_target → emissions_reduction_pathway,Sets an economy-wide GHG reduction target that drives planning and coordinated actions across sectors to reduce overall emissions.,Mitigation,None,None,Governance commitment/target-setting → coordinated cross-sector mitigation actions → ↓ net GHG emissions → ↓ atmospheric forcing,"(1) Change in human activity/system: The jurisdiction sets an economy-wide emissions-reduction or carbon-neutrality/net-zero target (often with interim milestones) and typically triggers planning, accountability, and alignment across departments and sectors.  
(2) Mediating process: The target creates institutional and political incentives (prioritization, budgeting, regulation, performance management) that increase adoption and stringency of emissions-reducing measures across energy, buildings, transport, waste, and industry.  
(3) Climate-relevant outcome: Reduced (or net-zero) community-wide GHG emissions over time, lowering cumulative emissions and associated warming.",The single biggest climate-relevant effect of policies using this mechanism is reducing economy-wide net GHG emissions by aligning and accelerating cross-sector mitigation actions toward a quantified target.,"1) Dominant causal pathway: Target-setting is designed to drive cross-sector actions whose direct physical outcome is lower net GHG emissions (mitigation).  
2) Why this primary over alternatives: While targets can indirectly influence efficiency, resource use, or resilience planning, those effects are contingent on the chosen measures; the mechanism itself is explicitly oriented around emissions outcomes.  
3) Inherent causal chain for each secondary: None—no secondary outcome (resource efficiency, adaptation, or nature-based solutions) is guaranteed by merely adopting an economy-wide target; the target can be met through many mixes of actions.  
4) Edge cases applied: “Carbon neutral/net zero” may be achieved partly via offsets/removals; this still sits in mitigation because the intended climate effect is lowering net atmospheric GHG impact, but the specific pathway (reductions vs offsets) varies.  
5) Confirm labels apply to ALL instances: Across Chicago, Seattle, and Miami-Dade examples, the shared mechanism is an economy-wide quantified emissions objective intended to drive emissions reduction planning and implementation; mitigation remains the primary category in all cases.",0.93,"Targets that rely heavily on carbon offsets, renewable energy credits, or external procurement reduce net emissions accounting rather than necessarily local gross emissions; still mitigation. If a “climate goal” were framed primarily around resilience outcomes (without an emissions objective), it would not fit this mechanism.",None,target-setting,enabling,direct,“54% reduction in GHG emissions by 2050”; “goals”,"Potential air quality and public health co-benefits from reduced fossil fuel combustion, but not specified in the text.","Target is presented as an overall goal without indicating whether it is legally binding, interim milestones, sectoral allocation, or implementation instruments."
15.0,individual,individual,buildings,8.1 Dakar's vision for 2050,Reduce the energy bill in the built heritage of the City of Dakar by 75% by 2050.,,"Overall, the goals that the city could achieve are:

-  a 75% reduction in the energy bill in the built heritage of the City of Dakar by 2050;",Quantified target with deadline focused on municipal/built heritage energy costs.,Dakar,No vulnerability context provided,commercial_building_retrofit → energy_use_reduction,"Improve/retrofit existing heritage buildings to lower their energy use, which reduces associated energy demand (and typically emissions).",Mitigation,Resource Efficiency,"Resource Efficiency: Retrofit measures (insulation, HVAC upgrades, controls, efficient lighting/equipment) deliver the same building services with less energy input, i.e., improved energy productivity as an inherent physical consequence of the mechanism.",Building systems/envelope upgrades → ↓ building energy demand → ↓ fuel/electricity consumption → ↓ GHG emissions → ↓ atmospheric forcing,"(1) Change: Existing commercial/industrial/public building stock is retrofitted via efficiency upgrades (envelope improvements, HVAC replacement/optimization, controls, lighting and equipment upgrades, commissioning).  
(2) Process: Reduced heat transfer losses/gains and improved conversion/control efficiency lowers delivered energy required for the same comfort/operations.  
(3) Outcome: Lower operational energy consumption reduces upstream and on-site combustion emissions (CO₂e) associated with providing that energy.","The single biggest climate-relevant effect is reduced operational energy use in existing buildings, which lowers GHG emissions from on-site fuel combustion and/or grid electricity generation.","1) Dominant causal pathway: retrofit → lower energy use → lower energy-related GHG emissions, which is a direct mitigation pathway.  
2) Why this primary over alternatives: while retrofits can incidentally improve comfort or resilience, the mechanism as stated and implemented is explicitly energy-use reduction leading to emissions reduction; that is the largest and most consistent climate effect across instances.  
3) Inherent secondary chain(s): Resource Efficiency is inherent because achieving “energy use reduction” necessarily means providing the same service with less energy input.  
4) Edge cases applied: if a retrofit includes electrification or fuel switching, emissions benefits depend on grid intensity, but the mechanism here is specifically energy reduction (still mitigation-dominant). If retrofits are for hazard hardening (e.g., floodproofing) without energy impacts, that would be adaptation—but that is a different mechanism.  
5) Confirm labels apply to ALL instances: retrofitting industrial, city-owned, and commercial buildings to reduce energy use always reduces energy demand and therefore tends to reduce associated operational emissions (Mitigation) and improves energy productivity (Resource Efficiency).",0.93,"Emissions reductions magnitude can vary with rebound effects and grid carbon intensity; some retrofit bundles may target comfort/resilience (adaptation) or include on-site renewables/electrification, but those are additional mechanisms beyond “energy_use_reduction.”",None,target-setting,enabling,direct,"""75% reduction in the energy bill""; ""built heritage of the City of Dakar""; ""by 2050""",Potential co-benefits: reduced operating costs; improved thermal comfort; potential reduced heat stress indoors (if efficiency includes envelope/shading/cooling optimization). Not coded as secondary without explicit hazard/vulnerability link or adaptation intent.,"“Energy bill” could reflect both consumption reduction and energy price dynamics, but the magnitude/goal framing in a built-heritage context most strongly signals an energy-efficiency/retrofit target rather than a pricing mechanism."
16.0,individual,individual,energy_supply,8.1 Dakar's vision for 2050,Increase the share of renewable energy in Dakar’s energy mix to at least 65% by 2050.,,"Overall, the goals that the city could achieve are:

-    an  increase  in  the  share  of  renewable energy in the energy mix of at least 65% by 2050.",Quantified renewable energy share target with a deadline (2050).,Dakar,No vulnerability context provided,renewable_energy_target → grid_decarbonization,"Setting a renewable energy share target drives deployment of renewable generation, which displaces fossil-fueled energy supply and reduces grid emissions.",Mitigation,None,None,Electricity supply policy → ↑ renewable electricity share → ↓ fossil generation/combustion → ↓ GHG emissions → ↓ atmospheric forcing,"(1) Change: The city/state/utility increases renewable electricity procurement and/or deployment (often via targets, aggregation, community ownership/access, and projects on public property). (2) Process: Added renewable generation (and associated contracting) supplies electricity with near-zero operational emissions, which displaces marginal fossil generation on the grid. (3) Outcome: Lower lifecycle and especially operational CO₂e emissions from the power sector, contributing to grid decarbonization and economy-wide emissions reductions (via cleaner electricity for buildings/transport).",The single biggest climate-relevant effect is reduced greenhouse gas emissions from electricity generation by replacing fossil fuel power with renewable electricity.,"(1) Dominant causal pathway: Increasing renewable electricity supply leads to reduced fossil electricity generation and thus reduced GHG emissions.  
(2) Why this primary over alternatives: While these policies can yield co-benefits (air quality, energy affordability, resilience), the core and largest climate effect across all instances is emissions mitigation through power-sector decarbonization.  
(3) Inherent causal chain for each secondary: None—resource-efficiency gains or adaptation/resilience benefits are not guaranteed outcomes of simply increasing renewable share (they depend on grid design, storage, reliability measures, and local hazard context).  
(4) Edge cases applied: If renewables are added without displacing fossil generation (e.g., high curtailment or parallel load growth), mitigation impact could be smaller, but the mechanism’s intended and typical pathway remains emissions reduction.  
(5) Confirm labels apply to ALL instances: Any policy under this mechanism is fundamentally about shifting the grid mix toward renewables/clean electricity; that is inherently a mitigation action regardless of ownership model or procurement approach.",0.95,"If a “renewable target” is met largely via unbundled RECs without inducing new renewable generation, or if added renewables are heavily curtailed, realized emissions reductions may be weaker; however, the mechanism classification remains Mitigation because the dominant intended pathway is grid decarbonization via fossil displacement.",None,target-setting,enabling,direct,“increase in the share of renewable energy”; “energy mix”; “at least 65% by 2050”,"Potential air quality improvements and energy security/price stability benefits, but not specified in the text.","The excerpt states a goal/target without specifying implementation tools (e.g., mandates, incentives, procurement), so instrument classification is limited to target-setting and directness is enabling rather than direct."
