cluster_id,cluster_type,role,sector,section_header,policy_statement,parent_statement,parent_row_type,verbatim_text,extraction_rationale,location,location_vulnerability_context,row_key,source_bundle_key,is_atomized_row,is_decomposed,canonical_mechanism,mechanism_description,typology_code,typology_confidence,typology_evidence_quote,secondary_categories,gate_demoted_reason,classification_schema_version,secondary_profile,climate_screen,is_financial_instrument,primary_category,primary_causal_pathway,causal_mechanism_detail,dominant_pathway_test,mechanism_classification_reasoning,mechanism_confidence,mechanism_edge_case_notes,instrument_type,instrument_directness,climate_relevance,key_indicators,co_benefits,instance_edge_case_notes,language_violations,primary_gate_passed,primary_gate_reason,secondary_gate_passed,secondary_gate_reason,parent_policy_name,rescue_disposition,rescue_reasoning,rescue_confidence,primary_gate_rescued,dropped_by_climate_rescue
5,parent_with_subs,sub,cross_sector,Table of laws and measures (2000-12-23 Law 388),Law 388/2000 excludes from taxable income the portion of SMEs’ income earmarked for environmental investments (with resources available in 2001–2002 stated as 307.7 billion Lire).,"Law 388/2000 (2001 Budget Law) introduces multiple sustainable development measures, including tax relief for SMEs’ environmental investments, excise tax exemptions/reductions for certain biofuels and environmentally defensive fuel products, tax credits for geothermal/biomass district heating connections, incentives for sustainable development measures, and establishment of a fund to reduce atmospheric emissions and promote energy efficiency and renewables.",standalone parent policy,The - tion of the income of small and medium- size enterprises earmarked for environ - mental investments is not counted towards determining taxable income for the - poses of corporate taxation. Resources available 2001-2002: 307.7 billion Lire.,Specific fiscal measure (tax base exclusion) with a stated resource envelope.,Perugia_Italy,No vulnerability context provided,Perugia_Italy::ff16c51873a642576dddf206,Perugia_Italy::ff16c51873a642576dddf206,False,False,tax_incentive_for_environmental_investment → emissions_reduction_enablement,"By not counting SMEs’ income earmarked for environmental investments toward taxable income, the policy incentivizes more environmental investment that can reduce greenhouse gas emissions.",None,0.0,None,None,evidence_quote not substring-grounded in source,guide_secondary_typology_v1,policy_text_evidence_gated,explicit_self,yes,Mitigation,Fiscal incentive → ↑ low-carbon/environmental investment → ↓ energy/fuel use and/or ↑ process efficiency/clean tech adoption → ↓ GHG emissions → ↓ atmospheric forcing,"(1) Change in human activity/system: SMEs face a lower effective tax burden on income earmarked for environmental investments, increasing the rate and scale of environmental/clean-technology capital spending (e.g., energy efficiency upgrades, electrification, cleaner processes, pollution control with energy co-benefits).  
(2) Mediating physical/ecological process: Invested measures reduce fossil energy consumption, improve process efficiency, shift energy carriers to lower-carbon options, and/or reduce high-GWP emissions through improved equipment and controls.  
(3) Climate-relevant outcome: Net reduction in CO₂e emissions relative to baseline operations, producing mitigation benefits.",The single biggest climate-relevant effect is that tax incentives unlock additional environmental investments that reduce greenhouse gas emissions versus business-as-usual.,"1) Dominant causal pathway: A tax incentive increases uptake of emissions-reducing investments, leading to lower GHG emissions.  
2) Why this primary over alternatives: While such incentives can also improve resource efficiency, the mechanism’s defining climate outcome is emissions reduction (mitigation) enabled by financial policy; “Resource Efficiency” would only be primary if the central outcome were reduced material/energy input regardless of emissions, which is not the dominant framing here.  
3) Edge cases applied: If “environmental investments” are primarily non-climate (e.g., local pollution abatement with negligible GHG impact) or include high-emitting infrastructure, the mitigation effect could be weak or ambiguous; however, the canonical mechanism asserts emissions-reduction enablement as the core effect.  
4) Applicability to ALL instances: Any policy that works by tax-incentivizing environmental/clean investments to enable emissions reductions shares a mitigation-dominant pathway.  
5) Secondary subtype deferral: Specific subtypes (e.g., energy efficiency vs. renewables vs. industrial process changes) depend on the policy’s eligible investment list and implementation evidence, so subtype assignment is deferred to policy-level details.",0.82,“Environmental investment” is broad; some eligible investments may yield limited or uncertain GHG reductions (or even rebound effects). Classification remains Mitigation because the canonical mechanism specifies emissions-reduction enablement as the primary intended effect.,incentive-program,enabling,direct,“excludes from taxable income”; “not counted towards determining taxable income”; “income … earmarked for environmental investments”; “Resources available 2001–2002: 307.7 billion Lire”,"Air pollution reduction and general environmental quality improvements (non-climate), SME competitiveness/innovation support.",“Environmental investments” is broad and could include non-mitigation measures; classification assumes a substantial share supports energy efficiency/clean technology consistent with the assigned mitigation pathway.,[],True,matched token: 'emission',True,no typology code,"Law 388/2000 (2001 Budget Law) introduces multiple sustainable development measures, including tax relief for SMEs’ environmental investments, excise tax exemptions/reductions for certain biofuels and environmentally defensive fuel products, tax credits for geothermal/biomass district heating connections, incentives for sustainable development measures, and establishment of a fund to reduce atmospheric emissions and promote energy efficiency and renewables.",,,,,
5,parent_with_subs,sub,transport,Table of laws and measures (2000-12-23 Law 388),"Law 388/2000 provides excise tax exemptions for biodiesel fuel and reduces excise taxes on specified biofuel-related products used as fuels (bio-ethanol and certain additives/alcohol for unleaded gasoline and diesel, excluding biodiesel).","Law 388/2000 (2001 Budget Law) introduces multiple sustainable development measures, including tax relief for SMEs’ environmental investments, excise tax exemptions/reductions for certain biofuels and environmentally defensive fuel products, tax credits for geothermal/biomass district heating connections, incentives for sustainable development measures, and establishment of a fund to reduce atmospheric emissions and promote energy efficiency and renewables.",standalone parent policy,"art. 21 'Measures on exemptions from excise tax for bio-diesel fuel'. ... the excise is reduced on the following products used as fuels: bio-ethanol manufactured agricultural products, additives and - hol for unleaded gasoline and diesel with the exception of bio-diesel.",Clearly specified tax exemptions/reductions targeting biofuels.,Perugia_Italy,No vulnerability context provided,Perugia_Italy::1d38655dbc4d4ac187cb90d5,Perugia_Italy::1d38655dbc4d4ac187cb90d5,False,False,biofuel_tax_exemption_incentive → transport_fuel_emissions_reduction,"It provides excise tax exemptions/reductions for biodiesel and other biofuel-related fuel products to encourage switching from petroleum fuels to biofuels, lowering transport fuel emissions.",None,0.0,None,None,"evidence quote missing one of: [ghg, greenhouse gas, greenhouse gases, emission, ...]; evidence quote missing secondary subtype token: [hazard, exposure, vulnerab, resilien, ...]",guide_secondary_typology_v1,policy_text_evidence_gated,explicit_self,yes,Mitigation,Fuel price incentive → fuel switching (diesel → biodiesel) → ↓ lifecycle CO₂e per unit energy/use → ↓ transport-sector GHG emissions,"(1) Changes the transport fuel market by lowering biodiesel’s retail/wholesale cost (often encouraging higher blending or direct substitution for fossil diesel). (2) The mediating process is combustion of biogenic-derived fuel and associated upstream supply-chain emissions, which (for qualifying sustainable feedstocks) yields lower net lifecycle CO₂e than petroleum diesel for the same vehicle-kilometres. (3) Outcome is reduced net GHG emissions from transport fuel consumption (primarily CO₂e), contingent on lifecycle performance and indirect land-use change risks.",The single biggest climate-relevant effect is reducing road-transport lifecycle GHG emissions by substituting biodiesel for fossil diesel through a price incentive.,"1) Dominant causal pathway: a fiscal incentive drives substitution away from fossil diesel toward biodiesel, lowering lifecycle emissions from transport energy use.  
2) Why Mitigation over alternatives: the direct intent and largest effect is emissions reduction (not improved energy efficiency per se, not hazard risk reduction, and not ecosystem enhancement as the primary lever).  
3) Edge cases applied: if biodiesel feedstocks have high indirect land-use change or poor lifecycle performance, net emissions benefits can be smaller or negative, but the mechanism’s intended and typical climate-relevant pathway remains emissions mitigation via fuel switching.  
4) Applies to ALL instances: any policy with this mechanism (biofuel tax relief to encourage biodiesel uptake) operates through reduced fuel cost → increased biodiesel use → changed fuel carbon intensity → emissions impact, so Mitigation is the consistent primary category.  
5) Secondary subtype assignment (e.g., “low-carbon fuels,” “fiscal incentives,” “transport decarbonization”) is deferred to policy-level evidence such as sustainability criteria, eligible feedstocks, and actual blending/uptake.",0.86,"Net mitigation depends on lifecycle accounting, feedstock type, and land-use change; some exemptions may be motivated partly by air-quality or energy-security goals, but the dominant climate pathway is still transport fuel emissions reduction via fuel substitution.",pricing-mechanism,direct,direct,“exemptions from excise tax”; “the excise is reduced”; “products used as fuels”; “bio-ethanol”; “additives … for unleaded gasoline and diesel”,Reduced local air pollutants from fuel substitution; agricultural/rural income support; energy security/fuel import reduction,"Text references both “exemptions … for bio-diesel” and reductions for other biofuel-related products “with the exception of bio-diesel,” creating a possible internal inconsistency/translation ambiguity; nonetheless, the instrument is clearly differentiated excise-duty relief for biofuels.",[],True,matched token: 'emission',True,no typology code,"Law 388/2000 (2001 Budget Law) introduces multiple sustainable development measures, including tax relief for SMEs’ environmental investments, excise tax exemptions/reductions for certain biofuels and environmentally defensive fuel products, tax credits for geothermal/biomass district heating connections, incentives for sustainable development measures, and establishment of a fund to reduce atmospheric emissions and promote energy efficiency and renewables.",,,,,
5,parent_with_subs,sub,buildings,Table of laws and measures (2000-12-23 Law 388),"Law 388/2000 provides a tax credit of 40,000 Lire per kW to users connecting to district-heating networks operating on geothermal energy or fuelled by biomass.","Law 388/2000 (2001 Budget Law) introduces multiple sustainable development measures, including tax relief for SMEs’ environmental investments, excise tax exemptions/reductions for certain biofuels and environmentally defensive fuel products, tax credits for geothermal/biomass district heating connections, incentives for sustainable development measures, and establishment of a fund to reduce atmospheric emissions and promote energy efficiency and renewables.",standalone parent policy,"Art. 29 'Rules and regulations on geother - mal energy': users who connect a remote-heating network that operates geothermal energy or is fuelled by - masses receive a subsidy (tax credit) of 40,000 Lire for each kW of power used.",Quantified incentive (tax credit per kW) linked to geothermal/biomass district heating.,Perugia_Italy,No vulnerability context provided,Perugia_Italy::4eba9e3b2d6a351bcc01b1fa,Perugia_Italy::4eba9e3b2d6a351bcc01b1fa,False,False,district_heating_decarbonization → building_heat_emissions_reduction,"Provides a tax credit to encourage users to connect to geothermal- or biomass-fuelled district heating networks, shifting heating supply toward lower-carbon sources and reducing heating-related emissions.",None,0.0,None,None,"evidence quote missing one of: [ghg, greenhouse gas, greenhouse gases, emission, ...]; row context missing primary/climate token: [ghg, greenhouse gas, greenhouse gases, emission, ...]",guide_secondary_typology_v1,policy_text_evidence_gated,explicit_self,yes,Mitigation,Heat supply shift (district heating) → ↓ fossil fuel combustion for heating → ↓ GHG emissions → ↓ atmospheric forcing,"1) Change in human activity/system: Cities/heat utilities refurbish and expand district heating networks and modernize connected heat plants, increasing the share of renewable heat (e.g., geothermal, biomass), recovered waste heat, and/or high-efficiency CHP while enabling more buildings to connect.  
2) Mediating physical process: Lower-carbon heat generation and reduced on-site fossil boiler use decrease combustion of natural gas/oil/coal for the same delivered heat (often with additional system efficiency gains from modern networks and CHP).  
3) Climate-relevant outcome: Reduced CO₂ (and to a lesser extent CH₄/N₂O) emissions associated with space and water heating across connected buildings.",The single biggest climate-relevant effect is reduced GHG emissions from building heat by replacing fossil heat with low/zero-carbon district heat.,"1) Dominant causal pathway: Decarbonizing district heat supply reduces fossil fuel combustion used to provide building heat, yielding direct GHG reductions (mitigation).  
2) Why this primary over alternatives: Although district heating upgrades can improve efficiency (resource efficiency) and reliability/comfort (adaptation co-benefits), the defining, largest climate effect across the mechanism is emissions reduction via lower-carbon heat input.  
3) Edge cases applied:  
   - If expansion/refurbishment occurred without meaningful decarbonization (e.g., new coal CHP), the mechanism would not fit this canonical mechanism; within this mechanism, the intent and effect is lower-carbon heat.  
   - Biomass-based heat can have variable lifecycle impacts; nevertheless, policies in this mechanism target lower-carbon/renewable/waste-heat shares, so the dominant intended pathway remains mitigation.  
4) Confirm primary applies to ALL instances: Any policy that “decarbonizes district heating” (raising renewable/waste-heat/low-carbon shares and displacing fossil heat in buildings) primarily functions by reducing heating-related GHG emissions, so Mitigation is consistently primary.  
5) Secondary subtype assignment deferred: Any further subtyping (e.g., “energy supply decarbonization,” “building heat,” “waste-heat recovery,” “CHP efficiency”) requires policy-specific evidence and is deferred to policy-level classification.",0.87,"Potential edge cases include: (a) CHP projects that increase fossil gas use while improving efficiency—net GHG benefit depends on baseline and power/heat displacement; (b) biomass/geothermal sustainability and lifecycle emissions; (c) network expansion emissions/lock-in if paired with fossil heat. These affect net impact magnitude, but not the dominant intended pathway for this canonical mechanism.",incentive-program,direct,direct,"“tax credit”; “receive a subsidy”; “40,000 Lire for each kW”; “connect a remote-heating network”; “operates geothermal energy”; “fuelled by biomass”","Potential local air-quality improvements and reduced household heating costs/energy security benefits, but not explicitly stated.",None,[],True,matched token: 'emission',True,no typology code,"Law 388/2000 (2001 Budget Law) introduces multiple sustainable development measures, including tax relief for SMEs’ environmental investments, excise tax exemptions/reductions for certain biofuels and environmentally defensive fuel products, tax credits for geothermal/biomass district heating connections, incentives for sustainable development measures, and establishment of a fund to reduce atmospheric emissions and promote energy efficiency and renewables.",,,,,
5,parent_with_subs,sub,energy_supply,Table of laws and measures (2000-12-23 Law 388),"Law 388/2000 establishes a fund for the reduction of atmospheric emissions and for promotion of energy efficiency and renewable energy sources, financing national and regional programs and including incentives such as 80% support for solar panels (as described).","Law 388/2000 (2001 Budget Law) introduces multiple sustainable development measures, including tax relief for SMEs’ environmental investments, excise tax exemptions/reductions for certain biofuels and environmentally defensive fuel products, tax credits for geothermal/biomass district heating connections, incentives for sustainable development measures, and establishment of a fund to reduce atmospheric emissions and promote energy efficiency and renewables.",standalone parent policy,"Art. 110 Fund for the reduction of - sions in the atmosphere and for - motion of energy efficiency and - able sources of energy. Financing national and regional programs for reduction of atmospheric emissions, - motion of energy efficiency... Plan for the installation of - els... calling for: incentives of 80% panels.",Creates a named fund with explicit purposes and financing scope; includes described incentive level for solar panels.,Perugia_Italy,No vulnerability context provided,Perugia_Italy::93f876177f5261d30817a7d1,Perugia_Italy::93f876177f5261d30817a7d1,False,False,solar_pv_deployment → fossil_generation_displacement,"The fund provides incentives for installing solar panels, increasing solar generation and displacing fossil-based electricity generation to reduce atmospheric emissions.",None,0.0,None,None,evidence_quote not substring-grounded in source,guide_secondary_typology_v1,policy_text_evidence_gated,explicit_self,yes,Mitigation,Renewable electricity deployment → fossil generation displacement → ↓ fuel combustion → ↓ GHG emissions → ↓ atmospheric forcing,"1) Changed activity/system: Electricity supply mix shifts as PV capacity and generation increase (utility-scale, rooftop, or community solar), changing dispatch and reducing fossil plant run-hours and output.  
2) Mediating process: PV produces electricity without on-site combustion; on the grid, this zero/low-operational-emissions generation substitutes for marginal fossil generation (often gas or coal), reducing fossil fuel use and associated CO2 (and some CH4/N2O) emissions; effects depend on marginal emissions factors, curtailment, and storage/transmission constraints.  
3) Climate-relevant outcome: Net reduction in power-sector GHG emissions (tCO2e) and, secondarily, reductions in co-pollutants from fossil generation.","The single biggest climate-relevant effect is that added solar PV generation displaces fossil electricity generation, lowering power-sector GHG emissions.","1) Dominant causal pathway: PV deployment increases renewable generation that substitutes for fossil generation, yielding a direct decrease in combustion-related GHG emissions—this is classic emissions mitigation.  
2) Why this primary over alternatives: While PV can improve resource efficiency (less fuel input per kWh) and can support resilience if paired with storage/islanding, the principal and most general effect across all such policies is emissions reduction via fossil displacement.  
3) Edge cases applied: If PV is added in a grid with high curtailment or already near-zero marginal emissions, emissions benefits may be smaller, but the intended and typical dominant pathway remains fossil displacement and mitigation. Lifecycle/manufacturing emissions do not overturn the primary operational mitigation effect in standard accounting.  
4) Applicability to ALL instances: Any policy that materially deploys solar PV to increase electricity production shares this dominant mitigation pathway because the mechanism explicitly relies on renewable generation displacing fossil generation.  
5) Note on secondary subtypes: Any further subtype/secondary tagging (e.g., rooftop vs utility-scale, community ownership, resilience microgrids, equity components) is deferred to policy-level evidence and does not change the primary category.",0.95,"Emissions impact depends on the marginal grid mix, curtailment, and whether PV is paired with storage; PV deployed primarily for backup power/resilience could introduce an adaptation co-benefit, but the canonical mechanism specified is fossil generation displacement (mitigation).",incentive-program,enabling,direct,“Fund for the reduction of … emissions in the atmosphere”; “promotion of energy efficiency and renewable sources of energy”; “Financing national and regional programs”; “Plan for the installation of … panels”; “incentives of 80% [for] panels”,Air quality improvements (reduced conventional air pollutants from fossil generation); potential energy affordability/energy security benefits,"The OCR-like truncation (“- sions”, “- motion”, “- able”) makes some phrases incomplete, but the intent is clear: a financing fund with a specified high-percentage incentive for solar panel installation (capital subsidy/rebate).",[],True,matched token: 'emission',True,no typology code,"Law 388/2000 (2001 Budget Law) introduces multiple sustainable development measures, including tax relief for SMEs’ environmental investments, excise tax exemptions/reductions for certain biofuels and environmentally defensive fuel products, tax credits for geothermal/biomass district heating connections, incentives for sustainable development measures, and establishment of a fund to reduce atmospheric emissions and promote energy efficiency and renewables.",,,,,
