cluster_id,cluster_type,role,sector,section_header,policy_statement,parent_statement,parent_row_type,verbatim_text,extraction_rationale,location,location_vulnerability_context,row_key,source_bundle_key,is_atomized_row,is_decomposed,canonical_mechanism,mechanism_description,typology_code,typology_confidence,typology_evidence_quote,secondary_categories,gate_demoted_reason,classification_schema_version,secondary_profile,climate_screen,is_financial_instrument,primary_category,primary_causal_pathway,causal_mechanism_detail,dominant_pathway_test,mechanism_classification_reasoning,mechanism_confidence,mechanism_edge_case_notes,instrument_type,instrument_directness,climate_relevance,key_indicators,co_benefits,instance_edge_case_notes,language_violations,primary_gate_passed,primary_gate_reason,secondary_gate_passed,secondary_gate_reason,parent_policy_name,rescue_disposition,rescue_reasoning,rescue_confidence,primary_gate_rescued,dropped_by_climate_rescue
1,parent_with_subs,parent,land_use,Policies and measures,"Italy implements programmes and initiatives in agriculture and forestry to increase and better manage forest areas/woodlands, reclaim abandoned territories, and protect areas at instability or desertification risk to increase carbon sinks.",,standalone parent policy,"Measures in the agricultural and forestry sectors include the implementation of programmes and initiatives aimed at increasing the quantity and improving  the  management  of  forest  areas  and  woodlands, reclaiming of abandoned territories, and protection of territories that face instability or desertification risks:",Umbrella package introduced with multiple bullet-point measures listed underneath.,Perugia_Italy,No vulnerability context provided,Perugia_Italy::82442de45ef4fd33bfb9ee88,Perugia_Italy::82442de45ef4fd33bfb9ee88,False,False,afforestation_greenbelt → desertification_and_erosion_control,"Italy implements programmes and initiatives to increase and improve management of forest and woodland areas, reclaim abandoned territories, and protect land at risk of instability or desertification, strengthening carbon sinks and land resilience.",None,0.0,None,None,"evidence quote missing one of: [hazard, exposure, vulnerab, resilien, ...]; evidence quote missing secondary subtype token: [hazard, exposure, vulnerab, resilien, ...]",guide_secondary_typology_v1,policy_text_evidence_gated,explicit_self,no,Nature-Based Solutions,Ecosystem enhancement (afforestation/greenbelts) → ↑ biomass + soil carbon storage (carbon sinks) (+ stabilized soils/vegetation cover) → ↓ net atmospheric CO₂ (and often ↓ land degradation impacts),"1) Change in human activity/system: The city (or its partners) plants trees and restores/expands vegetated areas via afforestation, greenbelts/green walls, and rehabilitation of degraded lands susceptible to desertification and erosion.  
2) Mediating physical/ecological process: Increased photosynthesis and biomass accumulation store carbon in woody biomass and soils; improved ground cover and root systems reduce wind/water erosion, retain soil moisture, and slow land degradation/desertification processes.  
3) Climate-relevant outcome: Net removal of CO₂ from the atmosphere through enhanced carbon sinks (mitigation outcome) with frequent adaptation co-benefits such as reduced dust storm impacts, improved microclimates, and reduced vulnerability of soils/land to climate stresses.","The single biggest climate-relevant effect is increased net carbon sequestration from added tree biomass/soil carbon (enhanced carbon sink), lowering net atmospheric CO₂.","1) Dominant causal pathway: Planting trees/restoring vegetation → increased biomass/soil carbon → increased carbon sink → reduced net atmospheric CO₂.  
2) Why this primary over alternatives: Although some representative policies emphasize adaptation (e.g., dust-storm buffering via green walls) and land/soil productivity (resource efficiency framing), the mechanism as defined (“afforestation/greenbelt”) is inherently an ecosystem-based intervention whose most climate-distinctive and broadly applicable effect is carbon sequestration; thus Nature-Based Solutions best captures the primary pathway.  
3) Edge cases applied: If a specific project is designed primarily as a hazard barrier (dust/heat/wind) with minimal or non-additional carbon benefits (e.g., high mortality, non-additional plantings, heavy irrigation emissions), the adaptation benefit could dominate at the individual policy level—but that would be a policy-specific re-interpretation rather than a change in this canonical mechanism’s dominant pathway.  
4) Confirm applies to ALL instances sharing this mechanism: All policies that fit “afforestation/greenbelt for desertification/erosion control” involve increasing vegetative cover; this consistently implicates ecosystem enhancement and potential carbon sink gains even when co-goals include erosion control and dust reduction.  
5) Secondary subtype deferred: Whether a given policy should be tagged with an adaptation co-benefit (dust/erosion/heat) or mitigation strength depends on local design details (species, additionality, permanence, irrigation/energy inputs, baseline land cover) and is deferred to policy-level evidence.",0.83,"Some implementations (e.g., irrigated green walls in arid regions, non-native monocultures, low survival rates, or plantings on already-forested land) can reduce or negate net mitigation due to water/energy use, albedo changes, or lack of additionality; in those cases adaptation (dust/erosion control) may be the dominant realized benefit even though the mechanism is still nature-based restoration/afforestation.",infrastructure-investment,direct,direct,“implementation of programmes and initiatives”; “increasing the quantity”; “improving the management of forest areas and woodlands”; “reclaiming of abandoned territories”; “protection of territories that face instability or desertification risks”,Reduced erosion/land degradation and desertification risk; improved soil stability and moisture retention; biodiversity and habitat enhancement,"Could also be framed as a high-level planning/strategy instrument because it does not specify the concrete delivery tool (e.g., subsidy vs. public works). Given the emphasis on implementing programmes to increase forest area and protect/reclaim territories, it is treated as an investment/programmatic intervention rather than a target or regulation.",[],True,matched token: 'forest',True,no typology code,,,,,,
1,parent_with_subs,sub,energy_supply,Policies and measures,"Under current legislation (trend scenario), Italy includes a minimum 2% share of electricity production from new plants using renewable sources (Law Decree 79/1999).","Italy implements programmes and initiatives in agriculture and forestry to increase and better manage forest areas/woodlands, reclaim abandoned territories, and protect areas at instability or desertification risk to increase carbon sinks.",standalone parent policy,"The  'trend' emission scenario for 2010, 'under current legislation', includes measures already adopted:

- minimum  share  (2%)  of  electricity  production from  new  plants  using  renewable  sources  (law decree 79/1999);",Quantified renewable electricity obligation explicitly cited as an adopted measure within the Action Plan’s trend scenario.,Perugia_Italy,No vulnerability context provided,Perugia_Italy::cf08b4b260f1258d26679f3f,Perugia_Italy::cf08b4b260f1258d26679f3f,False,False,renewable_energy_procurement → grid_decarbonization,"It includes a minimum share of electricity production from new renewable-source plants, increasing renewable generation and displacing fossil generation to reduce power-sector emissions.",None,0.0,None,None,,guide_secondary_typology_v1,policy_text_evidence_gated,explicit_self,no,Mitigation,Electricity procurement / demand shift → ↑ renewable generation share → ↓ fossil generation → ↓ CO₂e emissions → ↓ atmospheric forcing,"(1) Change in human activity/system: The city changes electricity sourcing for public buildings (and sometimes broader municipal operations) to purchase/contract for renewable electricity rather than conventional grid mix.  
(2) Mediating physical process: Increased renewable electricity supply (via PPAs, RECs, utility green tariffs, or on-/off-site projects) reduces the need for fossil-fueled power plants to generate electricity, lowering combustion-related emissions (and associated upstream fuel-cycle emissions).  
(3) Climate-relevant outcome: Net reduction in CO₂e emissions from electricity generation attributable to municipal electricity consumption, contributing to overall grid decarbonization and lower cumulative emissions.",The single biggest climate-relevant effect is reducing GHG emissions by replacing fossil electricity generation with renewable electricity on the grid.,"1) Dominant causal pathway: The core causal chain is “procure more renewable electricity → displace fossil generation → reduce GHG emissions,” which is directly mitigation-focused.  
2) Why this primary over alternatives: While renewable procurement can incidentally improve energy security or price stability (resource efficiency/resilience co-benefits), the dominant and intended climate effect is emissions reduction from the power sector.  
3) Edge cases applied: If a policy only claims “renewable” via unbundled certificates with weak additionality, real-world emissions impacts can be smaller; however, the mechanism as stated still targets grid decarbonization via renewable sourcing and is best categorized as Mitigation.  
4) Applicability to ALL instances: Any policy that increases renewable electricity procurement/use (especially for municipal/public buildings) operates through the same primary pathway of reducing fossil-based electricity emissions.  
5) Note on secondary subtypes: Any secondary subtype distinctions (e.g., municipal operations vs. community-wide targets; on-site generation vs. procurement instruments; REC quality/additionality) require policy-specific evidence and are deferred to policy-level assessment.",0.92,"Emissions benefits depend on additionality and accounting (e.g., bundled vs. unbundled RECs, local vs. remote procurement, marginal grid emissions). Some “clean energy” targets may include nuclear or fossil w/ CCS; classification remains Mitigation because the dominant intended pathway is reduced power-sector GHG emissions.",regulatory-mandate,direct,direct,“under current legislation”; “minimum share (2%)”; “electricity production from new plants”; “using renewable sources”; “law decree 79/1999”,None,Could also be construed as a performance/quota standard (renewable portfolio requirement); classified as regulatory-mandate because it imposes a legally binding minimum share rather than an aspirational target or incentive.,[],True,matched token: 'emission',True,no typology code,"Italy implements programmes and initiatives in agriculture and forestry to increase and better manage forest areas/woodlands, reclaim abandoned territories, and protect areas at instability or desertification risk to increase carbon sinks.",,,,,
1,parent_with_subs,sub,energy_supply,Policies and measures,"Italy’s Prime Minister Decree of 4 August 1999 provides for ENEL to sell ~15,000 MW and mandates conversion of ~10,000 MW of existing oil-fired thermo-electric capacity to natural gas combined cycle.","Italy implements programmes and initiatives in agriculture and forestry to increase and better manage forest areas/woodlands, reclaim abandoned territories, and protect areas at instability or desertification risk to increase carbon sinks.",standalone parent policy,"- Prime  Minister  Decree  of  4  August  1999  providing for selling by ENEL of approximately 15,000 MW, and compulsory  conversion  of  existing  oil fired thermo-electric plants into natural gas combined cycle plants for about 10,000 MW;",Specific regulatory intervention with quantified MW amounts and binding language ('compulsory conversion').,Perugia_Italy,No vulnerability context provided,Perugia_Italy::54f83d7b639fba7e1f3027b4,Perugia_Italy::54f83d7b639fba7e1f3027b4,False,False,oil_to_gas_power_plant_conversion → power_sector_emissions_intensity_reduction,"The decree mandates converting existing oil-fired thermoelectric plants to natural gas combined-cycle plants, which lowers the carbon intensity of electricity generation and reduces power-sector emissions.",None,0.0,None,None,"evidence quote missing one of: [ghg, greenhouse gas, greenhouse gases, emission, ...]; evidence quote missing secondary subtype token: [hazard, exposure, vulnerab, resilien, ...]",guide_secondary_typology_v1,policy_text_evidence_gated,explicit_self,no,Mitigation,Power generation fuel/technology switch → ↓ emissions intensity (CO₂e/MWh) → ↓ absolute GHG emissions → ↓ atmospheric forcing,"(1) Change: Existing thermoelectric plants are retrofitted/repowered or replaced to run on natural gas combined-cycle instead of oil-fired generation. (2) Mediating process: Natural gas combustion has lower carbon content per unit energy than oil and combined-cycle units typically convert fuel to electricity more efficiently, both of which reduce CO₂ per MWh (with methane leakage as a potential offset outside the plant boundary). (3) Outcome: Reduced lifecycle or direct-stack GHG emissions from electricity generation, lowering power-sector emissions.","Fuel/technology switching in power generation (oil → natural gas combined-cycle) primarily lowers CO₂e per MWh, reducing total power-sector GHG emissions.","1) Dominant causal pathway: Switching from oil-fired to gas combined-cycle generation reduces emissions intensity and thus total GHG emissions from the power sector.  
2) Why this primary over alternatives: While it can also improve fuel efficiency (a resource-efficiency co-benefit), the primary objective and effect is direct GHG mitigation through lower-carbon electricity generation. It is not adaptation (doesn’t primarily reduce hazard exposure) or nature-based (no ecosystem sink pathway).  
3) Edge cases applied: If upstream methane leakage is very high, net mitigation benefits can shrink; however, the mechanism as defined is still aimed at emissions-intensity reduction at the generation stage. If conversions are paired with major demand changes, that’s a separate mechanism.  
4) Confirm applies to ALL instances: Any policy that mandates or causes oil-to-gas combined-cycle conversion in power plants has the same dominant effect—lower emissions intensity of power generation—so Mitigation remains the correct primary category across instances.  
5) Secondary subtype deferred: Any finer-grained subtype (e.g., “fuel switching,” “power plant efficiency upgrade,” “grid emissions intensity”) depends on policy-specific evidence and is deferred to policy-level classification.",0.9,"Upstream methane leakage and lock-in of fossil infrastructure can reduce or delay net climate benefits; some conversions may be framed as air-quality or reliability actions, but the dominant climate-relevant pathway remains emissions-intensity reduction in electricity generation.",regulatory-mandate,direct,direct,"“Prime Minister Decree”; “compulsory conversion”; “oil fired thermo-electric plants into natural gas combined cycle plants”; “about 10,000 MW”; “providing for selling by ENEL of approximately 15,000 MW”",Potential air-quality improvements (lower SOx/PM) and local health benefits from switching away from oil combustion; possible power-sector efficiency/reliability gains.,"The “selling by ENEL of approximately 15,000 MW” could be interpreted as electricity-market restructuring/privatization (not inherently climate-motivated). The classification is driven by the explicit “compulsory conversion” mandate, which is unambiguously mitigation-relevant.",[],True,matched token: 'emission',True,no typology code,"Italy implements programmes and initiatives in agriculture and forestry to increase and better manage forest areas/woodlands, reclaim abandoned territories, and protect areas at instability or desertification risk to increase carbon sinks.",,,,,
1,parent_with_subs,sub,energy_supply,Policies and measures,Italy increases the use of coal in power plants from 9% to 14% (as part of measures already adopted under the trend scenario).,"Italy implements programmes and initiatives in agriculture and forestry to increase and better manage forest areas/woodlands, reclaim abandoned territories, and protect areas at instability or desertification risk to increase carbon sinks.",standalone parent policy,- increase in the use of coal in power plants from 9% to 14%;,Explicit quantified change in fuel mix stated as a measure in the trend scenario.,Perugia_Italy,No vulnerability context provided,Perugia_Italy::a1cf270012c9e4a5e3bc1b4a,Perugia_Italy::a1cf270012c9e4a5e3bc1b4a,False,False,coal_generation_increase → power_sector_emissions_increase,"It increases coal use in power plants, which raises the carbon intensity of electricity generation and increases power-sector greenhouse gas emissions.",None,0.0,None,None,"evidence quote missing one of: [ecosystem, habitat, tree, trees, ...]; contextual pass disabled for rare code 'M-3'",guide_secondary_typology_v1,policy_text_evidence_gated,explicit_self,no,Mitigation,Fuel switch (toward coal) → ↑ combustion CO₂ emissions per kWh → ↑ total power-sector GHG emissions → ↑ atmospheric forcing,"(1) Change in human activity/system: The electricity supply mix shifts toward greater coal generation (higher coal capacity utilization and/or more coal capacity and dispatch).  
(2) Mediating physical process: Burning coal oxidizes carbon to CO₂ (and emits CH₄/N₂O in smaller quantities) at a higher emissions intensity per unit electricity than most alternatives; upstream coal mining/transport can add methane emissions.  
(3) Climate-relevant outcome: Higher lifecycle GHG emissions from the power sector (especially CO₂), worsening mitigation performance and increasing radiative forcing relative to a lower-coal baseline.","Increasing coal-fired electricity generation raises power-sector CO₂ emissions, increasing net greenhouse gas emissions.","1) Dominant causal pathway: More coal burned for power → higher CO₂ per kWh and typically higher total CO₂ → increased net GHG emissions.  
2) Why this primary over alternatives: The single largest climate-relevant effect is the change in GHG emissions (mitigation domain); it is not primarily about reducing energy input (resource efficiency), reducing hazard exposure (adaptation), or enhancing ecosystems (nature-based solutions).  
3) Edge cases applied: Even if coal displaces oil/diesel generation, coal usually remains high-carbon and the mechanism’s defining feature is increased coal use; any local air-quality co-benefits/harms or reliability benefits do not change the dominant climate pathway. CCS would be a different mechanism (coal + capture), not this one.  
4) Applicability to ALL instances: Any policy that increases coal generation or coal share in electricity supply will, in expectation and in the dominant causal chain, increase power-sector GHG emissions relative to a counterfactual with less coal.  
5) Secondary subtype deferred: Any further tagging (e.g., “negative mitigation / emissions increase,” “fossil fuel expansion,” “energy security”) must be assigned at the individual policy level based on the specific design and context.",0.97,"If coal replaces an even more carbon-intensive temporary backup (rare) or if fully coupled with high capture rates CCS, the net effect could differ; those cases should be represented by different canonical mechanisms (e.g., “coal_with_CCS → emissions_reduction” or “diesel_to_coal → emissions_change”). Otherwise straightforward.",target-setting,indirect,direct,"""increase in the use of coal in power plants""; ""from 9% to 14%""",None,"Instrument is not explicitly stated (could reflect multiple underlying tools such as subsidies, dispatch rules, or delayed phase-out), so classification is inferred as mix/usage target rather than a clearly specified regulatory or fiscal instrument.",[],True,matched token: 'emission',True,no typology code,"Italy implements programmes and initiatives in agriculture and forestry to increase and better manage forest areas/woodlands, reclaim abandoned territories, and protect areas at instability or desertification risk to increase carbon sinks.",,,,,
