cluster_id,cluster_type,role,sector,section_header,policy_statement,parent_statement,parent_row_type,verbatim_text,extraction_rationale,location,location_vulnerability_context,row_key,source_bundle_key,is_atomized_row,is_decomposed,canonical_mechanism,mechanism_description,typology_code,typology_confidence,typology_evidence_quote,secondary_categories,gate_demoted_reason,classification_schema_version,secondary_profile,climate_screen,is_financial_instrument,primary_category,primary_causal_pathway,causal_mechanism_detail,dominant_pathway_test,mechanism_classification_reasoning,mechanism_confidence,mechanism_edge_case_notes,instrument_type,instrument_directness,climate_relevance,key_indicators,co_benefits,instance_edge_case_notes,language_violations,primary_gate_passed,primary_gate_reason,secondary_gate_passed,secondary_gate_reason,parent_policy_name,rescue_disposition,rescue_reasoning,rescue_confidence,primary_gate_rescued,dropped_by_climate_rescue
1,parent_with_subs,sub,transport,Policies and measures,"Under the reference scenario, Italy develops new infrastructure to shift passenger and freight transport from roads to railways and coasting navigation.","Italy implements programmes and initiatives in agriculture and forestry to increase and better manage forest areas/woodlands, reclaim abandoned territories, and protect areas at instability or desertification risk to increase carbon sinks.",standalone parent policy,"- new infrastructures, with effects on the transportation of passengers and goods from road to railways and coasting navigation;",Concrete infrastructure-led modal shift measure explicitly stated.,Perugia_Italy,No vulnerability context provided,Perugia_Italy::b9d90d80c1fcca61307dff77,Perugia_Italy::b9d90d80c1fcca61307dff77,False,False,modal_shift_to_sustainable_transport → transport_emissions_reduction,"Develops new infrastructure that shifts passenger and freight transport from roads to railways and coasting navigation, reducing transport emissions.",None,0.0,None,None,"evidence quote missing one of: [ecosystem, habitat, tree, trees, ...]; contextual pass disabled for rare code 'M-3'",guide_secondary_typology_v1,policy_text_evidence_gated,explicit_self,no,Mitigation,"Mobility system change (↑ transit access + ↑ multimodal connectivity) → modal shift (↓ single-occupancy driving, ↓ VKT) → ↓ fuel combustion → ↓ GHG emissions → ↓ atmospheric forcing","1) Change in human activity/system: Cities invest in and redesign mobility access (mobility hubs, park-and-ride, bike/scooter links, integrated transfers) to make transit and shared/active modes easier and more reliable than driving alone.  
2) Mediating physical process: Reduced internal-combustion vehicle use lowers gasoline/diesel combustion (and associated upstream fuel-cycle emissions); in some cases, congestion relief can further reduce per-km emissions, though rebound can offset.  
3) Climate-relevant outcome: Net reduction in transport CO₂e emissions through lower vehicle travel and substitution toward lower-emitting passenger-km modes.",The single biggest climate-relevant effect is reduced tailpipe (and upstream) GHG emissions from fewer car trips and/or shorter car travel due to a modal shift to lower-carbon transport.,"1) Dominant causal pathway: Improve multimodal connectivity to enable modal shift away from single-occupancy vehicles, leading to lower fuel combustion and lower GHG emissions.  
2) Why this primary over alternatives: While such hubs can improve accessibility (a co-benefit) and sometimes reduce energy use per trip (resource efficiency), the defining and largest climate effect across policies sharing this mechanism is emissions mitigation via reduced car use.  
3) Edge cases applied: If a “mobility hub” primarily induces additional driving (e.g., large park-and-ride generating new trips) or is implemented mainly for resilience/evacuation, the dominant effect could weaken or shift; however, the stated mechanism explicitly targets modal shift to sustainable transport and emissions reduction.  
4) Applies to ALL instances sharing this mechanism: Any policy whose core mechanism is shifting trips from single-occupancy driving to transit/active/shared modes will primarily operate through transport emissions reductions, making Mitigation the consistent primary category.  
5) Secondary subtype deferred: Whether the policy’s realized impact is large, and whether it also qualifies for secondary labels (e.g., air quality, equity, congestion, adaptation co-benefits), depends on policy-specific design and evidence and is not assigned at the mechanism level.",0.86,"Park-and-ride elements can create induced driving or shift trips from active modes to car-to-transit, reducing net benefits; outcomes depend on parking supply/pricing, transit frequency, land-use context, and whether buses/rail are low-carbon. If transit vehicles are diesel and poorly utilized, emissions reductions may be smaller, but the intended dominant pathway remains mitigation via modal shift.",infrastructure-investment,direct,direct,“new infrastructures”; “effects on the transportation of passengers and goods from road to railways and coasting navigation”; “shift … from roads to railways”,"Reduced air pollution (NOx/PM), congestion reduction, improved road safety, potentially lower noise pollution.","“Coasting navigation” could have variable emissions depending on vessel fuel and efficiency; however, the policy intent is modal shift away from road, and the instrument is clearly infrastructure construction, so classification remains infrastructure-investment with direct mitigation relevance.",[],True,matched token: 'emission',True,no typology code,"Italy implements programmes and initiatives in agriculture and forestry to increase and better manage forest areas/woodlands, reclaim abandoned territories, and protect areas at instability or desertification risk to increase carbon sinks.",,,,,
1,parent_with_subs,sub,transport,Policies and measures,"Under the reference scenario, Italy promotes the production and use of high-efficiency vehicles and fuels.","Italy implements programmes and initiatives in agriculture and forestry to increase and better manage forest areas/woodlands, reclaim abandoned territories, and protect areas at instability or desertification risk to increase carbon sinks.",standalone parent policy,- promotion of the production and use of high-efficiency vehicles and fuels;,"Specified intervention to promote efficient vehicles and fuels (policy action, even if instruments not detailed).",Perugia_Italy,No vulnerability context provided,Perugia_Italy::c78ae03c7d2951ad3f65f1dd,Perugia_Italy::c78ae03c7d2951ad3f65f1dd,False,False,vehicle_fuel_efficiency_improvement → transport_emissions_reduction,"The policy promotes the production and use of high-efficiency vehicles and fuels, reducing energy consumed per trip and lowering transport greenhouse gas emissions.",None,0.0,None,None,"evidence quote missing one of: [ghg, greenhouse gas, greenhouse gases, emission, ...]; evidence quote missing secondary subtype token: [hazard, exposure, vulnerab, resilien, ...]",guide_secondary_typology_v1,policy_text_evidence_gated,explicit_self,no,Mitigation,Same mobility service (vehicle-km) → ↓ fuel use per km → ↓ combustion CO₂e emissions → ↓ atmospheric forcing,"(1) Change in system/activity: Vehicle design, drivetrain efficiency, and/or operational efficiency improves so that vehicles consume less fuel per unit distance for the same travel demand.  
(2) Mediating physical process: Reduced fuel combustion (and upstream fuel supply-chain throughput) lowers CO₂ emissions per km; in some cases also reduces CH₄/N₂O associated with fuel use and refining.  
(3) Climate-relevant outcome: Lower total transportation-sector GHG emissions (CO₂e), contingent on vehicle activity levels.","The single biggest climate-relevant effect is reduced fossil fuel consumption per mile traveled, leading to lower transportation GHG emissions.","1) Dominant causal pathway: improving fuel efficiency reduces fuel burned per mile, which directly reduces GHG emissions from combustion (mitigation).  
2) Why this primary over alternatives: While efficiency is sometimes framed as “resource efficiency,” the dominant climate effect for this transport mechanism is emissions reduction from reduced fossil fuel combustion; thus Mitigation is the correct primary category under the dominant pathway rule.  
3) Edge cases applied: Rebound effects (more driving due to lower per-mile cost) can partially offset savings, but do not change the mechanism’s primary intent/effect pathway. If the “efficiency” improvement is achieved via electrification, the mechanism would shift to a different canonical pathway (vehicle electrification → grid emissions), but that is outside this specified mechanism.  
4) Applicability to ALL instances: Any policy that improves vehicle fuel economy (regardless of city/context) primarily works by lowering fuel use per distance and therefore lowering transport emissions.  
5) Note on secondary assignment: Any secondary subtypes (e.g., pricing vs. standards vs. procurement; passenger vs. freight) require policy-specific evidence and are deferred to policy-level classification.",0.9,"Potential rebound effects can reduce net emissions benefits; lifecycle impacts of vehicle manufacturing/lightweight materials and upstream fuel-cycle emissions may matter but typically remain secondary to use-phase fuel combustion for this mechanism. If a policy mixes “high-efficiency vehicles and fuels” with low-carbon fuels/electrification, it may span adjacent mechanisms, but the fuel-efficiency component remains Mitigation.",incentive-program,enabling,direct,“promotion”; “production and use”; “high-efficiency vehicles and fuels”,"Reduced local air pollutants (NOx/PM), improved energy security, potential cost savings for drivers/fleets.","The instrument is underspecified: “promotion” could also be implemented via performance standards, labeling/information, or R&D support. With no explicit mandate/standard/labeling mentioned, it is treated as an incentive-type enabling measure.",[],True,matched token: 'emission',True,no typology code,"Italy implements programmes and initiatives in agriculture and forestry to increase and better manage forest areas/woodlands, reclaim abandoned territories, and protect areas at instability or desertification risk to increase carbon sinks.",,,,,
1,parent_with_subs,sub,land_use,Policies and measures,Implement management of existing forests as part of agricultural and forestry measures to increase carbon sinks.,"Italy implements programmes and initiatives in agriculture and forestry to increase and better manage forest areas/woodlands, reclaim abandoned territories, and protect areas at instability or desertification risk to increase carbon sinks.",standalone parent policy,- management of existing forests;,Specific listed measure under the agriculture/forestry package.,Perugia_Italy,No vulnerability context provided,Perugia_Italy::e0a1e5294af9b290fd4eef9d,Perugia_Italy::e0a1e5294af9b290fd4eef9d,False,False,forest_management → carbon_sequestration_enhancement,"Management of existing forests increases the amount of carbon stored and sequestered in forest ecosystems, strengthening carbon sinks.",None,0.0,None,None,evidence_quote not substring-grounded in source,guide_secondary_typology_v1,policy_text_evidence_gated,explicit_parent,no,Nature-Based Solutions,Forest ecosystem management → ↑ biomass/soil carbon stocks → ↑ net CO₂ removals (enhanced carbon sink),"1) Changed human activity/system: How existing forests are managed (e.g., harvest intensity/rotation, thinning regimes, restoration within forest stands, protection from degradation, fuel management aligned with maintaining stocks).  
2) Mediating physical/ecological process: Altered forest growth, mortality, decomposition, and soil carbon dynamics that increase standing biomass and/or soil organic carbon and reduce carbon losses from disturbance/degradation.  
3) Climate-relevant outcome: Higher long-term carbon storage and increased net sequestration, lowering atmospheric CO₂ concentration relative to baseline.","The single biggest climate-relevant effect is increased net CO₂ sequestration and storage in managed forests, strengthening land-sector carbon sinks.","1) Dominant causal pathway: Forest management changes ecosystem function to increase carbon stocks, yielding increased net CO₂ removals (a sink enhancement).  
2) Why this primary over alternatives: While some forest management can also reduce wildfire risk (adaptation) or yield biomass products (resource/energy interactions), the mechanism as defined is explicitly “carbon sequestration enhancement” in existing forests—i.e., a nature-based carbon sink pathway is primary.  
3) Edge cases applied: If “management” focuses mainly on hazard reduction (e.g., fuel breaks) with net carbon losses, the dominant effect could shift toward adaptation or even reduced sequestration; however, such cases would not fit this canonical mechanism as stated (enhancing sinks).  
4) Applies to ALL instances: Any policy sharing this mechanism targets increased carbon stored/sequestered in forest ecosystems, which is consistently a nature-based sink enhancement.  
5) Secondary subtype deferred: Any additional benefits (biodiversity, resilience, wildfire risk reduction, wood product substitution) require policy-specific evidence and are not assigned at the mechanism level here.",0.9,"Edge case: some “forest management” (e.g., aggressive thinning, salvage logging) can reduce near-term carbon stocks; classification assumes practices are designed and verified to increase net ecosystem carbon over the relevant accounting period, consistent with the mechanism definition.",planning-strategy,direct,direct,“management of existing forests”,Biodiversity conservation; watershed protection; soil conservation; reduced wildfire risk (if fuel management is part of management); improved local air quality (via reduced severe fire),"Instrument is underspecified: “management” could be implemented via regulatory mandates, performance standards, incentives, or operational public-forest management; classified as planning-strategy due to lack of explicit tool language.",[],True,matched token: 'forest',True,no typology code,"Italy implements programmes and initiatives in agriculture and forestry to increase and better manage forest areas/woodlands, reclaim abandoned territories, and protect areas at instability or desertification risk to increase carbon sinks.",,,,,
1,parent_with_subs,sub,land_use,Policies and measures,Implement revegetation of farmlands and grazing lands to support increased carbon sinks.,"Italy implements programmes and initiatives in agriculture and forestry to increase and better manage forest areas/woodlands, reclaim abandoned territories, and protect areas at instability or desertification risk to increase carbon sinks.",standalone parent policy,- revegetation of farmlands and grazing lands;,Specific listed land-based measure under the agriculture/forestry package.,Perugia_Italy,No vulnerability context provided,Perugia_Italy::51a95b2bef612be1d94f44f6,Perugia_Italy::51a95b2bef612be1d94f44f6,False,False,revegetation_of_agricultural_land → carbon_sequestration_enhancement,"Revegetating farmlands and grazing lands increases vegetation and soil carbon storage, strengthening carbon sinks.",None,0.0,None,None,"evidence quote missing one of: [ecosystem, habitat, tree, trees, ...]; evidence quote missing secondary subtype token: [hazard, exposure, vulnerab, resilien, ...]",guide_secondary_typology_v1,policy_text_evidence_gated,explicit_parent,no,Nature-Based Solutions,Land management change (revegetation) → ↑ biomass + soil organic carbon → ↑ carbon sink → ↓ net atmospheric CO₂ (↓ radiative forcing),"(1) Change: Farmland and grazing land management is altered to restore/establish vegetative cover (e.g., native grasses, shrubs, trees, riparian vegetation) and reduce practices that deplete soil carbon.  
(2) Mediating process: Plant growth fixes CO₂ via photosynthesis and transfers carbon to long-lived biomass and soils (roots, litter inputs, improved soil structure), increasing soil organic carbon stocks and reducing erosion-related carbon losses.  
(3) Climate outcome: Greater long-term carbon storage increases net sequestration, reducing net GHG concentrations (primarily CO₂) relative to the baseline.",The single biggest climate-relevant effect is increased net removal of CO₂ from the atmosphere through enhanced biomass and soil carbon sequestration on revegetated agricultural land.,"1) Dominant causal pathway: Revegetation → increased ecosystem carbon storage (biomass + soils) → reduced net atmospheric CO₂.  
2) Why this primary over alternatives: While revegetation can also improve resource efficiency (e.g., reduced erosion, improved water retention) or adaptation (e.g., heat/wind buffering, drought resilience), the defining and largest climate-relevant effect in this mechanism is enhanced carbon sequestration via ecosystem processes—hallmark of Nature-Based Solutions.  
3) Edge cases applied: If revegetation is implemented mainly for erosion control, biodiversity, or water benefits, it could look like adaptation/co-benefits; however, the canonical mechanism explicitly centers on carbon sink enhancement, keeping the primary category as NBS.  
4) Applies to ALL instances: Any policy that fits this mechanism (revegetating agricultural/grazing lands specifically to enhance carbon sequestration) shares the same dominant sink-driven pathway, so NBS is consistently primary.  
5) Secondary subtype assignment deferred: Whether a specific policy is best tagged additionally as adaptation (microclimate, drought resilience), resource efficiency (soil retention), or mitigation co-benefits depends on policy-level evidence and is deferred.",0.92,"If revegetation includes substantial fertilizer increases, irrigation expansion, or land-use changes that raise non-CO₂ emissions (e.g., N₂O) or cause indirect land-use change elsewhere, net climate benefits could be reduced; these do not change the primary mechanism category but may affect net impact assessment.",incentive-program,direct,direct,“revegetation”; “farmlands and grazing lands”; “carbon sinks”,Biodiversity/habitat enhancement; soil erosion control; improved soil health and water retention; rangeland productivity,"The excerpt does not specify the actual policy lever (e.g., grant, mandate, standard, or plan); classification as an incentive-program is inferred from typical implementation of revegetation/restoration measures.",[],True,rescued_by_f1_5,True,no typology code,"Italy implements programmes and initiatives in agriculture and forestry to increase and better manage forest areas/woodlands, reclaim abandoned territories, and protect areas at instability or desertification risk to increase carbon sinks.",keep,"Climate relevance is explicit in the text: the policy_statement commits to 'revegetation of farmlands and grazing lands' specifically 'to support increased carbon sinks,' which is a direct carbon sequestration (mitigation) outcome consistent with Nature-Based Solutions. The parent_statement reiterates the aim 'to increase carbon sinks.' The gate failure reflects missing outcome-token detection, not substantive non-climate content.",0.93,True,False
1,parent_with_subs,sub,land_use,Policies and measures,Implement natural reforestation to support increased carbon sinks.,"Italy implements programmes and initiatives in agriculture and forestry to increase and better manage forest areas/woodlands, reclaim abandoned territories, and protect areas at instability or desertification risk to increase carbon sinks.",standalone parent policy,- natural reforestation;,Specific listed measure under the agriculture/forestry package.,Perugia_Italy,No vulnerability context provided,Perugia_Italy::5aa4b3b8735555c8c468c4da,Perugia_Italy::5aa4b3b8735555c8c468c4da,False,False,natural_reforestation → carbon_sequestration_increase,"Natural reforestation increases vegetative cover, which boosts carbon uptake and storage in biomass and soils.",None,0.0,None,None,"evidence quote missing one of: [hazard, exposure, vulnerab, resilien, ...]; evidence quote missing secondary subtype token: [hazard, exposure, vulnerab, resilien, ...]",guide_secondary_typology_v1,policy_text_evidence_gated,explicit_self,no,Nature-Based Solutions,Ecosystem enhancement (natural forest regeneration) → ↑ biomass + ↑ soil organic carbon → ↑ carbon sequestration (CO₂ removal) → ↓ atmospheric CO₂ concentration → ↓ radiative forcing,"1) Changed human activity/system: Land management shifts to allow or assist natural forest regeneration (e.g., reducing grazing/clearing, protecting regenerating areas, managing disturbance), increasing tree/shrub cover and ecosystem maturity over time.  
2) Mediating physical/ecological process: Photosynthesis draws down CO₂; carbon accumulates in living biomass, deadwood/litter, and soil organic matter as vegetation establishes and soils recover.  
3) Climate-relevant outcome: Higher net ecosystem carbon balance (greater removals and/or lower losses) increases long-term carbon storage, reducing net GHG concentrations relative to a non-forested or degraded baseline.",The single biggest climate-relevant effect is increased net removal and storage of CO₂ from the atmosphere via greater carbon sequestration in forest biomass and soils.,"1) Dominant causal pathway: Ecosystem enhancement leading to increased CO₂ removal and storage (carbon sink strengthening).  
2) Why this primary over alternatives: Although mitigation is an outcome, the mechanism is explicitly nature-mediated (forest ecosystem regrowth) and is most appropriately categorized as Nature-Based Solutions rather than generic Mitigation or Resource Efficiency; adaptation co-benefits exist but are not the single biggest effect across policies using this mechanism.  
3) Edge cases applied: If “reforestation” were implemented primarily for hazard reduction (e.g., slope stabilization) with negligible net carbon gains, classification could drift toward Adaptation; however, the canonical mechanism explicitly specifies increased carbon sequestration, anchoring the dominant effect as sink enhancement.  
4) Applicability to ALL instances sharing this mechanism: Any policy whose core mechanism is natural reforestation → increased carbon sequestration has the same primary pathway of enhancing carbon sinks via ecosystem regrowth.  
5) Secondary subtype deferred: Specifics such as durability, leakage, species mix, fire risk, or biodiversity/adaptation co-benefits require policy-level evidence and are not assigned here.",0.93,"Potential reversibility (fire, pests, drought), additionality/baseline uncertainty, land-use competition, and leakage can reduce net sequestration; some projects may prioritize local adaptation outcomes, but the stated mechanism is explicitly carbon sequestration increase.",planning-strategy,direct,direct,“natural reforestation”,Biodiversity habitat improvement; erosion control; watershed regulation/water quality; heat mitigation/local cooling,"Instrument type is ambiguous because no implementation mechanism is stated (could be an incentive program, protected-area regulation, or public restoration investment); classified as planning-strategy by default based on generic phrasing.",[],True,matched token: 'forest',True,no typology code,"Italy implements programmes and initiatives in agriculture and forestry to increase and better manage forest areas/woodlands, reclaim abandoned territories, and protect areas at instability or desertification risk to increase carbon sinks.",,,,,
