cluster_id,cluster_type,role,sector,section_header,policy_statement,parent_statement,parent_row_type,verbatim_text,extraction_rationale,location,location_vulnerability_context,row_key,source_bundle_key,is_atomized_row,is_decomposed,canonical_mechanism,mechanism_description,typology_code,typology_confidence,typology_evidence_quote,secondary_categories,gate_demoted_reason,classification_schema_version,secondary_profile,climate_screen,is_financial_instrument,primary_category,primary_causal_pathway,causal_mechanism_detail,dominant_pathway_test,mechanism_classification_reasoning,mechanism_confidence,mechanism_edge_case_notes,instrument_type,instrument_directness,climate_relevance,key_indicators,co_benefits,instance_edge_case_notes,language_violations,primary_gate_passed,primary_gate_reason,secondary_gate_passed,secondary_gate_reason,parent_policy_name,rescue_disposition,rescue_reasoning,rescue_confidence,primary_gate_rescued,dropped_by_climate_rescue
2,parent_with_subs,sub,buildings,AGREEMENT PROTOCOL OF THE CONFERENCE OF THE PRESIDENTS OF REGIONAL GOVERNMENTS AND OF AUTONOMOUS PROVINCES FOR THE COORDINATION OF POLICIES AIMED AT REDUCING EMISSIONS OF GREENHOUSE GASES INTO THE ATMOSPHERE,"The Environmental Energy Plan will include rationalisation of electricity production and rationalisation of energy consumption, including potential introduction of energy certification for the civil sector.","Agreement Protocol (Turin, 5 June 2001) by the Conference of Presidents of Regional Governments and Autonomous Provinces coordinates policies aimed at reducing greenhouse gas emissions, including preparing an Environmental Energy Plan by end-2002.",standalone parent policy,"that an Environmental Energy Plan shall be drawn up by the end of the year 2002... and favouring:

rationalisation of the production of electricity;

rationalisation of energy consumption, in particular with regard to the civil sector, with measures eventually to include the introduction of energy certification;",Specifies concrete elements to be included in the plan; includes an explicit mechanism (energy certification) though framed as possible ('eventually').,Perugia_Italy,No vulnerability context provided,Perugia_Italy::3509ee91a9a55cd3d8fe1231,Perugia_Italy::3509ee91a9a55cd3d8fe1231,False,False,energy_certification_program → market_signal_for_efficiency,The plan promotes energy certification for the civil sector to provide information that encourages energy efficiency improvements and lowers energy use.,None,0.0,None,None,evidence_quote not substring-grounded in source,guide_secondary_typology_v1,policy_text_evidence_gated,explicit_parent,no,Mitigation,Information disclosure/market signal → building efficiency actions → ↓ final energy demand → ↓ fossil energy combustion → ↓ GHG emissions,"(1) Changes: Building owners/managers (and the real-estate market) receive standardized energy performance information (labels/certificates), influencing purchase/lease decisions and prompting retrofits, equipment upgrades, and improved operations. (2) Mediating process: Improved transparency corrects information asymmetry and shifts market preferences toward efficient buildings, increasing adoption of efficiency measures and reducing wasted energy. (3) Outcome: Lower electricity and heating/cooling fuel use, yielding reduced CO₂ (and associated) emissions from energy generation and onsite combustion.",The single biggest climate-relevant effect is reduced building energy consumption leading to lower upstream fossil-fuel combustion and thus lower GHG emissions.,"1) Dominant causal pathway: information/labeling → behavior and investment shifts → reduced energy use → reduced GHG emissions.  
2) Why this primary over alternatives: While certification can also support cost savings (resource efficiency framing) or comfort/resilience co-benefits, the dominant climate-relevant effect across such programs is emissions mitigation via reduced energy demand.  
3) Edge cases applied: If certification is used mainly for adaptation (e.g., heat-risk labels) or purely administrative tracking without driving efficiency actions, the mitigation effect could be weaker—but the stated mechanism explicitly targets efficiency improvements and lower energy use.  
4) Applicability to ALL instances: Any policy fitting “energy certification program → market signal for efficiency” relies on performance information to drive efficiency actions; the primary climate impact is therefore mitigation through reduced energy consumption and emissions.  
5) Secondary subtype assignment deferred: Whether impacts occur via electricity vs. heating fuels, operational improvements vs. capital retrofits, and the magnitude of realized savings depends on policy design and local grid/fuel mix, and should be assessed at the individual policy level.",0.86,"If the certification is purely informational with no disclosure at transaction points, weak compliance, or no market uptake, realized mitigation may be limited; conversely, if paired with mandatory upgrades triggered by poor ratings, the mechanism blends into direct efficiency standards (still mitigation).",information-disclosure,enabling,direct,“Environmental Energy Plan shall be drawn up”; “rationalisation of energy consumption”; “civil sector”; “introduction of energy certification”; “rationalisation of the production of electricity”,Reduced energy bills/cost savings; improved indoor comfort and air quality (via efficiency improvements); potential energy security benefits from lower demand,"“Rationalisation” of electricity production/energy consumption could encompass regulatory standards or investments, but the text only specifies a potential instrument (“energy certification”), so classification is anchored to information disclosure; “eventually to include” indicates it may be planned rather than already implemented.",[],True,rescued_by_f1_5,True,no typology code,"Agreement Protocol (Turin, 5 June 2001) by the Conference of Presidents of Regional Governments and Autonomous Provinces coordinates policies aimed at reducing greenhouse gas emissions, including preparing an Environmental Energy Plan by end-2002.",keep,"Although the excerpt lacks an explicit mitigation outcome token, the measures described are inherently energy-efficiency/electricity-system measures that function as mitigation. Verbatim text: 'rationalisation of the production of electricity' and 'rationalisation of energy consumption... [including] the introduction of energy certification' indicate improving efficiency and managing demand. Parent context (climate_screen=explicit_parent) explicitly states the protocol 'coordinates policies aimed at reducing greenhouse gas emissions,' making the sub-statement mitigation-linked. Thus the gate failure ('no Mitigation outcome token found') reflects overly strict token matching, not lack of climate relevance.",0.86,True,False
2,parent_with_subs,sub,cross_sector,AGREEMENT PROTOCOL OF THE CONFERENCE OF THE PRESIDENTS OF REGIONAL GOVERNMENTS AND OF AUTONOMOUS PROVINCES FOR THE COORDINATION OF POLICIES AIMED AT REDUCING EMISSIONS OF GREENHOUSE GASES INTO THE ATMOSPHERE,"The Environmental Energy Plan will link planning sectors for sustainability and promote eco-efficiency in the production sector, technological innovation support policies, and macroeconomic tools (taxation, fees, incentives), including international cooperation.","Agreement Protocol (Turin, 5 June 2001) by the Conference of Presidents of Regional Governments and Autonomous Provinces coordinates policies aimed at reducing greenhouse gas emissions, including preparing an Environmental Energy Plan by end-2002.",standalone parent policy,"that an Environmental Energy Plan shall be drawn up by the end of the year 2002... and favouring:

the linking of different planning sectors in the interests of overall sustainability;

optimisation of the role of policies for the support of technological innovation, as well as macroeconomic tools regarding taxation, fees and incentives;

promotion in the production sector of eco-efficiency and international cooperation.","List of specified plan priorities and instruments (innovation support, fiscal tools, eco-efficiency, international cooperation).",Perugia_Italy,No vulnerability context provided,Perugia_Italy::20a7d6f1a3133f86643c85b5,Perugia_Italy::20a7d6f1a3133f86643c85b5,False,False,economic_instruments_and_innovation_support → emissions_reduction_pathway,"The plan is drawn up to link planning sectors and use innovation support and tools like taxation, fees, and incentives to promote eco-efficiency in production, supporting an emissions-reduction pathway.",None,0.0,None,None,"evidence quote missing one of: [ghg, greenhouse gas, greenhouse gases, emission, ...]; evidence quote missing secondary subtype token: [hazard, exposure, vulnerab, resilien, ...]",guide_secondary_typology_v1,policy_text_evidence_gated,explicit_parent,yes,Mitigation,Economic/innovation policy → technology + behavior shift → ↓ fossil energy use/process emissions → ↓ GHG emissions → ↓ atmospheric forcing,"1) Change in human activity/system: Governments alter market signals and innovation conditions (e.g., taxes, fees, subsidies, grants, coordinated planning) so firms and households adopt cleaner production processes, energy sources, and efficiency measures.  
2) Mediating physical/ecological process: Reduced combustion of fossil fuels and reduced high-emitting industrial/process activities (and/or substitution toward low/zero-carbon energy and materials) lowers CO₂, CH₄, N₂O and other GHG release.  
3) Climate-relevant outcome: Net reduction (or avoided growth) of economy-wide GHG emissions, contributing to mitigation.","The single biggest climate-relevant effect of policies using this mechanism is lowering GHG emissions by shifting investment, technologies, and behaviors via pricing, incentives, and innovation support.","1) Dominant causal pathway: Economic instruments and innovation support primarily operate by changing prices/returns and reducing technology costs, leading to lower-emission energy and production choices and thus ↓ GHG emissions.  
2) Why this primary over alternatives: While “eco-efficiency” can be framed as resource efficiency, the stated endpoint is an “emissions-reduction pathway”; the largest climate effect is direct mitigation through reduced emissions.  
3) Edge cases applied: If instruments target non-climate pollutants or general productivity with no emissions linkage, classification could drift toward Resource Efficiency; if aimed at resilience finance, it could be Adaptation. But for this canonical mechanism, the unifying intent and effect is emissions reduction.  
4) Applicability to ALL instances: Any policy fitting “economic instruments + innovation support → emissions-reduction pathway” has mitigation as its dominant climate outcome, regardless of sector targeted (industry, buildings, transport, etc.).  
5) Secondary subtype deferred: Specific sub-types (e.g., industrial decarbonization vs transport demand management vs clean energy innovation) depend on policy-level details and are not assigned at the mechanism level.",0.82,Some implementations may primarily deliver energy/material productivity gains (Resource Efficiency) or broader environmental benefits; classification remains Mitigation here because the canonical mechanism explicitly centers on emissions-reduction outcomes via pricing/incentives and innovation support.,incentive-program,enabling,direct,"“Environmental Energy Plan”; “linking of different planning sectors… overall sustainability”; “support of technological innovation”; “macroeconomic tools regarding taxation, fees and incentives”; “promotion… of eco-efficiency”",Air quality/public health improvements; industrial competitiveness/innovation spillovers; resource efficiency/cost savings,"Instrument bundle is mentioned (planning/coordination + taxation/fees/incentives). If one single instrument type must be chosen, “incentive-program” best matches the emphasized use of incentives alongside fiscal tools; however, “pricing-mechanism” could also fit due to “taxation, fees”.",[],True,matched token: 'emission',True,no typology code,"Agreement Protocol (Turin, 5 June 2001) by the Conference of Presidents of Regional Governments and Autonomous Provinces coordinates policies aimed at reducing greenhouse gas emissions, including preparing an Environmental Energy Plan by end-2002.",,,,,
3,parent_with_subs,parent,energy_supply,"4.2.1 Measures implemented in the electric sector, including renewable sources","Enel voluntary agreement aims to reduce emissions by 22 MtCO2 by 2006 compared to 1990 through power plant efficiency/CC conversion, renewables obligation, distribution leak reductions, and DSM measures.",,standalone parent policy,"The voluntary agreement with Enel has the objective of reducing emissions of 22 MtCO2 by 2006, compared to the emissions of 1990, by:
- increasing the efficiency of existing plants and converting 15.000 MW to combined-cycle plants...
- increasing the use of renewable sources (2% obligation)...
- reducing leaks from distribution networks...
- DSM measures: (Demand Side Management)...",Named agreement with quantified target and multiple explicit sub-actions listed.,Perugia_Italy,No vulnerability context provided,Perugia_Italy::ca0e336f4a50ffc60a250eea,Perugia_Italy::ca0e336f4a50ffc60a250eea,False,False,utility_decarbonization_and_efficiency_program → grid_emissions_reduction,"A voluntary agreement with the utility increases power-plant efficiency and combined-cycle conversion, increases renewable energy use, reduces distribution leaks, and implements demand-side management, which together reduce grid emissions.",None,0.0,None,None,"evidence quote missing one of: [ghg, greenhouse gas, greenhouse gases, emission, ...]; evidence quote missing secondary subtype token: [hazard, exposure, vulnerab, resilien, ...]",guide_secondary_typology_v1,policy_text_evidence_gated,explicit_self,no,Mitigation,Electricity supply & demand interventions → ↓ fossil fuel combustion / ↓ grid emissions intensity (tCO2e/kWh) → ↓ GHG emissions → ↓ atmospheric forcing,"(1) Human activity/system changed: Utility operations and planning (power-plant retrofit and combined-cycle conversion, renewable energy procurement/obligations, distribution system loss/leak reduction, and customer demand-side management to reduce or shift electricity use).  
(2) Mediating physical process: Improved conversion efficiency reduces fuel burned per unit electricity; renewables displace fossil generation; reduced technical losses/leaks mean less generation set for the same delivered electricity; DSM reduces or shifts load, avoiding marginal fossil generation.  
(3) Climate-relevant outcome: Lower CO2 (and potentially CH4/N2O) emissions from electricity generation and delivery, yielding lower grid-average and marginal emissions and reduced total sectoral GHG emissions.","The single biggest climate-relevant effect is reduced power-sector GHG emissions by lowering grid emissions intensity and total fossil generation through efficiency, renewables, loss reduction, and demand-side management.","1) Dominant causal pathway: Actions by the utility reduce fossil fuel combustion and/or the carbon intensity of delivered electricity, directly reducing GHG emissions.  
2) Why this primary over alternatives: While “efficiency” could be framed as Resource Efficiency, the dominant effect across this bundled mechanism is decarbonization of the grid (supply-side fuel/emissions changes plus avoided generation), which is unequivocally mitigation.  
3) Edge cases applied: If a program focused only on non-climate reliability/resilience, it could be adaptation; if it only reduced energy use without explicit emissions impact it could be resource efficiency. Here, the mechanism explicitly targets emissions reductions via generation mix and plant efficiency, so mitigation dominates.  
4) Confirm applies to ALL instances sharing this mechanism: Any policy whose mechanism is “utility decarbonization and efficiency program → grid emissions reduction” has, by definition, its primary climate effect through reducing grid GHG emissions.  
5) Secondary subtype assignment deferred: Whether the specific policy is best subtyped as renewable deployment, power-plant efficiency, T&D loss reduction, or DSM depends on policy-level evidence and is not assigned here.",0.93,"If “distribution leaks” refers to methane leaks from gas distribution (rather than electric T&D losses), the policy also yields direct CH4 mitigation; this strengthens (not changes) the Mitigation classification. If implemented purely as energy savings without measurable grid decarbonization (rare for this mechanism definition), Resource Efficiency could be a competing framing.",target-setting,direct,direct,"“voluntary agreement with Enel”; “objective of reducing emissions of 22 MtCO2 by 2006, compared to … 1990”; “increasing the efficiency of existing plants”; “converting 15.000 MW to combined-cycle plants”; “increasing the use of renewable sources (2% obligation)”; “reducing leaks from distribution networks”; “DSM measures (Demand Side Management)”",Improved local air quality (via reduced fossil generation); improved energy security/fuel savings; potentially improved grid reliability from reduced distribution losses.,"The “2% obligation” element resembles a regulatory mandate/renewable portfolio requirement, but because it is presented within an overarching voluntary agreement with a quantified emissions goal, the dominant instrument is classified as target-setting.",['required'],True,matched token: 'emission',True,no typology code,,,,,,
3,parent_with_subs,sub,energy_supply,"4.2.1 Measures implemented in the electric sector, including renewable sources","Increase efficiency of existing plants and convert 15,000 MW to combined-cycle plants under the Enel voluntary agreement to cut CO2 emissions.","Enel voluntary agreement aims to reduce emissions by 22 MtCO2 by 2006 compared to 1990 through power plant efficiency/CC conversion, renewables obligation, distribution leak reductions, and DSM measures.",standalone parent policy,"- increasing the efficiency of existing plants and converting 15.000 MW to combined-cycle plants; of the reduced 12 MtCO2, only 10 MtCO2 are to be attributed to the measures implemented after the Kyoto Protocol;","Specific intervention (15,000 MW conversion) explicitly listed as part of the agreement.",Perugia_Italy,No vulnerability context provided,Perugia_Italy::7c6863d66a276e3e0b604b29,Perugia_Italy::7c6863d66a276e3e0b604b29,False,False,power_plant_efficiency_and_combined_cycle_conversion → electricity_generation_emissions_reduction,"It increases the efficiency of existing power plants and converts generation to combined-cycle units, reducing CO2 emissions per unit of electricity produced.",None,0.0,None,None,"evidence quote missing one of: [ghg, greenhouse gas, greenhouse gases, emission, ...]; evidence quote missing secondary subtype token: [hazard, exposure, vulnerab, resilien, ...]",guide_secondary_typology_v1,policy_text_evidence_gated,explicit_self,no,Mitigation,Power generation technology/operations upgrade → ↓ fuel input per kWh (↓ heat rate) → ↓ combustion CO2 per kWh → ↓ total electricity-sector GHG emissions → ↓ atmospheric forcing,"1) Changed human activity/system: Utilities retrofit or repower existing thermal power plants (e.g., turbine upgrades, boiler improvements, controls) and/or convert simple-cycle or older steam units to combined-cycle configurations to raise thermal efficiency.  
2) Mediating physical process: Higher thermodynamic efficiency means less fossil fuel is combusted for the same electrical output; combined-cycle captures more useful work by using gas-turbine exhaust heat to produce additional steam power.  
3) Climate-relevant outcome: Reduced CO2 (and often reduced CH4 upstream per kWh and reduced co-pollutants) emitted per MWh, typically reducing absolute power-sector GHG emissions when electricity output is held constant or when efficiency gains are not fully offset by increased generation (rebound).","The single biggest climate-relevant effect is reducing CO2 emissions per unit of electricity generated by improving power-plant conversion efficiency (often via combined-cycle upgrades), thereby lowering total power-sector GHG emissions.","1) Dominant causal pathway: Plant efficiency upgrades and combined-cycle conversion reduce fuel combusted per kWh, directly reducing CO2 emissions from electricity generation.  
2) Why this primary over alternatives: While “efficiency” can resemble resource efficiency, the dominant and intended climate effect here is explicitly lower GHG emissions from fossil generation (an emissions-mitigation pathway), not merely reduced energy use in end-use sectors; it is not about reducing hazard exposure (adaptation) nor ecosystem carbon sinks (nature-based).  
3) Edge cases applied: If a conversion includes significant fuel switching (e.g., coal-to-gas) or adds CCS, those are distinct mechanisms; if efficiency gains lead to more dispatch and partially offset reductions (rebound), the primary intended pathway remains emissions mitigation via lower emissions intensity.  
4) Confirm applies to ALL instances sharing this mechanism: Any policy that improves existing plant efficiency or converts to combined-cycle units does so by lowering heat rate and emissions intensity of generation, making mitigation the consistent primary category.  
5) Secondary subtype assignment deferred: Any further subtype (e.g., “power generation efficiency,” “repowering,” “gas combined-cycle modernization”) depends on policy-specific evidence and is deferred to policy-level coding.",0.93,"Potential ambiguity if the policy is framed solely as “energy efficiency” without explicit emissions intent, but for power-plant efficiency/combined-cycle conversion the dominant climate effect is almost always reduced combustion CO2 per MWh (mitigation). Rebound via increased generation could reduce net benefits but does not change the primary mechanism.",target-setting,direct,direct,“Enel voluntary agreement”; “increasing the efficiency of existing plants”; “converting 15.000 MW to combined-cycle plants”; “reduced 12 MtCO2”; “after the Kyoto Protocol”,"Potential air-pollution reductions (NOx/SO2/PM) and fuel-cost savings from higher efficiency, but not stated as objectives.","Voluntary agreement could also be treated as a negotiated/voluntary program; however, the presence of quantified CO2 reductions and implied commitments makes “target-setting” the closest instrument type among the allowed options.",[],True,matched token: 'emission',True,no typology code,"Enel voluntary agreement aims to reduce emissions by 22 MtCO2 by 2006 compared to 1990 through power plant efficiency/CC conversion, renewables obligation, distribution leak reductions, and DSM measures.",,,,,
